community_area,disposable_income,discretionary_consumption,accessibility,decision_rationale,vote,rank1,rank2,rank3,rank4,rank5
Hyde Park,"Hyde Park has a diverse income distribution with a significant portion of the population earning less than $50,000 annually. However, there is also a substantial percentage earning over $100,000, indicating a mixed-income community.","With a notable percentage of households earning below $50,000, discretionary spending is likely limited for a significant portion of the community. The community may be sensitive to increases in transit fares and taxes.","Hyde Park has a high percentage of residents using transit (22.5%) and walking/biking (29.4%), with a significant portion of households not owning a vehicle (43.4%). This suggests a strong reliance on public transit and non-motorized modes of transportation.","Given the high reliance on public transit and the mixed-income nature of the community, policies that maintain or improve transit accessibility without significantly increasing costs are prioritized. Lower transit fares and moderate driver fees are preferred to encourage transit use and reduce congestion. A moderate sales tax is acceptable if it significantly improves transit services, as many residents depend on public transportation. The top-ranked proposals balance these considerations by offering reduced travel times and costs for transit users while maintaining reasonable tax and fee levels.","[11, 13, 10, 14, 19]",11,13,10,14,19
Woodlawn,"The median income in Woodlawn is $29,969, with a significant portion of the population (44.5%) earning less than $25,000. This indicates limited disposable income, making cost-sensitive policies more favorable.","With a high percentage of low-income households, discretionary spending is likely constrained. Policies that minimize additional financial burdens, such as lower fares and taxes, would be beneficial.","38.1% of households do not own a vehicle, and 24.3% of residents use transit. Improving transit accessibility and affordability is crucial for this community, as many rely on public transportation.","Given the high reliance on public transit and limited disposable income, policies with lower transit fares and moderate taxes are prioritized. A balance between improving transit services and minimizing financial impact is essential. Lower driving fees are less critical due to the lower car ownership rate. The selected policies aim to reduce transit costs while maintaining or slightly improving service levels, considering the community's economic constraints and reliance on public transportation.","[10, 11, 19, 20, 13]",10,11,19,20,13
South Shore,"The median income in South Shore is $39,649, with a significant portion of the population earning less than $25,000. This indicates limited disposable income, making cost-sensitive policies more favorable.","With a high percentage of households earning below $50,000, discretionary spending is likely constrained. Policies that minimize additional financial burdens are preferred to maintain essential consumption.",A significant portion of the population relies on transit (32.8%) and a notable percentage has no vehicle (37.8%). Improving transit accessibility and affordability is crucial for this community.,"Given the community's reliance on transit and limited disposable income, policies with lower transit fares and moderate taxes are prioritized. Reducing travel time is also important, but not at the expense of significantly higher costs. The community would benefit from policies that balance improved transit services with affordability. Therefore, proposals with lower fares and moderate driver fees, which can improve transit times without excessive cost increases, are preferred.","[10, 11, 19, 20, 13]",10,11,19,20,13
Chatham,"Chatham has a median income of $39,348 and a per capita income of $28,801. A significant portion of the population earns less than $50,000, indicating limited disposable income.","With 32.8% of households earning less than $25,000, discretionary spending is likely constrained. Any increase in transportation costs could significantly impact these households.",Chatham has a high percentage of residents using transit (27.3%) and a significant portion without vehicles (31.8%). Improving transit accessibility and affordability is crucial for this community.,"Given the limited disposable income and high reliance on public transit, policies that lower transit fares and maintain or slightly increase taxes and driving fees are preferred. These policies should improve transit services without significantly burdening low-income households. The focus is on reducing transit costs and improving service times, while considering the impact of taxes and driving fees on overall affordability.","[11, 10, 19, 13, 14]",11,10,19,13,14
Avalon Park,"The median income in Avalon Park is $54,139, with a significant portion of the population earning less than $50,000. This suggests that disposable income is limited for many residents, making cost-sensitive policies more favorable.","With 24% of households earning less than $25,000, a large portion of the community may prioritize essential spending over discretionary consumption. Therefore, policies that minimize additional financial burdens are preferred.","58.5% of residents drive alone, while 24.1% use transit. This indicates a reliance on both driving and public transit. Policies that improve transit times and reduce costs could benefit a significant portion of the community.","Given the community's income distribution and reliance on both driving and transit, policies that balance lower costs with improved transit times are prioritized. A lower sales tax and fare, combined with a moderate driving fee, can enhance transit services without significantly impacting disposable income. The top-ranked proposals reflect a preference for reduced transit fares and moderate driving fees to encourage transit use and reduce congestion, while keeping the sales tax manageable to avoid burdening low-income households.","[10, 11, 19, 20, 13]",10,11,19,20,13
South Chicago,"The median income in South Chicago is $43,936, with a significant portion of the population earning less than $25,000. This indicates limited disposable income, making cost-sensitive policies more favorable.","With a per capita income of $22,912, residents have limited discretionary spending. High transit fares or driver fees could significantly impact their ability to spend on other necessities.","31.6% of households have no vehicle, and 23.7% of residents use transit. Improving transit accessibility and affordability is crucial for this community, as a significant portion relies on public transportation.","Given the community's limited disposable income and reliance on public transit, policies with lower transit fares and moderate driver fees are prioritized. A lower sales tax is also preferred to minimize the impact on discretionary spending. The goal is to enhance transit accessibility while keeping costs manageable for residents. Policies that reduce travel time for both transit and driving are also considered to improve overall accessibility and quality of life.","[10, 11, 19, 20, 13]",10,11,19,20,13
Burnside,"The median income in Burnside is $46,711, with a significant portion of households earning less than $50,000. This suggests limited disposable income, making cost-sensitive policies more favorable.","With a per capita income of $28,605, residents have limited discretionary spending. High transit fares or driver fees could significantly impact their ability to spend on other necessities.",Burnside has a high percentage of residents using transit (27.6%) and a significant portion without vehicles (38.7%). Improving transit accessibility and affordability is crucial for this community.,"Given the community's reliance on transit and limited disposable income, policies with lower transit fares and moderate driver fees are prioritized. A lower sales tax is also preferred to minimize the impact on discretionary spending. The selected policies aim to balance improved transit service with affordability, considering the community's economic constraints and transportation needs.","[10, 11, 19, 20, 13]",10,11,19,20,13
Calumet Heights,"The median income in Calumet Heights is $68,436, with a per capita income of $39,867. A significant portion of the population earns less than $50,000, indicating a moderate level of disposable income.","With a diverse income distribution, a substantial portion of the community may be sensitive to increases in transportation costs, as these could impact their ability to spend on other necessities and discretionary items.","52.3% of residents drive alone, while 19.5% use transit. A significant portion of the community relies on cars, but a notable percentage also depends on public transit. Accessibility improvements in transit could benefit a large segment of the population.","Given the moderate disposable income and reliance on both driving and transit, the community would benefit from policies that balance cost and service improvements. Lower fares and moderate driver fees could encourage transit use without overly burdening drivers. A lower sales tax would help maintain discretionary spending. Therefore, proposals with lower fares and moderate driver fees, which also reduce travel times, are prioritized.","[10, 11, 19, 20, 13]",10,11,19,20,13
Roseland,"The median income in Roseland is $49,808, with a significant portion of the population earning less than $50,000. This suggests limited disposable income, making cost-sensitive policies more favorable.","With a per capita income of $24,754, residents have limited discretionary spending. High transit fares or driver fees could significantly impact their ability to spend on other necessities.","25.9% of households have no vehicle, and 20.1% of residents use transit to commute. Improving transit accessibility and affordability is crucial for this community.","Given the limited disposable income and high reliance on transit, policies with lower transit fares and moderate driver fees are prioritized. A lower sales tax is also preferred to minimize the impact on discretionary consumption. The goal is to enhance transit accessibility while keeping costs manageable for residents. Policies that reduce travel time for both transit and driving are also considered to improve overall accessibility.","[10, 11, 19, 20, 13]",10,11,19,20,13
Pullman,"The median income in Pullman is $54,755, with a significant portion of the population earning less than $50,000. This suggests that disposable income is limited for many residents, making cost-sensitive policies more favorable.","With a per capita income of $32,327, residents have limited discretionary spending. High transit fares or driver fees could significantly impact their ability to spend on other necessities.","64% of residents drive alone, while 17.6% use transit. This indicates a reliance on both driving and public transit, but with a higher dependency on personal vehicles. Policies that balance improvements in transit with reasonable costs for drivers are crucial.","Given the income distribution and transportation preferences, policies that offer lower transit fares and moderate driver fees are prioritized to ensure affordability and accessibility. A lower sales tax is also preferred to minimize the impact on discretionary spending. The top-ranked policies aim to reduce travel times for both transit and driving, while keeping costs manageable for residents.","[10, 11, 19, 20, 13]",10,11,19,20,13
South Deering,"The median income in South Deering is $34,814, with a significant portion of the population earning less than $25,000. This indicates limited disposable income, making cost-sensitive policies more favorable.","With a high percentage of households earning less than $25,000, discretionary spending is likely constrained. Policies that minimize additional financial burdens, such as lower fares and taxes, are preferable.","A significant portion of the community relies on driving (57.2%) and transit (23.7%). Improving transit times and maintaining affordable fares are crucial for accessibility, especially for those without vehicles (24%).","Given the community's limited disposable income and reliance on both driving and transit, the focus is on minimizing costs while improving transit efficiency. Lower fares and moderate taxes are prioritized to ensure affordability. Driver fees are considered to reduce congestion and improve transit times, but they must be balanced against the community's financial constraints. The selected policies aim to enhance transit accessibility and affordability, while also considering the impact on driving costs.","[10, 11, 13, 14, 19]",10,11,13,14,19
East Side,"The median household income in East Side is $61,898, with a per capita income of $25,646. A significant portion of the population earns between $25,000 and $49,999, indicating moderate disposable income levels.","With 26.7% of households earning between $25,000 and $49,999, and 15.1% earning less than $25,000, a substantial portion of the community may be sensitive to increases in transportation costs, which could impact their discretionary spending on other goods and services.","The majority of residents (68.4%) drive alone, with only 7.7% using transit. The mean commute time is 36.4 minutes, suggesting that improvements in transit times could benefit the community, but the reliance on cars indicates that driver fees could be burdensome.","Given the community's reliance on driving and moderate income levels, policies that balance lower transit fares and moderate driver fees with reasonable travel times are preferred. A lower sales tax is also favorable to minimize the impact on discretionary spending. The goal is to improve transit accessibility without significantly increasing costs for drivers, who make up the majority of commuters.","[10, 13, 19, 4, 22]",10,13,19,4,22
West Pullman,"The median income in West Pullman is $46,861, with a significant portion of the population earning less than $50,000. This suggests limited disposable income, making cost-sensitive policies more favorable.","With a per capita income of $24,916, residents have limited discretionary spending. High transit fares or driver fees could significantly impact their ability to spend on other necessities.","63.1% of residents drive alone, while 12% use transit. Improving transit times and affordability could benefit those without vehicles (23.4%) and those who rely on public transportation.","Given the community's income constraints and reliance on both driving and transit, policies that balance lower costs with improved transit times are prioritized. Lower fares and moderate driver fees are preferred to encourage transit use without overly burdening drivers. A moderate sales tax is acceptable if it significantly improves transit services, as it supports the 12% of residents who use transit and could encourage more to switch from driving, reducing congestion and emissions.","[10, 13, 19, 22, 11]",10,13,19,22,11
Riverdale,"Riverdale has a median income of $41,144 and a per capita income of $19,721. A significant portion of the population earns less than $25,000, indicating limited disposable income.","With a high percentage of households earning less than $50,000, discretionary spending is likely constrained. Any increase in transportation costs could significantly impact the community's ability to spend on other necessities.","67.9% of residents drive alone, while 12.9% use transit. The mean commute time is 33.8 minutes. Improving transit times could benefit those without vehicles and reduce overall travel time for the community.","Given the limited disposable income, policies with lower fares and taxes are preferred to minimize financial strain. However, improving transit times is also crucial for accessibility. Balancing these factors, proposals with moderate taxes and fares, but significant improvements in transit times, are prioritized. The community's high reliance on driving suggests that moderate driver fees could be acceptable if they lead to better transit services and reduced congestion.","[11, 14, 13, 10, 19]",11,14,13,10,19
Hegewisch,"The median income in Hegewisch is $58,647, with a per capita income of $31,457. A significant portion of the population earns less than $50,000, indicating limited disposable income for many households.","With 27.6% of households earning less than $25,000, discretionary spending is likely constrained. The community may be sensitive to increases in transit fares and taxes that reduce disposable income.","65.2% of residents drive alone, while only 10.8% use transit. This suggests a reliance on cars, but also a need to improve transit to make it a more viable option. Car ownership is high, with 87.4% of households owning at least one vehicle.","Given the community's reliance on driving and limited disposable income, policies that balance lower transit fares and moderate driver fees with minimal tax increases are preferred. Reducing travel time for both modes is important, but affordability is crucial. The community would benefit from policies that encourage transit use without significantly increasing costs for drivers. Therefore, proposals with lower fares and moderate driver fees, while maintaining or slightly increasing taxes, are prioritized to improve transit services and reduce congestion.","[10, 13, 19, 22, 14]",10,13,19,22,14
Garfield Ridge,"Garfield Ridge has a relatively high median income of $90,374 and a per capita income of $37,983. A significant portion of households earn over $100,000, indicating a relatively high disposable income.","With a high median income, residents likely have more discretionary spending capacity. However, a notable portion of the population earns less than $50,000, which means that affordability of transit and driving fees is still a concern for a segment of the community.","The majority of residents drive alone (71.2%), with only 7.6% using transit. This suggests that car travel is the dominant mode of transportation, and any policy that increases driving costs could impact a large portion of the community. However, improving transit could benefit those who rely on it and potentially reduce congestion.","Given the high car ownership and preference for driving, policies that significantly increase driving costs are less favorable. However, improving transit times and affordability is also important for the minority who rely on it. Balancing these factors, the community would benefit from policies that moderately increase transit funding without drastically increasing driving costs. Lower sales tax rates are preferred to maintain discretionary spending, while moderate driving fees could help improve transit without overly burdening drivers. The selected policies aim to improve transit times and maintain reasonable costs for both driving and transit.","[10, 13, 19, 4, 22]",10,13,19,4,22
Archer Heights,"The community has a significant portion of households earning less than $50,000, with 46.3% of households falling into this category. This suggests a moderate to low disposable income level, which means that any increase in transportation costs could significantly impact household budgets.","Given the income distribution, a large portion of the community's income is likely allocated to essential expenses, leaving limited room for discretionary spending. Therefore, policies that minimize additional costs are preferable.","With 58.7% of residents driving alone and 13.1% using transit, both modes of transportation are important. However, a significant portion of the community relies on cars, so policies that reduce driving time and costs are beneficial. At the same time, improving transit times and affordability could encourage more residents to use public transportation.","The decision prioritizes policies that balance lower costs with improved transit times, considering the community's income constraints and current transportation habits. Lower fares and taxes are preferred to minimize financial burdens, while moderate driver fees are acceptable if they lead to significant reductions in travel time. The selected policies aim to enhance transit service quality and accessibility without imposing excessive financial strain on residents.","[10, 11, 19, 20, 13]",10,11,19,20,13
Brighton Park,"The median income in Brighton Park is $52,145, with a significant portion of households earning less than $50,000. This suggests limited disposable income, making cost-sensitive policies more favorable.","With a per capita income of $22,361, residents have limited discretionary spending. High transit fares or driver fees could significantly impact their ability to spend on other necessities.","A majority of residents drive alone (58.8%), but a notable portion (15.1%) uses transit. Improving transit times and maintaining affordability is crucial for accessibility, especially for those without vehicles (15.4%).","Given the community's income constraints and reliance on both driving and transit, policies that balance lower costs with improved transit times are prioritized. Lower fares and moderate driver fees can encourage transit use without overly burdening drivers. A lower sales tax is preferred to minimize the impact on discretionary spending. The selected policies aim to reduce travel times while keeping costs manageable for both transit users and drivers.","[10, 11, 19, 20, 13]",10,11,19,20,13
McKinley Park,"The median income in McKinley Park is $70,411, with a per capita income of $32,106. A significant portion of the population earns between $25,000 and $149,999, indicating a moderate level of disposable income.","With a diverse income distribution, a substantial portion of the community may be sensitive to increases in transit fares and driver fees, as these could impact their ability to spend on other necessities and discretionary items.","51.5% of residents drive alone, while 21.7% use transit. This suggests a reliance on both driving and public transportation. The community has a moderate level of car ownership, with 12.2% having no vehicle, indicating the importance of affordable and efficient transit options.","Given the community's moderate income levels and reliance on both driving and transit, the focus is on balancing affordability with improved transit services. Lower fares and moderate driver fees are preferred to maintain accessibility and reduce congestion. A lower sales tax is favored to minimize the impact on discretionary spending. The selected proposals aim to reduce travel times while keeping costs manageable for both drivers and transit users.","[10, 13, 19, 4, 22]",10,13,19,4,22
Bridgeport,"Bridgeport has a median income of $72,159 and a per capita income of $38,718. The income distribution shows a significant portion of the population earning less than $50,000, which suggests that affordability is a key concern for many residents.","With a diverse income range, a substantial portion of the community may be sensitive to changes in transportation costs, as these could impact their ability to spend on other necessities and discretionary items.","Bridgeport has a relatively high percentage of residents who drive alone (48.3%) and a notable portion using transit (16%). The community also has a significant number of households with no vehicle (17.8%), indicating a reliance on public transit for some residents.","Given the community's income distribution and reliance on both driving and transit, the ideal policy would balance affordability with improved transit services. Lower fares and moderate driver fees could encourage transit use without overly burdening drivers. A moderate sales tax would support transit improvements while minimizing the impact on discretionary spending. Therefore, proposals with lower fares, moderate driver fees, and moderate sales taxes are prioritized to enhance transit accessibility and affordability.","[10, 13, 19, 22, 14]",10,13,19,22,14
New City,"The median income in New City is $40,959, with a significant portion of the population earning less than $25,000. This suggests limited disposable income, making cost-sensitive policies more favorable.","With a per capita income of $21,622, residents have limited discretionary spending. High transit fares or driver fees could significantly impact their ability to spend on other necessities.","A large portion of the community relies on driving (53.7%) and transit (17.9%). Improving transit times and maintaining affordable fares are crucial for accessibility, especially for those without vehicles (24.5%).","Given the community's income constraints and reliance on both driving and transit, policies that balance lower costs with improved transit times are prioritized. Lower fares and moderate driver fees can encourage transit use, reduce congestion, and improve accessibility without overly burdening residents financially. A moderate sales tax is acceptable if it significantly enhances transit services, as long as it doesn't disproportionately affect low-income households.","[11, 10, 19, 13, 14]",11,10,19,13,14
