community_area,disposable_income,discretionary_consumption,accessibility,decision_rationale,vote,rank1,rank2,rank3,rank4,rank5
Rogers Park,"Rogers Park has a median income of $57,591 and a per capita income of $36,162. A significant portion of the population earns less than $50,000, indicating limited disposable income for many residents.","With 44.8% of households earning less than $50,000, discretionary spending is likely constrained. Any increase in transportation costs could significantly impact these households.",Rogers Park has a high reliance on public transit (28.1%) and a significant portion of households without a vehicle (37.2%). Accessibility to affordable and efficient transit is crucial for the community.,"Given the high reliance on public transit and limited disposable income, policies that minimize fare increases while improving transit efficiency are prioritized. A moderate sales tax is acceptable if it significantly improves transit times, as this benefits a large portion of the community. Driver fees are less impactful due to lower car ownership, but they can help reduce congestion and improve transit times. The selected policies aim to balance affordability with improved transit service, considering the community's economic constraints and transportation needs.","[11, 14, 13, 10, 19]",11,14,13,10,19
West Ridge,"West Ridge has a median income of $68,091 and a per capita income of $32,132. The income distribution shows a significant portion of the population earning less than $50,000, indicating a need for affordable transportation options.","With a diverse income range, a substantial portion of the community may be sensitive to increases in transportation costs, which could impact their ability to spend on other necessities and discretionary items.",The community has a high percentage of residents who drive alone (59.2%) and a smaller percentage using transit (12.5%). This suggests a need for policies that improve transit accessibility and affordability to encourage more transit use and reduce car dependency.,"Given the community's income distribution and current transportation habits, the focus is on balancing affordability with improved transit services. Lower fares and moderate driver fees can encourage transit use without significantly impacting disposable income. A moderate sales tax is acceptable if it leads to better transit services, as long as it doesn't overly burden lower-income households. The selected policies aim to reduce travel times and costs for both drivers and transit users, while also considering the environmental benefits of reduced congestion.","[11, 14, 13, 10, 19]",11,14,13,10,19
Uptown,"Uptown has a median income of $66,871 and a per capita income of $49,783. A significant portion of the population earns less than $50,000, indicating a need to consider affordability in transportation costs.","With a diverse income distribution, a substantial portion of the community may be sensitive to changes in transportation costs, especially those in lower income brackets. The community's spending on transportation should not significantly impact their ability to afford other necessities.","Uptown has a high percentage of residents using transit (34.9%) and a significant number without vehicles (42.1%). This suggests that transit accessibility is crucial, and improvements in transit services could benefit a large portion of the community.","Given the high reliance on transit and the need for affordability, proposals with lower transit fares and moderate taxes are prioritized. Proposals that improve transit times without significantly increasing costs are favored. The community's high transit usage and lower vehicle ownership suggest that improving transit services while keeping costs low is essential. Therefore, proposals with lower fares and moderate driver fees, which can improve transit times and reduce congestion, are preferred.","[10, 11, 13, 14, 19]",10,11,13,14,19
Lincoln Square,"Lincoln Square has a relatively high median income of $90,569 and a per capita income of $57,351, indicating a community with a good level of disposable income. A significant portion of the population earns over $100,000, which suggests that the community can absorb moderate increases in taxes or fees without significant hardship.","With a high percentage of households earning over $100,000, discretionary consumption is likely robust. However, a portion of the community still earns less than $50,000, so policies should consider affordability for lower-income residents.","Lincoln Square has a diverse mode of transportation usage, with 26% using transit and 39.1% driving alone. The community has a relatively high percentage of households with no vehicle (21.6%), indicating a reliance on public transit. Therefore, improving transit times and maintaining affordable fares is crucial.","Given the high reliance on transit and the community's income distribution, policies that improve transit times while keeping fares affordable are prioritized. A moderate sales tax is acceptable due to the community's income levels, but driver fees should be balanced to encourage transit use without overly burdening drivers. The top-ranked proposals focus on reducing transit times and maintaining or slightly increasing fares to improve service quality, while also considering the impact on driving times and costs.","[11, 14, 13, 10, 19]",11,14,13,10,19
North Center,"North Center has a high median income of $148,585 and a per capita income of $88,926, indicating a relatively affluent community with significant disposable income.","With 49.5% of households earning $150,000 and over, the community has a high capacity for discretionary spending. However, the community may still be sensitive to changes in costs that affect their lifestyle and consumption patterns.","The community has a diverse mode of transportation usage with 38.6% driving alone and 20% using transit. The high percentage of work-from-home (29.2%) suggests flexibility in commuting needs. Car ownership is high, with 87.4% of households owning at least one vehicle, indicating a reliance on personal vehicles but also a significant portion using public transit.","Given the high income levels, the community can absorb moderate increases in taxes and fees if they result in improved transit services and reduced congestion. The preference is for policies that balance lower transit fares and moderate driver fees to encourage transit use while maintaining reasonable travel times. A lower sales tax is preferred to minimize impact on discretionary spending. The community values efficient transit options to reduce travel time and congestion, aligning with their high car ownership and transit usage.","[11, 14, 13, 10, 19]",11,14,13,10,19
Lake View,"Lake View has a relatively high median income of $100,625 and a per capita income of $87,044. A significant portion of the population earns over $150,000, indicating a strong disposable income base.","With a high income level, residents likely have substantial discretionary spending. However, a notable portion of the population earns less than $50,000, so affordability of transit and driving fees is still a consideration.","Lake View has a high percentage of residents using transit (36.9%) and a significant portion without vehicle access (39.6%). This suggests a strong reliance on public transportation, making transit accessibility and affordability crucial.","Given the high reliance on public transit and the community's income distribution, policies that improve transit times and maintain affordability are prioritized. A lower transit fare and moderate driver fees can encourage transit use and reduce congestion. A moderate sales tax is acceptable due to the community's higher income, which can support better transit services. The top-ranked proposals balance these factors by offering reduced transit times and reasonable costs, both for transit users and drivers.","[11, 14, 13, 10, 19]",11,14,13,10,19
Lincoln Park,"Lincoln Park has a high median household income of $134,277 and a per capita income of $109,538, indicating a relatively high level of disposable income compared to other areas.","With 44.8% of households earning $150,000 and over, residents likely have significant discretionary spending power. However, a portion of the population (11.4%) earns less than $25,000, which should be considered when evaluating fare and fee impacts.","Lincoln Park has a high percentage of residents using transit (33.4%) and a significant portion without vehicles (32.3%). This suggests a strong reliance on public transportation, making transit accessibility and affordability crucial.","Given the high reliance on transit and the community's overall high income, proposals that improve transit times and maintain reasonable costs are prioritized. A balance between transit fare, sales tax, and driving fees is essential to ensure accessibility without overly burdening lower-income residents. Proposals with lower fares and moderate taxes are preferred to support transit improvements while considering the community's financial capacity.","[11, 14, 13, 10, 19]",11,14,13,10,19
Near North Side,"The Near North Side has a high median income of $121,562 and a per capita income of $118,674, indicating a relatively affluent community with significant disposable income.","With 41.4% of households earning $150,000 and over, the community has a high capacity for discretionary spending. However, 12.3% of households earn less than $25,000, suggesting a need to consider affordability for lower-income residents.","The community has diverse transportation options with 18.9% using transit, 20.9% driving alone, and 27.6% walking or biking. A significant portion of the population (45.6%) does not own a vehicle, highlighting the importance of affordable and efficient public transit.","Given the high disposable income, the community can afford moderate increases in taxes and fees if they result in improved transit services. However, affordability for lower-income residents and those without vehicles is crucial. Proposals with lower transit fares and moderate driver fees are prioritized to encourage transit use and reduce congestion. A balance between tax rates and service improvements is essential to maintain accessibility and affordability.","[11, 13, 14, 19, 22]",11,13,14,19,22
Edison Park,"Edison Park has a relatively high median income of $120,024 and a per capita income of $57,872. A significant portion of the population earns $100,000 or more, indicating a strong disposable income base.","With a high income level, residents likely have substantial discretionary spending. However, a notable portion of the population (12.3%) earns less than $25,000, which means that affordability of transit fares and fees is still a concern for some households.","The majority of residents (69.1%) drive alone, indicating a strong reliance on personal vehicles. Only 8.4% use transit, suggesting that improvements in transit could benefit a small but significant portion of the community. Car ownership is high, with 61% owning two or more vehicles, which supports the preference for driving.","Given the high car ownership and preference for driving, policies that reduce driving time and improve transit without significantly increasing costs are preferred. A lower sales tax is favored to maintain discretionary spending. Proposals with moderate driver fees and transit fares are prioritized to balance cost and service improvements. The community's high income allows for some flexibility in accepting higher costs if they result in significant time savings.","[11, 14, 13, 10, 19]",11,14,13,10,19
Norwood Park,"Norwood Park has a relatively high median income of $107,122 and a per capita income of $49,303. A significant portion of the population earns over $150,000, indicating a strong disposable income base.","With a high median income, residents likely have more discretionary spending power. However, a notable portion of the population earns less than $50,000, so affordability of transit and driving fees is still a concern for some households.","The majority of residents drive alone (71.1%), with only 7.3% using transit. This suggests that car travel is the dominant mode of transportation, and any policy that increases driving costs could impact a large portion of the community. However, improving transit could encourage more residents to switch modes, potentially reducing congestion.","Given the high car ownership and preference for driving, policies that significantly increase driving costs may not be well-received. However, improving transit times and affordability could benefit the community by providing a viable alternative to driving. Balancing the sales tax impact with fare and fee structures is crucial to ensure that the community's discretionary spending is not overly burdened. Policies that offer moderate improvements in transit times without drastically increasing costs are preferred. Therefore, proposals with lower fares and moderate driving fees, coupled with reasonable sales tax rates, are prioritized.","[10, 13, 19, 22, 14]",10,13,19,22,14
Jefferson Park,"Jefferson Park has a relatively high median household income of $90,740 and a per capita income of $42,024, indicating a moderate to high level of disposable income.","With a significant portion of households earning over $100,000, there is a capacity for discretionary spending. However, a notable percentage of households earn less than $50,000, which suggests that affordability of transportation options is still important.","The majority of residents drive alone (61.7%), with a smaller percentage using transit (13.4%). Car ownership is high, with 89.2% of households owning at least one vehicle. This suggests that while transit improvements are beneficial, maintaining reasonable driving conditions is also crucial.","Given the high car ownership and the preference for driving, policies that balance transit improvements with reasonable driving conditions are prioritized. Lower transit fares and moderate driver fees are preferred to encourage transit use without overly burdening drivers. A moderate sales tax is acceptable given the community's income levels, as it supports transit improvements. The selected policies aim to reduce travel times for both modes while keeping costs manageable for all income levels.","[11, 14, 10, 13, 19]",11,14,10,13,19
Forest Glen,"Forest Glen has a high median income of $139,046 and a per capita income of $70,693, indicating a relatively high level of disposable income compared to other areas.","With 46.5% of households earning $150,000 and over, the community likely has significant discretionary spending power. However, a portion of the population (18.3%) earns less than $50,000, which should be considered when evaluating fare and tax impacts.","The majority of residents (57.9%) drive alone, with only 10.5% using transit. Car ownership is high, with 62.3% of households owning two or more vehicles. This suggests that policies affecting driving costs and transit improvements could influence travel behavior.","Given the high car ownership and preference for driving, policies that reduce driving time and improve transit efficiency are prioritized. The community's high income allows for some flexibility in accepting higher taxes or fees if they result in significant improvements in travel time and service quality. However, the impact on lower-income residents must be considered, so policies with lower fares are preferred. Balancing these factors, the selected policies aim to improve transit times and reduce driving congestion while considering the financial impact on residents.","[11, 14, 13, 10, 19]",11,14,13,10,19
North Park,"North Park has a median income of $74,649 and a per capita income of $37,156. A significant portion of the population earns over $100,000, indicating a relatively high disposable income, though there is also a notable percentage earning less than $25,000.","With a diverse income distribution, discretionary spending varies. The community can absorb moderate increases in costs, but lower-income households may be sensitive to higher fares and taxes.","55.6% of residents drive alone, while 17.5% use transit. The mean commute time is 34 minutes. Accessibility is crucial, and improvements in transit times could benefit a significant portion of the community.","Given the high percentage of car ownership and the significant number of residents who drive alone, policies that reduce driving time and improve transit efficiency are prioritized. Lower fares and moderate taxes are preferred to minimize the financial burden on lower-income households. Proposals that balance reduced travel times with reasonable costs are favored. The community's relatively high disposable income allows for some flexibility in supporting transit improvements through taxes and fees, but the impact on lower-income residents is a concern.","[11, 14, 13, 10, 19]",11,14,13,10,19
Albany Park,"Albany Park has a diverse income distribution with a significant portion of households earning between $25,000 and $149,999. The community has a relatively balanced income distribution, with a notable percentage of households earning above $100,000, indicating a moderate to high disposable income for many residents.","Given the income distribution, many households in Albany Park have discretionary income to spend on non-essential goods and services. However, a portion of the population earns less than $50,000, which may limit their discretionary spending. The community's spending on transportation should be balanced to ensure affordability for lower-income residents while maintaining quality services.","Albany Park has a high percentage of residents using transit (23.7%) and a significant number of households without a vehicle (19.1%). This indicates a strong reliance on public transportation. The community also has a substantial number of residents driving alone (45.5%), suggesting that both transit and driving options are important for accessibility.","Given the reliance on public transit and the need for affordable transportation options, proposals with lower transit fares and moderate driver fees are prioritized. A lower sales tax is preferred to minimize the impact on discretionary consumption. The goal is to improve transit times while keeping costs manageable for both transit users and drivers. Proposals that reduce travel time significantly for both modes are favored, as they enhance accessibility and efficiency.","[11, 14, 13, 10, 19]",11,14,13,10,19
Portage Park,"Portage Park has a median income of $85,473 and a per capita income of $38,488. A significant portion of the population earns over $100,000, indicating a relatively high disposable income compared to other areas.","With a substantial portion of the population earning over $100,000, there is likely a higher level of discretionary consumption. However, 30.8% of households earn less than $50,000, indicating a need to balance affordability for lower-income residents.","62.9% of residents drive alone, and 14% use transit. The mean commute time is 37.1 minutes, suggesting a reliance on both driving and transit. Improving transit times could benefit a significant portion of the community, but driving remains the dominant mode.","Given the high car ownership and reliance on driving, policies that reduce driving time and cost are favorable. However, improving transit times and maintaining affordability for lower-income residents is also crucial. A balance between lower fares, moderate taxes, and driver fees that encourage transit use without overly burdening drivers is ideal. The selected policies aim to reduce travel times for both modes while considering the financial impact on residents.","[10, 13, 19, 4, 22]",10,13,19,4,22
Irving Park,"Irving Park has a relatively high median income of $86,849 and a per capita income of $48,320. A significant portion of the population earns over $100,000, indicating a good level of disposable income.","With a substantial portion of the population earning over $100,000, there is likely a higher level of discretionary spending. However, 28.6% of households earn less than $50,000, which suggests that affordability is still a concern for a significant segment of the community.","49.6% of residents drive alone, and 18.5% use transit, indicating a reliance on both modes of transportation. The community has a moderate level of car ownership, with 13.9% of households having no vehicle, which suggests that transit accessibility is important.","Given the community's income distribution and transportation preferences, the focus is on balancing affordability with improved transit services. Lower fares and moderate driver fees are preferred to encourage transit use while maintaining affordability. A moderate sales tax is acceptable to support transit improvements, as the community can bear some additional tax burden. The selected proposals aim to reduce travel times and improve transit services without significantly increasing costs for lower-income residents.","[11, 14, 13, 10, 19]",11,14,13,10,19
Dunning,"Dunning has a relatively high percentage of households earning $100,000 or more (41.1%), indicating a moderate to high disposable income level. However, there is also a significant portion of the population earning less than $50,000 (29.3%), suggesting income diversity.","With a significant portion of the population in higher income brackets, discretionary consumption is likely robust. However, the presence of lower-income households means that affordability of transportation options remains important.","The majority of residents drive alone (72.1%), indicating a strong reliance on personal vehicles. Only 7.3% use transit, suggesting that current transit options may not be as accessible or convenient. Improving transit could benefit those without vehicles (6.3%) and potentially reduce congestion.","Given the high reliance on driving, policies that reduce driving time and improve transit accessibility are prioritized. Lower transit fares and moderate driver fees are preferred to encourage a shift from driving to transit, which could reduce congestion and emissions. A moderate sales tax is acceptable given the community's income levels, as it supports better transit services without overly burdening lower-income households. The selected policies aim to balance cost, travel time, and accessibility improvements.","[11, 14, 13, 10, 19]",11,14,13,10,19
Montclare,"The median income in Montclare is $69,038, with a per capita income of $33,574. A significant portion of the population earns less than $50,000, indicating a need to consider affordability in transportation costs.","With 20.3% of households earning less than $25,000, affordability is crucial. The community's spending on transportation should not significantly impact their ability to afford other necessities.","Montclare has a high rate of car ownership, with 74.9% driving alone to work. Only 4.4% use transit, suggesting that improvements in transit could benefit those without vehicles and potentially reduce congestion.","Given the high car ownership and low transit usage, policies that improve transit times and affordability are prioritized. Lower fares and moderate driver fees can encourage transit use without overly burdening drivers. A moderate sales tax is acceptable if it significantly improves transit services. The focus is on balancing costs with improved accessibility and reduced travel times.","[11, 14, 13, 10, 19]",11,14,13,10,19
Belmont Cragin,"Belmont Cragin has a diverse income distribution with a significant portion of households earning below $50,000. This suggests that affordability is a key concern for many residents.","With a large percentage of households in lower income brackets, discretionary spending is likely limited. Therefore, policies that minimize additional financial burdens are preferable.","A majority of residents drive alone, but a notable portion also uses transit. Improving transit times and affordability could benefit those who rely on public transportation, while also considering the impact on drivers.","Given the community's income distribution and reliance on both driving and transit, the ideal policy would balance affordability with improved transit services. Lower fares and moderate driver fees could encourage transit use without overly burdening drivers. A lower sales tax is preferred to minimize the impact on discretionary spending. Therefore, proposals with lower fares and moderate driver fees, combined with a lower sales tax, are prioritized.","[10, 11, 19, 20, 13]",10,11,19,20,13
