community_area,disposable_income,discretionary_consumption,accessibility,decision_rationale,vote,rank1,rank2,rank3,rank4,rank5
West Elsdon,"West Elsdon has a median household income of $64,441 and a per capita income of $27,703. A significant portion of the population earns between $25,000 and $74,999, indicating moderate disposable income levels.","With 40.5% of households earning less than $50,000, there is a need to balance transportation costs with other essential expenses. The community may be sensitive to increases in transit fares and sales taxes.","59.6% of residents drive alone, while 12.9% use transit. The mean commute time is 36.3 minutes. Improving transit times could benefit the community, but cost increases must be carefully considered due to the moderate income levels.","Given the high percentage of car ownership and driving alone, policies that reduce driving time and encourage transit use are beneficial. However, the community's moderate income levels necessitate keeping costs low. Therefore, proposals with lower fares and moderate driver fees are prioritized, as they improve transit times without significantly increasing costs. A balance between tax rates and service improvements is also considered to ensure affordability.","[10, 13, 19, 4, 22]",10,13,19,4,22
Gage Park,"The median income in Gage Park is $50,112, with a per capita income of $19,524. A significant portion of the population earns less than $50,000, indicating limited disposable income.","With a large percentage of households earning below $50,000, discretionary spending is likely constrained. Any increase in transportation costs could significantly impact the community's ability to spend on other necessities.","59.6% of residents drive alone, while 17.9% use transit. Car ownership is relatively high, but 20.5% of households have no vehicle, indicating a reliance on public transit for a portion of the community.","Given the limited disposable income and reliance on both driving and transit, policies that minimize costs while improving transit times are prioritized. Lower fares and moderate driver fees are preferred to balance affordability and service improvement. A lower sales tax is favored to minimize the impact on discretionary spending. The selected policies aim to reduce travel times for both drivers and transit users while keeping costs manageable for the community.","[10, 13, 19, 22, 11]",10,13,19,22,11
Clearing,"Clearing has a median household income of $73,778 and a per capita income of $33,089. A significant portion of the population earns between $50,000 and $149,999, indicating a moderate level of disposable income.","With a substantial portion of the population earning above $50,000, there is a reasonable level of discretionary consumption. However, the community must balance transportation costs with other living expenses.","The majority of residents (74.1%) drive alone, indicating a reliance on personal vehicles. Only 6.9% use transit, suggesting that improvements in transit could benefit a small but significant portion of the community. The mean commute time is 31.9 minutes, which is relatively high.","Given the high reliance on driving, policies that reduce driving time and costs are prioritized. However, improving transit is also important to provide alternatives and reduce congestion. A balance between low transit fares and moderate driver fees is ideal to encourage transit use without overly burdening drivers. A moderate sales tax is acceptable if it significantly improves transit services. The selected policies aim to reduce travel time for both drivers and transit users while maintaining affordability.","[13, 10, 14, 4, 19]",13,10,14,4,19
West Lawn,"The median income in West Lawn is $69,647, with a per capita income of $25,786. A significant portion of the population earns between $25,000 and $99,999, indicating moderate disposable income levels.","With 16.3% of households earning less than $25,000, affordability is a concern. The community has a balanced income distribution, but a notable portion of the population may be sensitive to increases in transportation costs.","63.4% of residents drive alone, and 18% carpool, indicating a high reliance on cars. Only 9.8% use transit, suggesting that improvements in transit could benefit a minority but significant portion of the community. Car ownership is high, with 56.3% owning two or more vehicles.","Given the community's reliance on driving and moderate income levels, policies that reduce driving time and maintain or lower transit costs are prioritized. A lower sales tax is preferred to minimize the impact on discretionary spending. The community would benefit from reduced congestion and improved transit times, but not at the expense of significantly higher costs. Therefore, proposals with moderate driver fees and lower fares are favored, balancing improved transit service with affordability.","[10, 13, 19, 4, 22]",10,13,19,4,22
Chicago Lawn,"The median income in Chicago Lawn is $43,293, with a significant portion of households earning less than $50,000. This suggests limited disposable income, making cost-sensitive policies more favorable.","With a per capita income of $20,907, residents have limited discretionary spending. High transit fares or driver fees could significantly impact their ability to spend on other necessities.","A large portion of the community relies on driving (57.8%) and carpooling (20.6%), with 14.9% using transit. Improving transit times and maintaining affordability is crucial for accessibility, especially for those without vehicles (24.3%).","Given the community's income constraints and reliance on both driving and transit, policies that balance lower costs with improved transit times are prioritized. Lower fares and moderate driver fees can encourage transit use without overly burdening drivers. A moderate sales tax is acceptable if it significantly improves transit services, as it supports the 14.9% who rely on transit and could encourage more to switch from driving, reducing congestion and emissions.","[10, 13, 19, 22, 11]",10,13,19,22,11
West Englewood,"West Englewood has a median income of $29,234 and a per capita income of $19,453, with a significant portion of the population earning less than $25,000. This indicates limited disposable income, making cost-sensitive policies more favorable.","With 42.1% of households earning less than $25,000, discretionary spending is likely constrained. Policies that minimize additional financial burdens, such as lower fares and taxes, are preferable to maintain essential consumption.","A significant portion of the community relies on transit (25.9%) and a notable percentage has no vehicle (32.7%). Improving transit accessibility and affordability is crucial, while also considering the impact on those who drive (55.6% drive alone).","Given the community's low income levels and reliance on transit, policies with lower fares and taxes are prioritized to reduce financial strain. However, improving transit times is also important to enhance accessibility. Balancing these factors, the selected policies aim to provide affordable transit options while slightly increasing driver fees to improve transit services and reduce congestion.","[10, 11, 19, 20, 13]",10,11,19,20,13
Englewood,"Englewood has a low median income of $27,792 and a per capita income of $17,897. A significant portion of the population earns less than $25,000, indicating limited disposable income.","With 46.5% of households earning less than $25,000, discretionary spending is likely minimal. Any increase in transportation costs could significantly impact the ability to spend on other necessities.","44.6% of households do not own a vehicle, and 25.2% of residents use transit. Improving transit accessibility and affordability is crucial for this community, as many rely on it for daily commutes.","Given the low income levels, minimizing costs is essential. Proposals with lower fares and taxes are prioritized to reduce financial burden. However, improving transit times is also important due to high transit reliance. Balancing these factors, proposals with moderate driver fees are considered to encourage a shift from driving to transit, potentially reducing congestion and improving transit service. The selected proposals aim to provide affordable transit options while enhancing service quality.","[10, 11, 19, 20, 13]",10,11,19,20,13
Greater Grand Crossing,"The median income is $39,908, with a significant portion of the population earning less than $25,000. This indicates limited disposable income, making cost-sensitive policies more favorable.","With a high percentage of households earning below $50,000, discretionary spending is likely constrained. Policies that minimize additional financial burdens are preferred.","36.5% of households have no vehicle, and 29.5% use transit. Improving transit accessibility and affordability is crucial, as a significant portion of the community relies on public transportation.","Given the community's limited disposable income and reliance on public transit, policies with lower transit fares and moderate driver fees are prioritized to enhance affordability and transit service quality. A lower sales tax is preferred to minimize the impact on discretionary spending. The selected policies aim to balance improved transit services with affordability, considering the community's economic constraints and transportation needs.","[11, 10, 19, 13, 14]",11,10,19,13,14
Ashburn,"The median income in Ashburn is $78,060, with a per capita income of $28,910. A significant portion of the population earns between $50,000 and $149,999, indicating a moderate level of disposable income.","With a diverse income distribution, discretionary spending varies. A 1% sales tax would cost approximately $200 annually for a household spending $20,000, which is a consideration for lower-income households.","67.6% of residents drive alone, while 11.4% use transit. Car ownership is high, with 92.3% of households owning at least one vehicle. This suggests a reliance on driving, but transit improvements could benefit the 11.4% using public transport.","Given the high car ownership and reliance on driving, policies that reduce driving time and improve transit are prioritized. Lower fares and moderate driver fees are preferred to balance costs and benefits. A lower sales tax is favored to minimize impact on discretionary spending. The top-ranked proposals aim to reduce travel time for both drivers and transit users while keeping costs manageable for the community.","[10, 13, 19, 22, 14]",10,13,19,22,14
Auburn Gresham,"The median income in Auburn Gresham is $41,000, with a significant portion of the population earning less than $25,000. This suggests limited disposable income, making cost-sensitive policies more favorable.","With 33% of households earning less than $25,000, discretionary spending is likely constrained. Policies that minimize additional financial burdens, such as lower fares and taxes, are preferable.","21.1% of residents use transit, and 29.9% have no vehicle, indicating a reliance on public transportation. Improving transit accessibility and affordability is crucial for this community.","Given the community's limited disposable income and reliance on public transit, policies with lower fares and moderate taxes are prioritized. Reducing travel time is also important, but not at the expense of significantly higher costs. Therefore, proposals with lower fares and moderate driver fees, which can improve transit service without excessive cost, are preferred. The balance between tax, fare, and driver fee is crucial to ensure affordability and improved service.","[10, 11, 19, 20, 13]",10,11,19,20,13
Beverly,"Beverly has a high median income of $131,170 and a per capita income of $64,719, indicating a relatively high level of disposable income compared to other areas.","With a significant portion of households earning over $150,000, residents likely have more flexibility in discretionary spending. However, a higher sales tax could still impact consumption patterns, especially for those in lower income brackets.","62% of residents drive alone, while 17% use transit. The community has a high rate of car ownership, with 43.6% owning two vehicles. This suggests a strong reliance on driving, but also a notable portion using transit.","Given the high income levels, Beverly residents can absorb moderate increases in transit fares and driver fees. However, maintaining or improving transit times is crucial for the 17% who rely on it. A balance between improving transit service and minimizing additional costs is ideal. Proposals with moderate taxes and fees that significantly reduce travel times are prioritized. The community's high car ownership and driving rates suggest that reducing driving times is also beneficial. Therefore, proposals that improve transit times without drastically increasing costs are preferred.","[11, 14, 13, 10, 19]",11,14,13,10,19
Washington Heights,"The median income in Washington Heights is $66,797, with a per capita income of $29,673. A significant portion of the population earns less than $50,000, indicating limited disposable income for many households.","With a considerable percentage of households earning below $50,000, discretionary spending is likely constrained. Any increase in transportation costs could impact spending on essential goods and services.","58.2% of residents drive alone, while 22.3% use transit. Car ownership is relatively high, with 83.2% of households owning at least one vehicle. However, a notable portion of the population relies on transit, indicating the importance of affordable and efficient public transportation.","Given the community's income distribution and reliance on both driving and transit, the focus is on minimizing costs while improving transit efficiency. Lower fares and moderate driver fees are preferred to balance affordability and service improvement. A lower sales tax is favored to minimize the impact on discretionary spending. The selected proposals aim to reduce travel times and costs for both drivers and transit users, enhancing overall accessibility without significantly increasing the financial burden on residents.","[11, 10, 19, 13, 14]",11,10,19,13,14
Mount Greenwood,"Mount Greenwood has a relatively high median income of $113,328 and a per capita income of $47,744. A significant portion of the population earns over $100,000, indicating a strong disposable income base.","With a high percentage of households earning above $100,000, the community likely has a higher level of discretionary consumption. However, any increase in taxes or fees could impact this consumption, especially for those in lower income brackets.","The majority of residents drive alone (82.2%), with a small percentage using transit (4.2%). This suggests that car travel is the primary mode of transportation, and any policy that increases driving costs could have a significant impact. However, improving transit could provide more options for those without vehicles.","Given the high car ownership and reliance on driving, policies that significantly increase driving costs are less favorable. However, improving transit times and maintaining reasonable fares could encourage more transit use, benefiting those without vehicles. Balancing the sales tax to support transit without overly burdening consumption is also crucial. Therefore, proposals with moderate taxes, reasonable fares, and minimal driving fees are prioritized to maintain accessibility and affordability.","[13, 10, 4, 19, 22]",13,10,4,19,22
Morgan Park,"Morgan Park has a median household income of $71,683 and a per capita income of $39,283. A significant portion of the population earns between $25,000 and $99,999, indicating moderate disposable income levels.","With a diverse income distribution, a portion of the community may be sensitive to increases in transit fares and driver fees. The community's spending on goods and services could be impacted by higher taxes and fees.","Morgan Park has a high percentage of residents who drive alone (64.9%), with only 9.5% using transit. Car ownership is prevalent, with 49% having one vehicle and 28.7% having two vehicles. Accessibility to resources is primarily car-dependent, but improving transit could benefit the 11.3% without vehicles.","Given the community's reliance on driving and moderate income levels, policies that balance lower transit fares and moderate driver fees with reasonable travel times are preferred. Lower sales taxes are favored to minimize the impact on discretionary spending. The goal is to improve transit accessibility without significantly increasing costs for drivers or reducing disposable income through high taxes.","[10, 13, 19, 4, 22]",10,13,19,4,22
O'Hare,"O'Hare is a mixed-income area with a range of income levels, but generally has a moderate to high disposable income due to its proximity to the airport and associated employment opportunities.","Residents in O'Hare likely have moderate discretionary spending, with a focus on housing, transportation, and leisure activities. The community's spending patterns are influenced by its diverse population and employment opportunities.","O'Hare has good accessibility to resources and services due to its proximity to major transportation hubs, including the airport and highways. Public transit options are available but may not be as convenient as driving for some residents.","Given the moderate to high disposable income, the community can handle a slight increase in sales tax if it results in better transit services. However, keeping transit fares low is important to encourage public transit use. A moderate driver fee can help reduce congestion and improve air quality. The focus is on balancing costs with improved transit times and services, while considering the community's reliance on both driving and public transit.","[11, 14, 13, 10, 19]",11,14,13,10,19
Edgewater,"Edgewater has a median income of $67,796 and a per capita income of $51,717. A significant portion of the population earns less than $50,000, indicating a need to consider affordability in transportation costs.","With a diverse income distribution, a substantial portion of the community may be sensitive to increases in transportation costs, which could impact their ability to spend on other necessities.","Edgewater has a high percentage of residents using transit (33.2%) and a significant portion without vehicles (38.8%). This suggests a strong reliance on public transportation, making transit affordability and efficiency crucial.","Given the high reliance on public transit and the need to maintain affordability, proposals with lower transit fares and moderate sales taxes are prioritized. Reducing travel time is also important to improve accessibility and convenience. Proposals with higher driver fees are considered to encourage a shift from driving to transit, potentially reducing congestion and emissions. Balancing these factors, the selected proposals aim to enhance transit service while maintaining affordability for the community.","[11, 10, 19, 13, 14]",11,10,19,13,14
