community_area,disposable_income,discretionary_consumption,accessibility,decision_rationale,vote,rank1,rank2,rank3,rank4,rank5
Rogers Park,"Rogers Park has a median income of $57,591, with 44.8% of households earning less than $50,000 annually. This suggests many residents have limited disposable income and would be sensitive to increased transportation costs.","Given the income distribution and cost of living in Chicago, many Rogers Park residents likely have modest discretionary spending capacity. Higher sales taxes would notably impact their purchasing power.","The community has high transit usage (28.1%) and low car ownership (37.2% have no vehicle). The area is served by CTA Red Line and multiple bus routes, making transit accessibility crucial for residents.",1. Prioritized lower transit fares ($0.75) given high transit dependency and lower incomes. 2. Favored moderate driving fees ($0.50-$1.00) to improve transit service without excessive burden. 3. Selected lower sales tax rates (0.5-1.0%) to protect discretionary spending. 4. Balanced travel time improvements with cost impacts. 5. Considered that 39.3% drive alone and need reasonable driving costs.,"[1, 2, 10, 11, 4]",1,2,10,11,4
West Ridge,"Mixed income levels with median household income of $68,091. 37.4% households earn less than $50,000, while 32.5% earn over $100,000. Per capita income is $32,132, suggesting moderate disposable income overall.","Given the income distribution and household sizes (average 2.9 people), many families likely have limited discretionary spending. Higher taxes and fees would impact the 37.4% lower-income households more significantly.","59.2% drive alone and 10% carpool, while 12.5% use transit. 13.3% have no vehicle, making transit essential. Good mix of transportation needs with 86.6% having at least one vehicle but significant transit dependency.","1. Prioritize lower sales tax (0.5%) to protect discretionary spending for mixed-income population. 2. Moderate transit fares ($1.25) to maintain service while keeping transit affordable for 13.3% car-less households. 3. Include some driving fees to improve transit service and reduce congestion, but not highest fees given high car dependency. 4. Balance travel times for both modes since community uses both significantly. 5. Consider proposals that reduce transit travel time from current 58.8 minutes.","[4, 5, 13, 14, 22]",4,5,13,14,22
Uptown,"Mixed income levels with 38.6% earning under $50k and 31% earning over $100k. Median income of $66,871 suggests moderate disposable income, but significant income disparity exists","Given the high percentage of lower-income households (23.2% under $25k) and high cost of living in Chicago, many residents have limited discretionary spending capacity. Higher sales taxes would particularly impact these households","Strong transit orientation with 34.9% using transit for work commute. 42.1% of households have no vehicle, indicating high transit dependency. Good existing transit access with multiple L lines and bus routes",1. Prioritized lower sales tax (0.5%) to protect discretionary spending power of large lower-income population. 2. Favored moderate transit fares ($1.25) to balance transit agency funding with affordability. 3. Supported driving fees to improve transit service while managing congestion. 4. Focused on proposals that reduce transit travel times given high transit dependency. 5. Considered balance of car vs transit times given mixed-mode usage in community,"[4, 5, 1, 2, 7]",4,5,1,2,7
Lincoln Square,"Lincoln Square has a relatively high median income of $90,569, with 45.2% of households earning over $100,000. However, there's income diversity with 25.7% earning under $50,000, suggesting varying levels of disposable income across the community","With a per capita income of $57,351, residents have moderate to high discretionary spending power. The community can generally absorb moderate transportation costs, but increased taxes would impact discretionary spending, especially for lower-income households","The area shows diverse transportation usage: 39.1% drive alone, 26% use transit, and 21.6% have no vehicle. Good transit access is important as 74.7% of households have 1 or no vehicle. The community needs balanced policies that serve both drivers and transit users","1. Prioritized policies that balance transit improvement with moderate cost burden, given the mixed-income population. 2. Considered the significant transit-dependent population (21.6% no vehicle). 3. Sought policies that reduce transit travel times without excessive fees, as 26% use transit. 4. Selected options with moderate tax rates to maintain service quality while preserving discretionary income. 5. Included policies that improve both driving and transit times to serve the diverse transportation needs","[13, 4, 22, 14, 23]",13,4,22,14,23
North Center,"North Center is an affluent area with median income of $148,585 and 67.4% of households earning over $100,000. This suggests residents have significant disposable income and can absorb moderate increases in transportation costs","With high per capita income ($88,926), residents likely have substantial discretionary spending. A sales tax increase would affect this but not severely given the wealth levels","The area has good transportation mix - 38.6% drive alone, 20% use transit, and 29.2% work from home. 87.4% of households own at least one car, showing good mobility options. This suggests residents can flexibly choose between driving and transit based on cost/time tradeoffs","1. Given high incomes, prioritize time savings over cost savings. 2. With significant transit usage, favor policies that improve transit times. 3. With high car ownership, moderate driving fees are acceptable if they reduce congestion. 4. Higher sales tax is tolerable given high discretionary spending. 5. Selected policies that balance car and transit improvements given mixed modal split. Ranked based on best overall time savings for both modes while keeping cost increases moderate","[23, 14, 20, 26, 11]",23,14,20,26,11
Lake View,"Lake View is a relatively affluent area with median income of $100,625 and 50.2% of households making over $100,000. This suggests residents have higher disposable income and can better absorb transportation costs compared to other areas.","With high per capita income ($87,044), residents likely have significant discretionary spending. However, the high cost of living in Lake View means careful consideration of additional taxes and fees is still important.","The area has excellent transit access with 36.9% using transit for commuting. 39.6% of households don't own vehicles, indicating strong transit dependency. However, 24.8% drive alone, showing the need to balance both modes.","1. Given high transit usage and car-free households, prioritized proposals that improve transit service while keeping fares moderate. 2. Higher tax rates are more tolerable given income levels. 3. Support driving fees to fund transit and reduce congestion since many residents don't drive. 4. Balanced improved transit times against increased costs. 5. Selected proposals that reduce both transit and driving times while maintaining reasonable fare levels.","[23, 14, 20, 11, 4]",23,14,20,11,4
Lincoln Park,"Lincoln Park is an affluent area with median household income of $134,277 and 61.3% of households earning over $100,000. This suggests residents have significant disposable income and can generally afford higher transportation costs","With high per capita income ($109,538), residents likely have substantial discretionary spending. The impact of sales tax increases (0.5-1.5%) would be noticeable but not severely burdensome given the wealth levels","The area has high transit usage (33.4%) and low car dependency (32.3% no vehicle, 47.8% one vehicle). Good mix of transportation options with significant walk/bike share (9.3%). This suggests strong transit infrastructure and multiple viable transportation choices","1. Prioritized policies that improve transit times while keeping fares moderate, given high transit usage. 2. Considered that higher driving fees are acceptable given wealth levels and could fund better transit. 3. Moderate sales tax increase acceptable given high discretionary income. 4. Focused on proposals that reduce both transit and driving times to benefit all residents. 5. Selected policies that encourage sustainable transport while maintaining choice flexibility","[23, 14, 20, 11, 5]",23,14,20,11,5
Near North Side,"High disposable income with median household income of $121,562 and 58.8% of households making over $100,000. This suggests residents can generally absorb higher transportation costs and taxes",High discretionary spending capacity given the affluent population. The 1.5% tax would impact larger purchases but is manageable for most residents given their income levels,"Excellent multi-modal accessibility with 45.6% no-car households, high transit usage (18.9%), and significant walk/bike share (27.6%). Area has good transit infrastructure and many residents rely on non-car transportation","1. Given high income levels, prioritized policies that improve transit service and reduce congestion even if costs are higher. 2. Large car-free population benefits from better transit service. 3. High walking/biking share suggests support for policies reducing car traffic. 4. Selected policies balancing higher driver fees (to reduce congestion) with moderate-to-higher transit fares (as affordability less critical). 5. Higher tax rates acceptable given income levels and benefits of improved service","[26, 23, 20, 14, 11]",26,23,20,14,11
Edison Park,"Edison Park is a relatively affluent community with median income of $120,024 and 59.4% of households earning over $100,000. This suggests residents have significant disposable income and can absorb moderate transportation cost increases","With high per capita income ($57,872), residents likely have substantial discretionary spending. However, the 22.6% of households earning under $50,000 need to be considered in policy impacts","The community is heavily car-dependent with 93.5% of households owning cars and 74.9% driving for commuting. Only 8.4% use transit, suggesting limited transit accessibility or preference for driving","1. Given high car ownership and usage, policies that improve driving times without excessive fees are preferred. 2. Higher sales tax is acceptable given high disposable incomes to fund transit improvements. 3. Moderate transit fares to support system while keeping transit affordable for lower-income residents. 4. Balance between driving efficiency and transit improvement needed. 5. Policies that significantly reduce both driving and transit times are valued","[14, 23, 5, 13, 4]",14,23,5,13,4
Norwood Park,"Norwood Park is relatively affluent with median household income of $107,122 and per capita income of $49,303. About 53.4% of households earn over $100,000 annually, suggesting significant disposable income","With higher incomes, residents have substantial discretionary spending power. The impact of sales tax (0.5-1.5%) would be noticeable but manageable given the income levels. Most households can afford vehicle-related expenses, as shown by 92.3% having at least one car",The area is heavily car-dependent with 71.1% driving alone to work and only 7.3% using transit. High car ownership (56.8% having 2+ vehicles) suggests good road access is crucial. Transit usage is low but should be maintained as an option for the 7.7% without vehicles,"1. Given high car dependency, prefer policies with lower driving fees and reasonable travel times. 2. Can tolerate moderate sales tax given income levels. 3. Higher transit fares acceptable since few use transit and incomes can support it. 4. Balance needed between maintaining car convenience and supporting basic transit service. 5. Prioritize options that minimize congestion given high car usage","[3, 0, 6, 9, 12]",3,0,6,9,12
Jefferson Park,"Jefferson Park has a relatively high median household income of $90,740, with 44.1% of households earning over $100,000. This suggests residents have moderate to high disposable income and can absorb some transportation cost increases.","With higher incomes and an average household size of 2.5, residents likely have significant discretionary spending. However, about 27% earn under $50,000 annually, so cost sensitivity varies across the population.","The area has good car access (90.2% of households have at least one vehicle) and transit options (13.4% use transit for commuting). 61.7% drive alone to work, suggesting strong preference for driving despite transit availability.","1. Prioritized policies that balance driving efficiency with moderate fees, given high car dependency. 2. Considered moderate tax rates to maintain transit service without excessive burden. 3. Favored proposals that reduce transit travel times while keeping fares reasonable. 4. Selected options that provide meaningful travel time improvements without extreme cost increases. 5. Accounted for mixed-income population by avoiding highest-cost combinations.","[14, 13, 4, 11, 22]",14,13,4,11,22
Forest Glen,"Forest Glen is an affluent community with median household income of $139,046 and 63% of households earning over $100,000. This suggests residents have significant disposable income and can absorb moderate increases in transportation costs","With high per capita income ($70,693), residents likely have substantial discretionary spending. A sales tax increase would impact this, but the community can generally handle higher taxes better than lower-income areas","Car-centric community with 95% of households owning cars and 68.1% using cars for commuting. Only 10.5% use transit, suggesting good road access but limited transit dependence. 17.2% work from home","1. Given high car ownership and usage, prioritize proposals that improve driving times while accepting moderate fees. 2. Community can afford higher costs, so focus on service quality over lowest prices. 3. With high incomes, moderate tax increases are acceptable if they improve overall transportation. 4. Balance driving improvements with transit upgrades for the 10.5% transit users. 5. Prefer proposals with moderate to high driving fees to reduce congestion","[14, 23, 5, 17, 8]",14,23,5,17,8
North Park,"North Park has a median income of $74,649, with 23.2% earning over $150,000 but also 34.3% earning under $50,000. This suggests a mixed-income community where transportation costs impact households differently","With a significant portion (34.3%) of lower-income households, many residents need to carefully balance transportation costs with other essential expenses. The 1.5% tax rate would notably impact the community's discretionary spending","85.4% of households have at least one vehicle, with 55.6% driving alone to work. However, 17.5% use transit and 14.6% have no vehicle, indicating a need for both efficient driving and transit options. The mean commute time is 34 minutes",1. Prioritize balanced policies that serve both drivers and transit users given the mixed transportation needs. 2. Consider moderate tax rates to maintain services without overly burdening lower-income residents. 3. Favor policies that reduce commute times for both modes. 4. Select options that keep transit affordable for the 14.6% car-less households. 5. Choose policies that implement some driving fees to improve transit service while keeping taxes moderate,"[13, 4, 10, 22, 14]",13,4,10,22,14
Albany Park,"Mixed-income community with 31.3% earning under $50k, 29.3% middle income ($50k-$100k), and 39.3% earning over $100k. This suggests varying levels of sensitivity to transportation costs and taxes","Given the income distribution, about one-third of residents may have limited discretionary spending power and would be sensitive to fare increases and sales tax. Higher-income households have more flexibility to absorb increased costs","Good mix of transportation options with 23.7% using transit and 45.5% driving alone. 19.1% have no vehicle, making transit accessibility crucial. The community has relatively good access to both transit and driving options",1. Prioritize balanced policies that don't overly burden lower-income residents while improving transit service. 2. Consider the significant transit-dependent population (19.1% no vehicle). 3. Account for the large driving population (45.5%) who would be affected by driving fees. 4. Choose policies that reduce transit travel times without excessive cost increases. 5. Select options that maintain reasonable driving costs for the working-class population. Selected policies balance moderate fares with improved service times and reasonable tax rates,"[11, 13, 4, 10, 19]",11,13,4,10,19
Portage Park,"Portage Park has a median household income of $85,473, with about 30.8% of households earning less than $50,000. The community has moderate disposable income, suggesting sensitivity to both transit fares and driving costs.","With a mix of income levels and an average household size of 2.8, discretionary spending capacity varies. Higher sales taxes would impact all residents, particularly the 30.8% lower-income households who have limited discretionary spending.","89.9% of households own at least one vehicle, with 62.9% driving alone to work. 14% use transit, suggesting good access to both modes. Mean commute time is 37.1 minutes, indicating room for improvement in transportation efficiency.",1. Prioritize proposals balancing moderate tax rates with improved transit service given mixed-income population. 2. Consider high car ownership but significant transit usage suggests need for maintaining both modes. 3. Focus on reducing commute times while keeping costs reasonable. 4. Selected proposals that maintain affordable transit fares given 14% transit ridership. 5. Moderate driving fees to improve transit without overly burdening majority car-dependent population.,"[13, 4, 10, 22, 19]",13,4,10,22,19
Irving Park,"Irving Park has a median household income of $86,849, with 43.1% of households earning over $100,000. However, 28.6% earn less than $50,000, indicating a mixed-income community that needs to balance transit affordability with service quality.","With a per capita income of $48,320, residents have moderate discretionary spending power. Higher sales taxes would impact consumption, but most households could absorb moderate fare increases. The 13.9% of households without vehicles are particularly sensitive to transit costs.","The community shows diverse transportation needs: 49.6% drive alone, 18.5% use transit, and 18.6% work from home. With 86.1% of households owning at least one car, policies need to balance driving convenience with transit improvement.","1. Prioritized proposal 13 as it offers balanced improvements with moderate costs (1% tax, $1.25 fare, $0.50 driving fee)
2. Selected proposal 4 for lower tax impact while maintaining service improvements
3. Chose proposal 14 for significant transit improvements, acceptable to higher-income segments
4. Included proposal 10 to keep transit affordable with moderate improvements
5. Added proposal 22 for comprehensive transit improvements, justified by community's income level","[13, 4, 14, 10, 22]",13,4,14,10,22
Dunning,"Dunning has relatively high disposable income with 41.1% of households earning over $100,000. However, 29.3% earn under $50,000, indicating income diversity that needs consideration","With 93.7% of households owning at least one vehicle and high car dependency (72.1% drive alone), residents likely have significant transportation expenses. Higher-income households have more flexibility to absorb increased costs","The area shows heavy car reliance with low transit usage (7.3%) and walk/bike (1.2%). This suggests limited transit accessibility currently, though most households can afford car ownership","1. Prioritize proposals with moderate tax increases to improve transit while not overly burdening lower-income residents. 2. Support moderate driving fees to reduce congestion given high car usage. 3. Keep transit fares moderate to encourage more transit use. 4. Balance between travel time improvements and cost increases. 5. Selected proposals 13, 14, 22, 23, 10 as they offer good transit time improvements with reasonable cost increases, considering the community's car-dependent nature but need for better transit options","[13, 14, 22, 23, 10]",13,14,22,23,10
Montclare,"Montclare has a median income of $69,038, with about 38.3% of households making less than $50,000 annually. This suggests moderate disposable income levels, making residents somewhat sensitive to cost increases.","Given the income distribution and average household size of 2.9, many families likely have limited discretionary spending capacity. Higher taxes and fees would impact their consumption abilities, especially for the 38.3% lower-income households.","The area heavily relies on cars with 87.3% of households owning at least one vehicle and 74.9% driving alone to work. Only 4.4% use transit, suggesting limited transit accessibility or convenience. The high car dependency makes driving costs particularly important.",1. Prioritized proposals with lower sales tax (0.5%) due to significant lower-income population. 2. Favored moderate driving fees ($0.50) to improve transit without overly burdening car-dependent residents. 3. Selected lower transit fares ($0.75-$1.25) to encourage transit use. 4. Balanced travel time improvements with cost impacts. 5. Considered high car ownership rates and current travel patterns.,"[1, 4, 10, 13, 3]",1,4,10,13,3
Belmont Cragin,"Belmont Cragin is a working-class community with moderate income levels - 42.9% of households earn less than $50,000 annually, while 28.5% earn over $100,000. This suggests sensitivity to both transit fares and sales tax increases.","With a large average household size of 3.2 and significant portion of lower-middle income households, discretionary spending is likely limited. Higher sales taxes would notably impact household budgets.","84.3% of households have at least one vehicle, with driving alone (57.7%) and carpooling (13.3%) being primary commute modes. Transit usage is moderate at 15.3%, suggesting need for both efficient driving and transit options.",1. Prioritized proposals with lower sales tax (0.5%) to protect discretionary income. 2. Favored moderate driving fees ($0.50) to improve transit without overly burdening drivers. 3. Selected moderate transit fares ($1.25) balancing transit service quality with affordability. 4. Considered travel time improvements for both modes given mixed-mode usage. 5. Weighted impact on lower-income households more heavily given community demographics.,"[4, 1, 13, 7, 10]",4,1,13,7,10
Hermosa,"Hermosa has a median household income of $66,073, with about 38% of households earning less than $50,000 annually. This suggests moderate disposable income levels, making residents sensitive to both transit fares and sales tax increases.","Given the income distribution and average household size of 3.1, many families likely have limited discretionary spending. A significant portion of income goes to essential needs, making both transit costs and sales tax increases meaningful to household budgets.","87.5% of households own at least one vehicle, with 60.9% driving alone to work and 17.7% using transit. This indicates a car-dependent community but with notable transit usage, suggesting need for balanced transportation policies.",1. Prioritized proposals with lower sales tax (0.5%) to protect discretionary spending. 2. Favored moderate transit fares ($1.25) to balance transit service quality with affordability. 3. Supported modest driving fees ($0.50) to improve transit without overly burdening the majority who drive. 4. Considered travel time improvements for both modes given mixed transit/driving usage. 5. Selected proposals that reduce congestion while maintaining affordability for working families.,"[4, 1, 13, 10, 3]",4,1,13,10,3
Avondale,"Mixed-income community with 43.5% making $100k+ but also 32.6% under $50k. About 15.6% are low-income (<$25k), suggesting sensitivity to cost increases","Given the income distribution, many households have moderate to high discretionary spending capacity, but a significant portion may be cost-sensitive to both transit fares and sales tax increases","Mixed transportation needs - 19.8% no vehicle, 48.2% one vehicle. 49.7% drive alone, 21.5% use transit, indicating need for both car and transit options. Good balance needed between transit service improvements and driving costs",1. Prioritize proposals that balance transit improvement with moderate cost impact given mixed income levels. 2. Consider high transit usage (21.5%) and car-dependent population (49.7% drive alone). 3. Lower sales tax preferred due to significant low/middle income population. 4. Moderate driving fees acceptable to improve transit without overly burdening drivers. 5. Selected proposals that reduce transit times while keeping fares affordable,"[11, 4, 13, 10, 1]",11,4,13,10,1
