community_area,disposable_income,discretionary_consumption,accessibility,decision_rationale,vote,rank1,rank2,rank3,rank4,rank5
West Lawn,"West Lawn has a median household income of $69,647, with about 37% of households earning less than $50,000. The per capita income of $25,786 suggests moderate disposable income levels, making residents somewhat sensitive to additional transportation costs","With a significant portion of households in middle-income brackets and larger household sizes (average 3.4), discretionary spending capacity is moderate. Higher sales taxes would impact household budgets, especially for the 36.9% of households earning below $50,000","The community heavily relies on cars with 87.7% of households owning at least one vehicle. 63.4% drive alone to work, while only 9.8% use transit. This suggests strong preference for driving despite potential cost implications","1. Prioritize proposals with lower sales tax (0.5%) to protect discretionary spending. 2. Given high car dependency, avoid highest driving fees. 3. Balance transit fares to maintain service quality while keeping transit affordable for the 12.3% car-less households. 4. Consider moderate driving fees to reduce congestion while not overly burdening the car-dependent majority. 5. Focus on proposals that reduce both transit and driving times without excessive cost increases","[4, 1, 13, 10, 3]",4,1,13,10,3
Chicago Lawn,"Chicago Lawn has relatively low income levels with median income of $43,293 and 55.3% of households making less than $50,000. This suggests residents are price-sensitive to transportation costs and taxes.","With low per capita income ($20,907) and large household sizes (avg 3.0), discretionary spending is limited. Higher sales taxes would significantly impact household budgets given the high proportion of lower-income residents.","24.3% of households have no vehicle, while 39.8% have one vehicle. Transit usage (14.9%) is moderate, with driving alone (57.8%) and carpooling (20.6%) being primary modes. This suggests need for both affordable transit and driving options.",1. Prioritized proposals with lower sales tax (0.5%) due to limited disposable income. 2. Favored lower transit fares ($0.75-$1.25) to help car-less households. 3. Moderate driving fees ($0.50) acceptable to improve transit while not overly burdening drivers. 4. Balanced travel time improvements with cost impacts. 5. Selected proposals that reduce both transit and driving times without excessive cost increases.,"[1, 4, 10, 13, 19]",1,4,10,13,19
West Englewood,"West Englewood is a low-income community with median income of $29,234, significantly below Chicago's average. 69.5% of households earn less than $50,000 annually, with 42.1% earning less than $25,000, indicating very limited disposable income","Given the low income levels, residents have minimal discretionary spending capacity. Any increase in transportation costs or sales tax would significantly impact their ability to afford basic necessities","32.7% of households have no vehicle, and 25.9% rely on transit for commuting. The community has high transit dependency despite having limited transit access. 55.6% drive alone, suggesting a need to balance both transit and driving costs",1. Prioritized lowest sales tax (0.5%) to minimize impact on limited discretionary income. 2. Favored lower transit fares ($0.75-$1.25) to help transit-dependent residents. 3. Considered moderate driving fees ($0.50) to improve transit service without overly burdening drivers. 4. Balanced travel time improvements with cost burden. 5. Selected proposals that reduce both transit and driving times while keeping costs manageable for low-income residents,"[1, 4, 10, 13, 3]",1,4,10,13,3
Englewood,"Englewood has very limited disposable income with 46.5% households earning less than $25,000 and a median income of $27,792, which is significantly below Chicago's average. This makes residents highly sensitive to any cost increases.","With such low income levels, discretionary spending is minimal. Any additional transportation costs or sales tax would significantly impact residents' ability to afford basic necessities. The community needs to prioritize cost-saving policies.","44.6% of households have no vehicle, making transit accessibility crucial. 25.2% use transit for commuting, while 51% drive alone. The community needs balanced policies that improve transit service while keeping costs low.",1. Prioritize lowest transit fare ($0.75) to help low-income transit-dependent residents. 2. Keep sales tax low (0.5-1.0%) to minimize impact on limited discretionary spending. 3. Support moderate driving fees ($0.50) to improve transit service without overly burdening drivers. 4. Balance between travel time improvements and cost increases. 5. Consider high proportion of both transit users and drivers in the community.,"[1, 10, 0, 9, 4]",1,10,0,9,4
Greater Grand Crossing,"The community has relatively low income levels with 58.6% of households earning less than $50,000 annually and a median income of $39,908. This suggests limited disposable income and high sensitivity to transportation costs.","With low income levels and high percentage of households below poverty line, discretionary spending is likely very limited. Any increase in transportation costs or sales tax would significantly impact household budgets.","36.5% of households have no vehicle, and 29.5% rely on transit for commuting. Combined with 46.8% having just one vehicle, the community heavily depends on both public transit and car access. Transit accessibility is crucial.",1. Prioritized proposals with lower transit fares ($0.75) given high transit dependency and low incomes. 2. Favored lower sales tax (0.5%) to protect limited discretionary spending. 3. Considered moderate driving fees ($0.50) to improve transit service without overly burdening car-dependent households. 4. Balanced travel time improvements with cost impacts. 5. Selected proposals that reduce transit travel times while keeping costs affordable.,"[1, 0, 10, 4, 19]",1,0,10,4,19
Ashburn,"Ashburn has a median household income of $78,060 and per capita income of $28,910. About 30.6% of households earn less than $50,000, while 35.6% earn over $100,000, indicating a mixed-income community with significant middle and upper-middle class presence","With moderate to high car ownership (92.3% households have at least one vehicle) and median income levels, residents have some discretionary spending capacity but are likely sensitive to additional taxes and fees that could impact their consumption","The community heavily relies on cars (67.6% drive alone, 11.1% carpool) with only 11.4% using transit. The high vehicle ownership suggests good road access but potentially limited transit options","1. Given high car dependency, prefer policies with lower driving fees to avoid burdening majority of residents. 2. Moderate tax rates (1%) can support transit improvements without excessive burden. 3. Lower transit fares could encourage more transit use while helping lower-income residents. 4. Balance between maintaining reasonable car travel times and improving transit service. 5. Consider policies that don't drastically increase total transportation costs given mixed income levels","[12, 9, 3, 13, 10]",12,9,3,13,10
Auburn Gresham,"Auburn Gresham is a lower-income community with median income of $41,000 and 56.8% households making less than $50,000. This suggests residents are particularly sensitive to cost increases from taxes, fares, and fees","With high percentage of low-income households, discretionary spending is likely limited. Additional transportation costs and sales taxes would significantly impact household budgets and reduce spending on other necessities","29.9% have no vehicle access and 21.1% use transit for commuting, indicating significant transit dependency. However, 57.5% drive alone, suggesting need to balance both transit and driving improvements",1. Prioritized lower tax/fare combinations to protect limited disposable income. 2. Sought balance between transit improvements for car-less households while avoiding excessive driving fees given majority drive. 3. Selected options that reduce transit travel time without major cost increases. 4. Considered that 44.5% one-car households may switch between modes based on costs. 5. Aimed to minimize impact on discretionary spending power of low-income residents,"[9, 0, 3, 12, 18]",9,0,3,12,18
Beverly,"Beverly is an affluent community with median income of $131,170 and 64.5% of households earning over $100,000. This suggests residents have significant disposable income and can absorb moderate increases in transportation costs","With high income levels, residents likely have substantial discretionary spending. A sales tax increase would affect this spending, but impact would be manageable given the wealth levels. Annual consumption likely averages $50,000+ per household","Car ownership is very high (96.3% have at least one vehicle) and 62% drive alone to work. However, 17% use transit, suggesting decent transit access. The community needs balanced policies that maintain both driving and transit efficiency",1. Prioritized proposals that balance driving efficiency with transit improvements given high car ownership but significant transit use. 2. Community can handle moderate fee increases given high incomes. 3. Preferred lower sales tax options (0.5-1.0%) to protect discretionary spending. 4. Sought proposals reducing both car and transit travel times. 5. Selected options with moderate rather than extreme fare/fee combinations,"[14, 5, 13, 4, 11]",14,5,13,4,11
Washington Heights,"Median household income is $66,797, with about 37.7% households earning less than $50,000. This suggests moderate disposable income but significant portion of population may be cost-sensitive","Given the income distribution and household sizes, many families likely have limited discretionary spending capacity. Higher sales taxes would impact household budgets significantly",Car ownership is high (83.2% have at least one vehicle) with 58.2% driving alone to work. Transit usage is moderate at 22.3%. This suggests good car accessibility but also significant transit dependence,1. Prioritize lower sales tax (0.5%) due to income constraints and consumption patterns. 2. Balance between transit improvements and driving costs since community uses both modes significantly. 3. Moderate transit fares ($1.25) to maintain service while keeping transit affordable for the 22.3% transit users. 4. Consider driving fees to improve transit without excessive burden on drivers. 5. Selected proposals that reduce travel times while minimizing cost increases for both modes,"[4, 1, 13, 10, 3]",4,1,13,10,3
Mount Greenwood,"Mount Greenwood is relatively affluent with median income of $113,328 and 57.8% of households earning over $100,000. This suggests residents have higher disposable income and can better absorb transportation costs","With higher incomes, residents likely have significant discretionary spending. The 1-1.5% sales tax impact would be noticeable but manageable given the income levels. Annual consumption likely averages $40-50k per household",Car-centric community with 95.4% of households owning cars and 82.2% driving alone to work. Only 4.2% use transit. This suggests strong preference for driving despite cost/time tradeoffs,"1. Given high car dependency, prioritize proposals with lower driving fees to minimize impact on majority of residents. 2. Higher sales tax is acceptable given income levels if it improves overall service. 3. Higher transit fares acceptable since few use transit regularly. 4. Focus on proposals that reduce driving times since most commute by car. 5. Selected proposals balance maintaining driving convenience while funding system improvements through sales tax rather than driving fees","[3, 0, 12, 15, 21]",3,0,12,15,21
Morgan Park,"Morgan Park has a mixed income profile with median income of $71,683. About 39.5% of households earn less than $50,000, while 34.7% earn over $100,000. This suggests careful consideration of fare and tax impacts across income levels.","With per capita income of $39,283, residents have moderate discretionary spending power. Higher sales taxes would impact all residents, particularly the 39.5% lower-income households who have less flexible budgets.","88.7% of households have at least one vehicle, with 64.9% driving alone to work. Only 9.5% use transit, suggesting heavy car dependency. However, maintaining transit affordability is important for the 11.3% of households without vehicles.",1. Prioritized lower sales tax (0.5%) to protect discretionary spending power across income levels. 2. Moderate driving fees ($0.50) to improve transit without overly burdening the car-dependent majority. 3. Varied transit fares based on service improvements. 4. Selected proposals that balance travel time improvements with cost impacts. 5. Considered the needs of both drivers (73.8% drive/carpool) and transit users (9.5%).,"[4, 1, 7, 13, 10]",4,1,7,13,10
O'Hare,"Median income is $62,264, with about 37.5% households earning less than $50,000. This suggests moderate disposable income levels, making residents somewhat sensitive to cost increases but not severely constrained.","Given the income distribution and average household size of 2.2, most households have moderate discretionary spending capacity. Higher sales taxes would impact consumption but not drastically for most residents.","High car dependency with 91.3% households having at least one vehicle and 67.5% driving alone to work. Only 14.4% use transit, suggesting limited transit accessibility. The community needs balanced improvements in both driving and transit options.","1. Prioritized proposals with moderate tax rates (1%) to balance revenue generation and household burden. 2. Favored moderate driving fees ($0.50) to reduce congestion without excessive costs, given high car dependency. 3. Selected lower transit fares ($0.75-$1.25) to encourage transit use while maintaining service quality. 4. Considered travel time improvements for both modes given mixed transportation needs. 5. Balanced overall cost impact on moderate-income households.","[13, 10, 4, 22, 16]",13,10,4,22,16
Edgewater,"Edgewater has a median income of $67,796, with a diverse income distribution. About 38% earn less than $50,000, while 32.9% earn over $100,000. The per capita income of $51,717 suggests moderate disposable income levels","Given the income distribution and high cost of living in Chicago, many residents have limited discretionary spending. The 38% lower-income households would be particularly sensitive to increased transportation costs and sales taxes","The community shows balanced transit and car usage (33.2% transit, 33% drive alone). High proportion (38.8%) have no vehicles, indicating strong transit dependency. Excellent transit access with Red Line and multiple bus routes",1. Prioritized lower transit fares due to high transit usage and large car-free population. 2. Moderate tax rates to balance service funding with impact on discretionary spending. 3. Support driving fees to improve transit service and reduce congestion. 4. Considered travel time improvements for both modes given mixed-mode usage. 5. Balanced overall cost burden across different income groups,"[11, 10, 20, 19, 13]",11,10,20,19,13
