community_area,disposable_income,discretionary_consumption,accessibility,decision_rationale,vote,rank1,rank2,rank3,rank4,rank5
Logan Square,"Logan Square has a relatively high median income of $97,759 and per capita income of $62,532, with 48.9% of households earning over $100,000. However, there's income diversity with 24.5% earning under $50,000","Given the income distribution, most residents have moderate to high discretionary spending capacity. Higher-income households can better absorb increased transportation costs, while lower-income households (24.5%) would be more sensitive to fare and tax increases","The area has good transit access with 26.5% using public transit and 21.2% car-free households. However, 41.9% drive (alone or carpool), and 53.5% have one vehicle, suggesting a mix of transit and car dependency","1. Prioritize balanced policies that maintain transit affordability while improving service
2. Consider the significant transit-dependent population (21.2% no vehicle)
3. Account for mixed-mode usage patterns
4. Protect lower-income residents while accepting moderate fees to improve service
5. Focus on reducing transit travel times without excessive cost burden","[11, 13, 20, 4, 10]",11,13,20,4,10
Humboldt Park,"Median household income is $51,105 and per capita income is $25,358, with 49% of households earning less than $50k annually. This indicates limited disposable income for many residents, making them sensitive to transportation costs.","With high percentage of low-income households, discretionary spending is likely limited. Higher sales taxes would significantly impact household budgets, especially considering 25% of households earn less than $25k annually.","25% of households have no vehicle, and 20.1% use transit for work commutes. Mean commute time is 35.7 minutes. The community relies on both private vehicles (52.9% drive alone) and public transit, suggesting need for balanced policy.",1. Prioritize low transit fares due to high percentage of transit-dependent and low-income residents. 2. Moderate driving fees to improve transit service without overly burdening drivers. 3. Keep sales tax moderate to protect discretionary spending. 4. Balance between transit improvement and cost burden. 5. Consider policies that reduce travel times for both modes given long average commute times.,"[10, 11, 1, 19, 13]",10,11,1,19,13
West Town,"West Town is a relatively affluent area with median income of $128,717 and 59.2% of households earning over $100,000. This suggests residents have significant disposable income and can absorb moderate increases in transportation costs","With high per capita income ($82,088), residents likely have substantial discretionary spending. A sales tax increase would affect this but wouldn't be severely burdensome given the income levels","The area has diverse transportation usage: 35.1% drive alone, 23.2% use transit, and 8.8% walk/bike. 75.2% of households have at least one vehicle, while 20.2% have no vehicle. Good mix of transit and driving accessibility needed","1. Given high incomes, prioritize time savings over cost savings. 2. Balance needs of both drivers (39.3%) and transit users (23.2%). 3. Higher tax rates acceptable given income levels to fund better service. 4. Moderate driving fees to reduce congestion. 5. Prefer policies that improve both transit and driving times. Selected policies that optimize travel times while keeping costs reasonable for mixed-mode community","[23, 14, 20, 5, 8]",23,14,20,5,8
Austin,"Austin has relatively low income levels with a median household income of $40,086 and 57.6% of households earning less than $50,000. This suggests high sensitivity to costs from fares, fees, and taxes.","With high poverty rates and low per capita income ($23,403), residents have limited discretionary spending capacity. Additional transportation costs would significantly impact household budgets.","30.6% of households have no vehicle, and 23.7% use transit for work commutes. Mean commute time is 37.1 minutes, indicating heavy reliance on and need for efficient public transit.",1. Prioritized proposals with lower transit fares ($0.75) given low income levels and high transit dependency. 2. Favored lower sales tax rates (0.5-1.0%) to minimize impact on limited discretionary spending. 3. Supported moderate driving fees ($0.50) to improve transit service without excessive burden on car-dependent households. 4. Balanced travel time improvements with cost considerations. 5. Selected proposals that reduce transit travel times to benefit the significant transit-dependent population.,"[1, 10, 4, 19, 13]",1,10,4,19,13
West Garfield Park,"The community has relatively low income levels with 42.2% households earning less than $25,000 and median income of $36,360. This suggests high sensitivity to any additional transportation costs or taxes.","With low per capita income ($18,503), residents have limited discretionary spending capacity. Any increase in transportation costs or sales tax would significantly impact their ability to purchase other essential goods and services.","38.7% of households have no vehicle available, and 27.9% rely on transit for commuting. The mean commute time is 36.1 minutes, indicating significant dependence on public transportation despite longer travel times.",1. Prioritize proposals with lower transit fares ($0.75) due to high transit dependency and low income levels. 2. Favor lower sales tax (0.5%) to preserve purchasing power. 3. Support moderate driving fees ($0.50) to improve transit service without excessive burden. 4. Balance between travel time improvements and cost impacts. 5. Consider high proportion of both transit users and drivers in the community.,"[1, 0, 10, 9, 4]",1,0,10,9,4
East Garfield Park,"The community has relatively low income levels with 65.4% of households earning less than $50,000 annually and a median income of $31,762. This suggests high sensitivity to any additional transportation costs or taxes.","With a low per capita income of $20,343, residents have limited discretionary spending capacity. Any increase in transportation costs or sales tax would significantly impact their ability to purchase other essential goods and services.","40% of households have no vehicle, and 25% rely on public transit for commuting. The mean commute time is 35.1 minutes, indicating significant dependence on public transportation. Current transit accessibility needs improvement while keeping costs affordable.",1. Prioritize proposals with lower transit fares ($0.75) due to high transit dependency and low income levels. 2. Prefer lower sales tax rates (0.5-1.0%) to minimize impact on limited discretionary spending. 3. Support moderate driving fees ($0.50) to improve transit service without overly burdening car-dependent households. 4. Balance between transit time improvements and cost burden. 5. Consider proposals that reduce transit travel time while maintaining affordability.,"[1, 10, 0, 9, 4]",1,10,0,9,4
Near West Side,"The Near West Side has relatively high income levels with median household income of $106,955 and 52.9% of households making over $100,000. However, there's income diversity with 17.9% making less than $25,000","Given the high per capita income ($72,602), many residents have significant discretionary spending power. However, the community needs to consider the 29.1% of households making under $50,000 who would be more sensitive to fare and tax increases","The area has diverse transportation usage: 34.3% have no vehicles, 18.1% use transit, 24.1% walk/bike, and 33.9% drive. The area has good transit access but needs to balance options for all modes",1. Prioritized policies that maintain reasonable transit fares given high transit usage and car-free households. 2. Moderate tax rates to fund transit while not overly burdening lower-income residents. 3. Support driving fees to reduce congestion and fund transit improvements. 4. Balanced travel time improvements for both transit and driving given mixed mode usage. 5. Considered policies that provide best overall accessibility while maintaining affordability,"[11, 13, 4, 10, 19]",11,13,4,10,19
North Lawndale,"North Lawndale is a low-income community with 63% of households making less than $50,000 annually and a median income of $33,334. This suggests residents are particularly sensitive to cost increases from transportation policies.","With a high percentage of low-income households, discretionary spending is likely very limited. Higher sales taxes would significantly impact household budgets, as would increased transit fares or driving fees given the limited financial flexibility.","36.5% of households have no vehicle, and 23.7% rely on transit for commuting. However, 57.3% drive alone, indicating a mixed transportation need. The community requires both affordable transit options and reasonable driving costs.",1. Prioritize low transit fares ($0.75) given high transit dependency and low incomes. 2. Favor lower sales tax (0.5-1.0%) to protect limited discretionary spending. 3. Consider moderate driving fees ($0.50) to improve transit service without overly burdening drivers. 4. Balance between transit time improvements and cost increases. 5. Avoid highest tax/fee combinations that would strain household budgets.,"[1, 10, 4, 13, 19]",1,10,4,13,19
South Lawndale,"South Lawndale has relatively low income levels with median household income of $42,010 and per capita income of $18,001. About 58% of households earn less than $50,000 annually, indicating limited disposable income for most residents","Given the low income levels, residents likely have minimal discretionary spending capacity. Higher sales taxes would significantly impact household budgets. The community needs to prioritize keeping transportation costs low","About 21% of households have no vehicle, making them transit-dependent. 15.3% use transit for commuting while 70% drive alone or carpool. The community needs balanced access to both transit and driving options",1. Prioritize low transit fares ($0.75) due to low income levels and significant transit-dependent population. 2. Prefer lower sales tax (0.5-1.0%) to minimize impact on limited discretionary income. 3. Support moderate driving fees ($0.50) to improve transit service without overly burdening drivers. 4. Balance travel time improvements with cost burden. 5. Consider that many residents rely on both transit and driving,"[1, 10, 4, 13, 19]",1,10,4,13,19
Lower West Side,"Median household income is $69,810, with about 37.7% households earning less than $50,000. This suggests moderate disposable income but significant population segment that may be price-sensitive to transportation costs","Given the income distribution and average household size of 2.4, many families likely have limited discretionary spending. Higher sales taxes would impact household budgets, especially for lower-income residents","Mixed transportation profile with 43.8% driving alone, 24.5% using transit, and significant car-free population (23.8% no vehicle). Good balance of transit and driving needs to be maintained",1. Prioritized lower sales tax (0.5%) to protect discretionary spending power. 2. Balanced fare structure considering significant transit usage. 3. Moderate driving fees to improve transit service without overly burdening drivers. 4. Selected proposals that reduce transit travel time to benefit the quarter of population using transit. 5. Considered the large portion (23.8%) of no-vehicle households needing affordable transit options,"[4, 1, 13, 10, 7]",4,1,13,10,7
Loop,"The Loop is a relatively wealthy area with 61.3% of households earning over $100,000 annually. However, there is income diversity with about 20% earning under $50,000. This suggests most residents can absorb higher transportation costs, but policies should not overly burden lower-income residents.","Given the high income levels, residents likely have significant discretionary spending. The 1-1.5% sales tax impact would be notable given high consumption levels, but manageable for most. The area has high retail density, so residents likely spend considerably on taxable goods.","The Loop has excellent transit access and walkability, with only 22.7% driving. 50.5% of households don't own cars, and 47.9% use transit or walk/bike. The area is a transit hub with multiple L lines and bus routes, making transit improvements particularly impactful.","1. Given high transit usage and low car ownership, prioritize policies that improve transit times while keeping fares moderate. 2. Higher driving fees are acceptable since most residents don't drive and it will reduce congestion. 3. Moderate sales tax increase is acceptable given income levels. 4. Focus on policies that significantly reduce transit travel times. 5. Balance between transit improvement and cost burden on lower-income residents.","[23, 20, 14, 11, 5]",23,20,14,11,5
Near South Side,"The Near South Side has relatively high income levels with 43.7% of households earning over $150,000 and a median household income of $124,558. This suggests residents have significant disposable income and can generally absorb higher transportation costs","With high per capita income ($94,087), residents likely have substantial discretionary spending. Higher sales taxes would impact this, but the community can likely handle moderate increases given the wealth levels","The area has diverse transportation usage: 41.9% drive alone, 22.7% use transit, and 22.7% work from home. Most households (60.6%) have 1 vehicle, while 22.4% have no vehicle. This suggests need for both efficient driving and transit options","1. Given high incomes, prioritize time savings over cost savings. 2. Balance needs of both drivers and transit users given mixed mode share. 3. Support policies that reduce congestion given urban location. 4. Can accept moderate tax increases given income levels. 5. Prefer policies that significantly improve transit times while maintaining reasonable driving times. Selected proposals that offer best overall time savings with moderate cost increases, particularly benefiting both modes","[14, 23, 5, 8, 17]",14,23,5,8,17
Armour Square,"Armour Square has relatively low income levels with 50.8% of households earning less than $50,000 annually. This suggests high sensitivity to cost increases from taxes, fares, and fees","Given the high percentage of low-income households, discretionary spending is likely limited. Any increase in transportation costs or sales tax would significantly impact household budgets","The area has high transit dependency (33.9% no vehicle households) and significant transit usage (24.4%). While 41.1% drive alone, the large Asian population (71.7%) and lower-income residents rely heavily on public transit",1. Prioritize low transit fares due to high transit dependency and low incomes. 2. Moderate driving fees acceptable since 33.9% have no cars. 3. Lower sales tax preferred due to limited discretionary spending. 4. Balance between transit service improvements and cost burden. 5. Selected proposals that reduce transit travel times while keeping fares affordable,"[9, 0, 10, 1, 3]",9,0,10,1,3
Douglas,"Douglas has a relatively low median income of $43,528, with 54.3% of households earning less than $50,000 annually. This suggests limited disposable income for many residents, making them sensitive to additional transportation costs.","With a high percentage of low-income households, discretionary spending is likely limited. Higher sales taxes would significantly impact household budgets, especially considering 34.8% earn less than $25,000 annually.","44.4% of households have no vehicle, and 26.4% use transit for commuting. The community heavily relies on public transportation, with relatively high transit usage and walking/biking (8.4%). The mean commute time is 31.8 minutes.","1. Prioritize low transit fares due to high transit dependency and low incomes
2. Favor lower sales tax rates to protect limited discretionary spending
3. Support moderate driving fees to improve transit service without overly burdening the 40.3% who drive alone
4. Balance between transit improvement and cost burden on low-income residents
5. Consider policies that reduce transit travel time while keeping fares affordable","[1, 10, 4, 13, 19]",1,10,4,13,19
Oakland,"Oakland has a relatively low median income of $27,693, with 47.2% of households earning less than $25,000. This indicates limited disposable income for most residents, making them particularly sensitive to transportation costs.","Given the low income levels, discretionary consumption is likely very limited. Higher sales taxes would significantly impact residents' ability to purchase essential goods and services. The community needs to preserve purchasing power for basic necessities.","41.7% of households have no vehicle, and 40.4% have only one vehicle. Transit usage (19.9%) is significant, while 48.2% drive alone. The community needs affordable transit options while maintaining reasonable driving costs for those who depend on cars.",1. Prioritize low transit fares due to high percentage of transit-dependent residents and low incomes. 2. Favor lower sales tax rates (0.5-1.0%) to protect limited discretionary income. 3. Consider moderate driving fees to improve transit service without overly burdening drivers. 4. Balance between transit time improvements and cost increases. 5. Focus on proposals that reduce transit travel time while keeping fares affordable.,"[1, 10, 4, 13, 3]",1,10,4,13,3
Fuller Park,"Fuller Park is a low-income community with 70% of households earning less than $25,000 annually, making residents highly sensitive to any cost increases in transportation or taxes","With such low income levels, residents have very limited discretionary spending capacity, making them vulnerable to any additional transportation costs or sales tax increases","58% of households have no vehicle, making transit accessibility crucial. Current mode split shows 18.7% transit use, 49.3% drive alone, and 22.6% carpool, indicating heavy reliance on both transit and shared car usage",1. Prioritize lowest transit fares ($0.75) due to low income levels and high transit dependency. 2. Prefer lower sales tax (0.5-1.0%) to protect limited discretionary income. 3. Support moderate driving fees ($0.50) to improve transit service without excessive burden on carpoolers. 4. Balance between transit time improvements and cost impacts. 5. Consider proposals that reduce transit travel time below 55 minutes while maintaining affordability.,"[1, 10, 0, 9, 4]",1,10,0,9,4
Grand Boulevard,"Grand Boulevard has relatively low income levels with 53.6% of households earning less than $50,000 annually. The median income of $43,048 suggests limited disposable income for many residents, making them sensitive to transportation costs.","With a high percentage of low-income households and 30.3% having no vehicle, residents likely have limited discretionary spending capacity. Additional transportation costs and sales taxes would significantly impact their ability to purchase other goods and services.","The community shows significant transit dependence with 21.4% using transit and 30.3% having no vehicle. However, 49.3% drive alone, indicating a mix of transportation needs. Current transit travel times are considerably higher than driving times, affecting accessibility.",1. Prioritize lower transit fares ($0.75) due to high proportion of low-income residents and transit users. 2. Favor lower sales tax (0.5%) to protect limited discretionary income. 3. Support moderate driving fees ($0.50) to improve transit service without overly burdening drivers. 4. Balance between reducing transit travel times and keeping costs affordable. 5. Consider high percentage of both transit users and drivers in the community.,"[1, 0, 10, 4, 3]",1,0,10,4,3
Kenwood,"Kenwood shows significant income diversity with 45% making under $50k and 33.2% making over $100k. Median income is $58,052, suggesting moderate disposable income but with many residents sensitive to cost increases","Given the income distribution and average household size of 1.8, many households have limited discretionary spending power. Higher taxes and fees would impact the 45% lower-income residents significantly","33.1% have no vehicle, 50.3% have one vehicle. Transit usage (23.1%) equals drive-alone (40.1%), indicating strong reliance on both modes. Good transit access is crucial for this mixed-mode community",1. Prioritize lower transit fares ($0.75) to help car-less residents (33.1%) and current transit users (23.1%). 2. Moderate tax rate (1%) balances revenue needs with impact on discretionary spending. 3. Include some driving fees to improve transit service without excessive burden. 4. Focus on proposals that reduce transit travel time to support high transit usage. 5. Consider mixed income levels - avoid highest combined costs,"[11, 10, 9, 13, 14]",11,10,9,13,14
Washington Park,"Very low disposable income with median household income of $26,014 and nearly half (49.3%) of households earning less than $25,000. This suggests high sensitivity to any cost increases.",Limited discretionary spending capacity due to low income levels. Any additional transportation costs or sales tax would significantly impact already constrained household budgets.,"High transit dependency with 42.8% having no vehicle and 32.3% using transit for commuting. Mean commute time is 38.4 minutes, suggesting accessibility challenges.",1. Prioritize lowest transit fares ($0.75) due to high transit dependency and low income. 2. Prefer lower sales tax (0.5-1.0%) to minimize impact on limited discretionary spending. 3. Support moderate driving fees ($0.50-$1.00) to improve transit service without overly burdening car-owning residents. 4. Balance between transit time improvements and cost burden. 5. Consider proposals that reduce transit travel time below current 58.8 minutes.,"[1, 2, 10, 11, 9]",1,2,10,11,9
Hyde Park,"Hyde Park shows significant income diversity with 43.6% earning under $50K and 31.3% earning over $100K. The large student population from University of Chicago contributes to lower income brackets, while faculty and professionals represent higher income brackets","Given the mixed income levels and high proportion of students, many residents are price-sensitive to both transit fares and sales tax. The 43.4% of households without vehicles suggests high reliance on discretionary spending for transit","The area has excellent transit access with multiple bus routes and Metra/CTA stations. 22.5% use transit for commuting, 29.4% walk/bike, and only 25.8% drive. The high no-vehicle rate (43.4%) indicates strong transit dependency",1. Prioritize lower transit fares due to high transit usage and student population. 2. Moderate sales tax preferred given mixed income levels. 3. Support higher driving fees as most residents don't drive. 4. Balance between transit service quality and affordability needed. 5. Proposals that reduce transit travel time weighted heavily given high transit usage,"[11, 20, 2, 10, 19]",11,20,2,10,19
Woodlawn,"Woodlawn has relatively low income levels with median income of $29,969 and 44.5% households earning less than $25,000. This suggests high sensitivity to transportation costs and taxes.","Given the low income levels, discretionary spending is likely very limited. Higher sales taxes would significantly impact household budgets, especially for basic necessities.","38.1% have no vehicle access, 24.3% use transit, and 45.4% drive alone. The community needs both affordable transit options and reasonable driving costs. Current transit travel times are significantly higher than driving times.","1. Prioritized proposals with lower transit fares ($0.75) given high transit dependency and low incomes. 2. Favored lower sales tax (0.5-1.0%) to protect discretionary spending. 3. Moderate driving fees ($0.50) to improve transit service without overly burdening drivers. 4. Balanced travel time improvements for both transit and driving. 5. Selected proposal 1 as top choice for combining low transit fare, low tax, moderate driving fee, and good travel time improvements.","[1, 10, 4, 19, 13]",1,10,4,19,13
South Shore,"South Shore has relatively low income levels with median income of $39,649 and 56.5% of households making less than $50,000. This suggests high sensitivity to costs from fares, fees, and taxes","With lower income levels and high percentage of households below $50,000, discretionary spending is likely limited. Additional transportation costs and sales taxes would significantly impact household budgets",High transit dependency with 37.8% having no vehicle and 32.8% using transit for commuting. 49.8% drive alone showing mixed transportation needs. Good balance of transit and driving infrastructure needed,1. Prioritized lower sales tax (0.5%) to minimize impact on limited discretionary income. 2. Favored lower transit fares ($0.75-$1.25) given high transit usage and lower incomes. 3. Moderate driving fees ($0.50) acceptable to improve transit service while not overly burdening drivers. 4. Balanced travel time improvements for both transit and driving. 5. Selected proposals that reduce transit travel times from current 58.8 minutes while keeping costs manageable,"[1, 4, 10, 13, 3]",1,4,10,13,3
