community_area,disposable_income,discretionary_consumption,accessibility,decision_rationale,vote
Gage Park,"Gage Park is a working-class neighborhood with a median household income lower than the city average. Residents are likely to be sensitive to increases in costs, whether through transit fares, sales taxes, or driving fees.","Given the lower disposable income, discretionary spending is limited. Any increase in transportation costs could significantly impact the ability of residents to spend on other essential goods and services.","Gage Park has moderate access to public transit, but many residents rely on cars for commuting. Improving transit times could benefit those who rely on public transportation, but increased costs could be burdensome.","The goal is to balance affordability with improved transit services. Lower fares and moderate driving fees are preferred to encourage transit use without overly burdening drivers. A lower sales tax is also preferred to minimize the impact on discretionary spending. Therefore, proposals with a $0.75 fare, moderate driving fees, and a 0.5% or 1.0% sales tax are prioritized. These options offer improved transit times without significantly increasing costs for residents.","[1, 2, 10, 11, 19, 20]"
Clearing,"Clearing is a middle-income community with a moderate level of disposable income. Residents are sensitive to changes in costs related to transportation, as it can impact their overall budget for other essential and discretionary expenses.","The community has a balanced level of discretionary consumption, with residents spending on a mix of necessities and leisure activities. Any increase in transportation costs could reduce their ability to spend on non-essential goods and services.",Clearing has moderate accessibility to resources and services. Public transit options are available but not as extensive as in more central areas. Many residents rely on driving for convenience and time efficiency.,"Given the community's moderate disposable income and reliance on both driving and transit, policies that maintain or slightly reduce transit fares while not significantly increasing driving fees are preferred. A lower sales tax is also favorable to avoid impacting discretionary spending. Therefore, proposals with a $0.75 transit fare, a 0.5% sales tax, and a $0.50 driving fee are prioritized, as they offer a balance between cost savings and improved transit service. Proposals with a $1.25 fare and a 1.0% tax are also considered if they offer significant reductions in travel time.","[1, 2, 4, 5, 10, 11, 13, 14]"
West Lawn,"West Lawn is a middle-income community with a moderate level of disposable income. Residents are sensitive to changes in transportation costs, as these can impact their overall budget for essential and discretionary spending.","The community has a balanced level of discretionary consumption, with residents spending on a mix of essential goods and services, as well as leisure and non-essential items. Any increase in transportation costs could reduce their ability to spend on non-essential items.","West Lawn has moderate accessibility to resources and services. Public transit is a viable option for many residents, but driving is also common. Reducing travel time and improving transit services would benefit the community, but not at the expense of significantly higher costs.","Given the community's moderate disposable income and balanced discretionary consumption, policies that maintain or slightly reduce transit fares while keeping taxes and driving fees low are preferred. This would ensure that residents can continue to afford essential and discretionary spending. Additionally, policies that improve transit times without significantly increasing costs are favorable. Therefore, proposals with lower fares and moderate taxes and fees are prioritized, as they balance cost with improved transit service and reduced travel times.","[1, 2, 10, 11, 19]"
Chicago Lawn,"Chicago Lawn is a community with moderate to low disposable income levels. Many residents may be sensitive to increases in transportation costs, whether through fares, fees, or taxes.","Given the moderate to low income levels, discretionary spending is likely limited. Residents may prioritize essential goods and services over additional transportation costs.","Chicago Lawn has access to public transit, but travel times are relatively long. Improving transit efficiency and reducing travel times could significantly benefit residents who rely on public transportation.","The community would benefit from policies that improve transit efficiency and reduce travel times without significantly increasing costs. Lower fares and moderate driver fees could encourage more transit use, reducing congestion and emissions. A lower sales tax would minimize the impact on discretionary spending. Therefore, policies with lower fares and moderate driver fees, combined with a lower sales tax, are preferred.","[1, 2, 4, 5, 10, 11, 13, 14, 19, 20, 22, 23]"
West Englewood,West Englewood is a lower-income community with limited disposable income. Many residents rely on public transportation due to the high cost of car ownership.,"Given the limited disposable income, discretionary consumption is low. Residents prioritize essential goods and services, making any additional costs from transportation policies significant.",Public transportation is a crucial mode of transport for West Englewood residents. Improving transit times and maintaining low fares are important for accessibility to jobs and services.,"The community would benefit from policies that lower transit fares and improve transit times without significantly increasing costs. A lower sales tax is preferred to minimize the impact on discretionary spending. Driver fees are acceptable if they lead to better transit services and reduced congestion. Therefore, policies with a $0.75 fare, lower sales tax, and moderate driver fees are prioritized to balance cost and service improvements.","[1, 2, 10, 11, 19, 20]"
Englewood,"Englewood is a community with relatively low disposable income, with many residents living below the poverty line. This means that any increase in costs, whether through transit fares, driver fees, or sales taxes, could significantly impact residents' financial stability.","Given the low disposable income, discretionary consumption is limited. Residents prioritize essential goods and services, and any additional financial burden could reduce their ability to afford necessities.","Englewood has limited access to resources and services, with many residents relying on public transit for commuting and accessing essential services. Improving transit services could enhance accessibility, but affordability remains a critical concern.","Considering Englewood's low disposable income and limited discretionary consumption, policies with lower transit fares and minimal sales tax increases are preferred to minimize financial strain on residents. Additionally, reducing travel times for both transit and driving is beneficial, but not at the expense of significantly higher costs. Therefore, policies with a balance of lower fares, moderate driver fees to reduce congestion, and minimal tax increases are prioritized.","[1, 2, 10, 11, 19, 20]"
Greater Grand Crossing,"Greater Grand Crossing has a relatively low to moderate disposable income level, which means residents are sensitive to increases in costs related to transportation, such as fares and fees.","Given the income levels, discretionary consumption is limited, so any increase in transportation costs could significantly impact the ability of residents to spend on other essential goods and services.","The community relies heavily on public transit due to lower car ownership rates. Therefore, maintaining affordable and efficient transit options is crucial for accessibility to jobs, education, and other services.","The community needs to balance between affordable transit fares and reasonable sales tax rates to ensure that public transit remains accessible without overly burdening residents with high costs. Lower fares and moderate sales tax rates are preferred to maintain affordability. Driver fees can be considered to reduce congestion and improve transit times, but they should not be too high to avoid excessive costs for those who need to drive. Proposals with lower fares and moderate driver fees are prioritized to enhance transit service without significantly impacting disposable income.","[1, 2, 4, 5, 10, 11, 13, 14, 19, 20, 22, 23]"
Ashburn,"Ashburn is a middle-income community with a moderate level of disposable income. Residents are sensitive to changes in transportation costs, as these can impact their overall budget for essential and discretionary spending.","The community has a balanced level of discretionary consumption, with residents spending on a mix of necessities and non-essential goods. Any increase in transportation costs could reduce their ability to spend on other goods and services.","Ashburn has moderate accessibility to resources and services. Public transit is a viable option for many residents, but driving is also common. Reducing travel time and improving transit services would benefit the community.","Given the community's moderate disposable income and balanced discretionary consumption, policies with lower transit fares and moderate driver fees are preferred to minimize the financial burden on residents. A moderate sales tax is acceptable if it significantly improves transit services. Reducing travel time for both transit and driving is a priority to enhance accessibility. Therefore, policies that offer a good balance between cost and improved transit services, while not overly increasing the financial burden, are prioritized.","[1, 4, 10, 13, 19]"
Auburn Gresham,"Auburn Gresham has a moderate to low average disposable income, which means residents are sensitive to increases in costs related to transportation, taxes, and fees.","Given the moderate to low disposable income, discretionary consumption is limited. Residents prioritize essential expenses, so any increase in transportation costs could significantly impact their budget.","Auburn Gresham has moderate access to public transit, but improvements in transit times could enhance accessibility. Many residents rely on public transit, so lower fares and improved services are beneficial.","The community would benefit from policies that lower transit fares and improve transit times without significantly increasing taxes or driving fees. Lower fares would make transit more affordable, and improved transit times would enhance accessibility. A moderate sales tax is acceptable if it leads to better transit services, but high driving fees could be burdensome for those who rely on cars. Therefore, policies with lower fares, moderate sales tax, and minimal driving fees are prioritized.","[1, 2, 10, 11, 19, 20]"
Beverly,Beverly is a middle to upper-middle-class neighborhood with relatively high disposable income compared to other areas in Chicago. Residents can afford moderate increases in transportation costs but would prefer to maintain a balance to ensure discretionary spending is not heavily impacted.,"Residents in Beverly have a moderate to high level of discretionary consumption, spending on dining, entertainment, and other non-essential goods and services. They would prefer policies that do not significantly reduce their ability to spend on these activities.","Beverly has decent access to public transportation, with Metra services being a primary mode for commuters. However, many residents also rely on personal vehicles. Policies that improve transit times and reduce congestion would be beneficial, but not at the expense of significantly higher costs.","Given Beverly's relatively high disposable income and discretionary consumption, policies with moderate fare and tax increases are acceptable if they lead to significant improvements in transit times and reduced congestion. A balance between maintaining affordable transit fares and reasonable driving fees is crucial. Policies with a 1% sales tax and moderate driving fees are preferred as they provide a balance between cost and improved service. High sales taxes (1.5%) are less favorable due to their impact on discretionary spending.","[10, 11, 13, 14, 19, 20, 22, 23]"
Washington Heights,"Washington Heights has a moderate to low average disposable income, which means residents are sensitive to increases in costs related to transportation, such as higher fares or driver fees.","Given the moderate to low disposable income, discretionary consumption is limited. Residents prioritize essential spending, so any increase in transportation costs could significantly impact their budget for other necessities.","Washington Heights has moderate access to public transit, but improvements in transit times could significantly benefit the community. Many residents rely on public transit, so policies that improve transit efficiency without significantly increasing costs are preferred.","The community would benefit from policies that improve transit times and reduce congestion without imposing high costs on residents. Lower fares and moderate driver fees could encourage a shift from driving to transit, reducing congestion and emissions. A lower sales tax is preferred to minimize the impact on disposable income. Therefore, policies with a 0.5% sales tax, lower fares, and moderate driver fees are prioritized.","[1, 2, 4, 5, 10, 11, 13, 14, 19, 20, 22, 23]"
Mount Greenwood,"Mount Greenwood is a middle-class community with a relatively stable disposable income. Residents have a moderate level of financial flexibility, but significant increases in costs could impact their budget.","The community has a balanced discretionary consumption pattern, with spending on essentials and some leisure activities. Residents are likely to be sensitive to changes in transportation costs that could affect their overall spending power.",Mount Greenwood has moderate accessibility to resources and services. Public transit options are available but not as extensive as in more central areas. Many residents rely on driving for convenience and time efficiency.,"Given the community's moderate disposable income and reliance on both driving and transit, policies that balance cost and travel time improvements are preferred. Lower transit fares and moderate driver fees could encourage transit use without significantly impacting budgets. A moderate sales tax is acceptable if it leads to better transit services. Policies with high costs or minimal time savings are less favorable.","[1, 4, 10, 13, 19]"
Morgan Park,"Morgan Park is a middle-income community with a moderate level of disposable income. Residents are sensitive to changes in transportation costs, but they can accommodate slight increases if it leads to better services.","The community has a balanced discretionary consumption pattern, with residents spending on essentials and some non-essential goods. They are likely to be cautious about policies that significantly reduce their disposable income.","Morgan Park has moderate accessibility to resources and services. Public transit is a crucial mode of transportation for many residents, but driving is also common. Improvements in transit services could benefit the community, especially if they reduce travel times.","Given the community's moderate income and reliance on both transit and driving, policies that balance costs and benefits are preferred. Lower transit fares and moderate driver fees can encourage transit use without overly burdening drivers. A moderate sales tax is acceptable if it significantly improves transit services. Policies that reduce travel times for both transit and driving are prioritized, as they enhance accessibility and quality of life.","[1, 2, 10, 11, 19]"
O'Hare,"O'Hare is a relatively affluent area with a higher median income compared to other Chicago neighborhoods. Residents generally have more disposable income, which allows for some flexibility in absorbing additional costs from taxes or fees.","Given the higher income levels, residents in O'Hare likely have a higher level of discretionary consumption. They may prioritize convenience and time savings over cost savings, but still value cost-effective solutions.","O'Hare has good accessibility to resources and services, with a major airport and several transit options. However, the area is car-dependent, and reducing driving times could be beneficial. Improved transit services could also enhance accessibility for those who rely on public transportation.","Considering the higher disposable income and discretionary consumption, O'Hare residents might be willing to accept a moderate increase in sales tax and driving fees if it results in significant improvements in transit times and services. Proposals that reduce car travel time and improve transit efficiency without drastically increasing costs are preferred. A balance between maintaining reasonable costs and improving service quality is crucial.","[1, 2, 4, 5, 10, 11, 13, 14, 19, 20, 22, 23]"
Edgewater,"Edgewater is a diverse community with a mix of income levels. While some residents have higher disposable incomes, there is a significant portion of the population with moderate to low incomes. Therefore, policies that increase costs significantly could disproportionately affect lower-income residents.","Residents in Edgewater have varied discretionary spending habits, with some prioritizing housing and essentials, while others may have more flexibility for leisure and non-essential goods. Policies that increase transportation costs could reduce discretionary spending for lower-income residents.","Edgewater has good access to public transit, with several CTA bus and train lines serving the area. However, travel times by transit are longer compared to driving. Improving transit efficiency and reducing travel times could benefit the community, especially those who rely on public transportation.","Given the diverse income levels in Edgewater, policies that maintain or reduce transit fares while improving service are preferred. A moderate sales tax increase could be acceptable if it significantly improves transit service. Driver fees could be supported if they lead to reduced congestion and better transit options. The goal is to balance affordability with improved accessibility and service quality.","[1, 2, 10, 11, 19]"
