community_area,disposable_income,discretionary_consumption,accessibility,decision_rationale,vote
Rogers Park,"Rogers Park has a diverse population with varying income levels, but generally, it is a middle-income area. Many residents may not have a high disposable income, so affordability is a key concern.","Residents in Rogers Park have moderate discretionary spending. They prioritize essential goods and services, and any increase in transportation costs could impact their ability to spend on other necessities.","Rogers Park is well-served by public transit, including the CTA Red Line and several bus routes. Many residents rely on public transit for commuting and daily activities, making transit affordability and efficiency crucial.","Given the moderate disposable income and reliance on public transit, policies with lower transit fares and moderate sales taxes are preferred to maintain affordability. A moderate driver fee is acceptable if it significantly reduces travel time and congestion, benefiting both drivers and transit users. The goal is to balance affordability with improved transit services and reduced congestion.","[1, 2, 10, 11, 19]"
West Ridge,"West Ridge has a moderate level of disposable income, with a diverse population including middle-income families and a significant number of low-income households.","The community has a balanced discretionary consumption pattern, with residents spending on essentials and some discretionary items, but with limited flexibility for significant increases in transportation costs.","West Ridge has moderate accessibility to public transit, with some reliance on driving. Improving transit times could benefit the community, but cost increases need to be carefully managed to avoid burdening low-income residents.","Given the moderate disposable income and the need to balance costs, proposals with lower fares and moderate driver fees are preferred to encourage transit use without significantly increasing costs. A lower sales tax is also preferred to minimize the impact on discretionary spending. Proposals that improve transit times without drastically increasing costs are prioritized.","[1, 2, 4, 5, 10]"
Uptown,"Uptown is a diverse community with a mix of income levels. There are both high-income residents and lower-income residents, with a significant portion of the population being middle-income. This means that any increase in costs, whether through fares, fees, or taxes, could have varying impacts on different segments of the community.","Uptown residents have a moderate level of discretionary consumption. While some residents can absorb additional costs, others may find it challenging. Therefore, policies that minimize additional financial burdens while improving services are preferable.","Uptown has good access to public transit, with several bus and train lines serving the area. However, travel times can be long, and improvements in transit efficiency would be beneficial. Many residents rely on public transit, but there is also a significant number of car owners.","Given the diverse income levels and reliance on public transit in Uptown, policies that reduce transit fares and improve travel times are prioritized. A lower sales tax is preferred to minimize the financial burden on residents. Driver fees are acceptable if they significantly improve transit times, as this could encourage a shift from driving to transit, reducing congestion and emissions. Therefore, proposals with a $0.75 fare, a 0.5% or 1.0% tax, and a $0.5 or $1.0 driver fee are favored, as they balance cost with improved transit service.","[1, 2, 10, 11, 19, 20]"
Lincoln Square,"Lincoln Square is a middle-income community with a mix of families and young professionals. The community has a moderate level of disposable income, which means residents are sensitive to increases in costs that could affect their overall budget.","Residents in Lincoln Square enjoy a variety of local amenities, dining, and cultural activities. They value having disposable income for these discretionary activities, so policies that significantly reduce their spending power may not be favorable.","Lincoln Square has good access to public transportation, including buses and the CTA Brown Line. Many residents rely on public transit for commuting, but there is also a significant number of car owners. Reducing travel time and improving transit services are important for the community.","Given the community's moderate disposable income and reliance on both public transit and cars, policies that balance cost with improved transit services are preferred. Lower transit fares and moderate driver fees can encourage transit use without overly burdening car users. A moderate sales tax is acceptable if it leads to better transit services, as long as it doesn't significantly impact discretionary spending. Therefore, policies with a 1% sales tax, lower transit fares, and moderate driver fees are prioritized to improve transit times and services while maintaining affordability.","[10, 11, 13, 14, 19, 20, 22, 23]"
North Center,"North Center is a relatively affluent community with a higher median household income compared to the city average. Residents generally have more disposable income, which allows for some flexibility in absorbing additional costs from taxes or fees.","Given the higher income levels, residents in North Center likely have higher discretionary spending on non-essential goods and services. However, they may still be sensitive to significant increases in costs that could impact their lifestyle.","North Center has good access to public transportation, with several CTA bus and train lines serving the area. The community is also car-friendly, with many residents owning vehicles. Therefore, both transit and driving options are important for residents.","Considering the community's higher disposable income, a moderate increase in sales tax and driving fees could be acceptable if it leads to improved transit services and reduced congestion. Lower transit fares would benefit those who rely on public transportation, while moderate driving fees could encourage a shift from driving to transit, reducing congestion. Proposals with a 1% sales tax strike a balance between funding transit improvements and maintaining discretionary spending. A driving fee of $0.50 is reasonable to encourage transit use without overly burdening drivers. Transit fares at $0.75 or $1.25 are preferred to keep public transportation affordable.","[10, 11, 13, 14, 19, 20, 22, 23]"
Lake View,Lake View is a relatively affluent community with a higher than average disposable income compared to other areas in Chicago. Residents can generally afford moderate increases in taxes and fees if it results in improved services.,"Residents in Lake View have a higher level of discretionary consumption, spending on dining, entertainment, and other non-essential goods and services. They are likely to be sensitive to changes in disposable income that affect their lifestyle.","Lake View has good access to public transportation, with several CTA train lines and bus routes. Many residents rely on public transit for commuting, but there is also a significant number of car owners.","Given the higher disposable income and reliance on public transit, Lake View residents would benefit from policies that improve transit services even if it means a slight increase in costs. However, the community would prefer to avoid the highest tax rates to maintain discretionary spending. Policies that reduce travel time for both transit and driving are preferred, as they enhance overall accessibility and convenience. Therefore, policies with moderate taxes and fees that significantly improve transit times are prioritized.","[1, 2, 4, 5, 10, 11, 13, 14, 19, 20, 22, 23]"
Lincoln Park,"Lincoln Park is a relatively affluent community with higher than average disposable income levels, allowing residents to absorb moderate increases in costs such as transit fares and driver fees.","Residents in Lincoln Park have a higher level of discretionary consumption, meaning they can afford to spend more on non-essential goods and services. This suggests a capacity to handle slight increases in sales tax if it results in improved transit services.","Lincoln Park has good accessibility to resources and services, with a well-connected public transit system. However, reducing travel times and improving transit services would be beneficial, especially if it encourages a shift from driving to public transit.","Given the higher disposable income and discretionary consumption, Lincoln Park can support moderate increases in transit fares and driver fees if they lead to significant improvements in transit times and services. A balanced approach with a moderate sales tax increase is acceptable if it results in better transit infrastructure. Proposals with a $0.75 fare and a $0.5 driver fee are preferred as they offer a good balance between cost and service improvement. A 1% sales tax is acceptable, but 1.5% is less favorable unless it results in substantial transit time reductions.","[1, 2, 10, 11, 13, 14, 19, 20, 22, 23]"
Near North Side,"The Near North Side is one of the more affluent areas in Chicago, with a higher average disposable income compared to other communities. Residents can generally afford higher costs associated with transportation, but they still value cost-effectiveness.","Residents in the Near North Side have a higher level of discretionary consumption, spending on dining, entertainment, and luxury goods. They are likely to prioritize policies that do not significantly impact their ability to maintain this lifestyle.","The Near North Side has excellent access to public transportation, with multiple transit lines and bus routes. Many residents rely on public transit for commuting, but there is also a significant number of car owners who value reduced congestion and travel times.","Given the higher disposable income and discretionary consumption, the community can support moderate increases in transit fares and driver fees if it leads to improved transit services and reduced congestion. A balanced approach with moderate sales tax and driver fees, along with reasonable transit fares, would be ideal. Policies that significantly reduce travel time for both transit and driving while maintaining a reasonable cost are prioritized. Therefore, proposals with a 1% sales tax, moderate driver fees, and transit fares that do not exceed the current fare are preferred.","[10, 13, 14, 19, 22]"
Edison Park,"Edison Park is a relatively affluent community with a higher median household income compared to other areas in Chicago. Residents generally have more disposable income, which allows for some flexibility in absorbing additional costs from taxes or fees.","Given the higher income levels, residents of Edison Park likely have higher discretionary spending on goods and services. However, they may still be sensitive to significant increases in costs that could impact their lifestyle.","Edison Park has decent access to public transportation, but many residents rely on driving due to the suburban nature of the area. Reducing driving times and improving transit efficiency could be beneficial, but not at the expense of significantly higher costs.","Considering the community's higher disposable income, a moderate increase in sales tax and driving fees could be acceptable if it leads to improved transit services and reduced congestion. However, maintaining a balance is crucial to avoid excessive financial burden. Proposals with a 1% sales tax and moderate driving fees are preferred, as they offer a compromise between cost and improved service. Lower transit fares are also favorable to encourage public transit use without significantly impacting discretionary spending.","[10, 13, 14, 19, 22]"
Norwood Park,"Norwood Park is a middle to upper-middle-income community with a relatively high level of disposable income compared to other areas in Chicago. Residents can generally afford moderate increases in transportation costs, but significant increases could impact their discretionary spending.","Residents in Norwood Park have a moderate to high level of discretionary consumption. They value quality of life, including spending on leisure, dining, and other non-essential goods and services. Therefore, policies that significantly reduce disposable income might be less favorable.","Norwood Park has decent access to public transportation, but many residents rely on driving due to the suburban nature of the area. Reducing driving times and improving transit efficiency could be beneficial, but not at the expense of significantly higher costs.","Given the community's relatively high disposable income and reliance on both driving and transit, policies that balance moderate costs with improved transit times are preferred. A lower sales tax is favored to maintain discretionary spending. Moderate driving fees are acceptable if they lead to significant reductions in travel time, as this could encourage a shift to transit and reduce congestion. Lower transit fares are preferred to encourage public transportation use without significantly impacting disposable income.","[1, 2, 4, 5, 10, 11, 13, 14, 19, 20, 22, 23]"
Jefferson Park,"Jefferson Park is a middle-income community with a mix of working-class and middle-class residents. The community has a relatively stable economic base, with many residents employed in various sectors across the city.","Residents in Jefferson Park have moderate discretionary spending power. They are likely to be sensitive to increases in transportation costs, as these could impact their ability to spend on other goods and services.","Jefferson Park has good access to public transportation, including the CTA Blue Line and several bus routes. However, many residents also rely on cars for commuting, given the community's location and the need to travel to different parts of the city for work and other activities.","Given the community's moderate income levels and reliance on both public transit and driving, policies that balance affordability with improved transit services are preferred. Lower transit fares and moderate driver fees could encourage more residents to use public transit, reducing congestion and emissions. A moderate sales tax is acceptable if it significantly improves transit services, but it should not overly burden residents' discretionary spending. Therefore, proposals with lower fares and moderate driver fees, combined with a reasonable sales tax, are prioritized.","[1, 4, 10, 13, 19]"
Forest Glen,"Forest Glen is a relatively affluent community with a higher median household income compared to the city average. Residents generally have more disposable income, which allows for some flexibility in absorbing additional costs from taxes or fees.","Given the higher income levels, residents in Forest Glen likely have higher discretionary spending on goods and services. However, they may still be sensitive to significant increases in costs that could impact their lifestyle.","Forest Glen has good access to public transportation, with Metra and CTA services available. However, many residents also rely on personal vehicles for commuting, given the suburban nature of the area.","Considering the community's higher disposable income, a moderate increase in sales tax and driving fees could be acceptable if it leads to improved transit services and reduced congestion. Lower transit fares would benefit those who rely on public transportation, while moderate driving fees could encourage a shift from driving to transit, reducing congestion. Therefore, proposals with a balance of moderate taxes, reasonable transit fares, and driving fees that improve transit times and reduce car travel times are preferred.","[1, 4, 10, 13, 19]"
North Park,"North Park is a middle-income community with a moderate level of disposable income. Residents are sensitive to changes in transportation costs, but they can accommodate slight increases if it leads to better services.","The community has a balanced discretionary consumption pattern, with residents spending on a variety of goods and services. They are likely to be cautious about policies that significantly reduce their disposable income.","North Park has decent access to public transit, but improvements in transit times and services would be beneficial. Many residents rely on both driving and public transit, so policies that improve transit without drastically increasing costs are preferred.","Given the community's moderate income and balanced consumption, policies with lower fares and moderate taxes are preferred to maintain affordability. A slight increase in driver fees is acceptable if it significantly improves transit times, as this could encourage a shift from driving to transit, reducing congestion and emissions. Policies with a 0.5% or 1% tax rate, lower fares, and moderate driver fees are prioritized to balance cost and service improvements.","[1, 2, 4, 5, 10, 11, 13, 14]"
Albany Park,"Albany Park is a diverse community with a mix of income levels. Many residents are middle to lower-middle income, with a significant portion of the population being immigrants and working-class families. Disposable income is moderate, and residents are sensitive to increases in living costs.","Given the moderate disposable income, discretionary spending is limited. Residents prioritize essential expenses such as housing, food, and education. Any increase in transportation costs could significantly impact their budget.","Albany Park has decent access to public transportation, with several bus routes and the Brown Line serving the area. However, travel times can be long, and improvements in transit efficiency would be beneficial. Car ownership is moderate, and many residents rely on public transit for commuting.","Considering the moderate disposable income and limited discretionary spending, policies with lower transit fares and minimal increases in sales tax are preferred. Reducing travel time is also a priority to improve accessibility. Therefore, policies with a balance of lower fares, moderate taxes, and reasonable driving fees that lead to reduced travel times are favored. The community would benefit from improved transit services without significant increases in overall costs.","[1, 2, 10, 11, 19]"
Portage Park,"Portage Park is a middle-income community with a moderate level of disposable income. Residents are sensitive to changes in transportation costs, but they can accommodate slight increases if it leads to better services.","The community has a balanced discretionary consumption pattern, with residents spending on a mix of necessities and leisure activities. Any increase in transportation costs should not significantly impact their ability to maintain this balance.","Portage Park has decent access to public transit, but improvements in transit times and services would be beneficial. Many residents rely on both driving and public transit, so policies that improve transit without significantly increasing costs are preferred.","Given the community's moderate income and balanced consumption, policies with lower fares and moderate taxes are preferred to maintain affordability. A slight increase in driving fees is acceptable if it leads to reduced congestion and better transit services. Policies that improve transit times without drastically increasing costs are prioritized.","[1, 2, 10, 11, 13]"
Irving Park,"Irving Park is a middle-income community with a mix of working-class and middle-class residents. The disposable income is moderate, meaning residents are sensitive to increases in costs that could affect their budget for essential and discretionary spending.","Residents in Irving Park have moderate discretionary spending. They value affordability in transportation to maintain their lifestyle, which includes dining, entertainment, and other leisure activities.","Irving Park has decent access to public transit, with several bus lines and a nearby CTA Blue Line station. However, many residents also rely on cars for commuting, so both transit and driving options are important.","Given the moderate disposable income and discretionary consumption, policies with lower fares and taxes are preferred to minimize financial strain. However, improving transit times is also important to encourage public transit use. Balancing these factors, proposals with a $0.75 fare and moderate driver fees are prioritized, as they offer improved transit times without significantly increasing costs. A 1% sales tax is acceptable if it results in better transit services, but a 1.5% tax is too high given the community's income level.","[1, 2, 10, 11, 19, 20]"
Dunning,"Dunning is a middle-income community area with a moderate level of disposable income. Residents are sensitive to changes in transportation costs, but they can absorb moderate increases if they lead to significant improvements in service or accessibility.","The community has a balanced level of discretionary consumption, with residents spending on a variety of goods and services. Any increase in transportation costs should be justified by tangible benefits in terms of reduced travel time or improved service quality.","Dunning has moderate accessibility to resources and services. Public transit is used by a portion of the community, but many residents rely on driving. Improvements in transit times could encourage more residents to switch from driving to public transit, reducing congestion and emissions.","Given the community's moderate disposable income and balanced discretionary consumption, proposals with lower fares and moderate driver fees are preferred to encourage transit use without significantly impacting residents' budgets. A moderate sales tax is acceptable if it leads to better transit services. Proposals that significantly reduce travel times for both transit and driving are prioritized, as they offer the most benefit to the community by improving accessibility and reducing congestion.","[1, 4, 10, 13, 19]"
Montclare,"Montclare is a middle-income community with a moderate level of disposable income. Residents are sensitive to increases in costs, whether through taxes, fares, or fees.","The community has a balanced discretionary consumption pattern, with residents spending on essentials and some non-essential goods and services. Any increase in transportation costs could impact their ability to maintain this balance.","Montclare has moderate accessibility to resources and services. Public transit is used by a portion of the community, but many residents rely on driving due to the suburban nature of the area.","Given the moderate disposable income and balanced discretionary consumption, policies with lower fares and taxes are preferred to minimize financial strain. However, improving transit times is also important to enhance accessibility. Therefore, policies that offer a balance between cost and improved transit times are prioritized. A moderate driver fee is acceptable if it significantly reduces car travel time and improves transit service, as this could encourage a shift from driving to transit, reducing congestion and emissions.","[1, 4, 10, 13, 19]"
Belmont Cragin,"Belmont Cragin is a middle-income community with a significant portion of residents working in blue-collar jobs. The community has a moderate level of disposable income, which means that any increase in transportation costs could impact their budget for other essential expenses.","Residents in Belmont Cragin have limited discretionary spending due to their moderate income levels. They prioritize essential goods and services, so any increase in transportation costs could reduce their ability to spend on non-essential items.","Belmont Cragin has moderate access to public transit, with some residents relying on buses and trains for commuting. Car ownership is relatively high, but traffic congestion can be an issue. Improving transit times and reducing congestion would benefit the community.","Given the moderate disposable income and limited discretionary spending, policies with lower transit fares and moderate driver fees are preferred to minimize the financial burden on residents. A moderate sales tax is acceptable if it significantly improves transit services. Reducing travel times for both transit and driving is crucial to enhance accessibility. Therefore, policies that balance lower costs with improved transit times and reduced congestion are prioritized.","[1, 2, 10, 11, 19]"
Hermosa,"Hermosa is a working-class neighborhood with moderate disposable income levels. Residents are sensitive to increases in costs, whether through taxes, fares, or fees.","The community prioritizes essential spending, with limited room for discretionary consumption. Any increase in transportation costs could significantly impact their budget for other necessities.","Hermosa has moderate access to public transit, with many residents relying on it for commuting. Improving transit times and maintaining affordable fares are crucial for the community.","Given Hermosa's moderate income levels and reliance on public transit, policies that maintain or reduce transit fares while improving service times are prioritized. A lower sales tax is preferred to minimize the impact on disposable income. Driver fees are acceptable if they significantly improve transit times, as this could encourage a shift from driving to transit, reducing congestion and emissions. The community is willing to accept a moderate increase in driver fees if it results in substantial transit improvements.","[1, 2, 10, 11, 19]"
