community_area,disposable_income,discretionary_consumption,accessibility,decision_rationale,vote
Avondale,"Avondale is a diverse community with a mix of income levels. The median household income is moderate, suggesting that residents are sensitive to increases in costs, whether through taxes, fares, or fees.","Residents in Avondale have a moderate level of discretionary spending. They are likely to be cautious about policies that significantly increase their cost of living, such as higher sales taxes or transit fares.","Avondale has decent access to public transit, with several bus and train lines serving the area. However, travel times by transit are longer compared to driving, which may influence residents' preferences for policies that improve transit efficiency.","Given the moderate income levels and sensitivity to cost increases, Avondale would likely favor policies that minimize additional financial burdens while improving transit efficiency. Lower fares and moderate driver fees could encourage transit use without significantly impacting disposable income. A moderate sales tax could be acceptable if it leads to noticeable improvements in transit service. Therefore, policies with lower fares and moderate driver fees, combined with a moderate sales tax, are preferred.","[1, 4, 10, 13, 19]"
Logan Square,"Logan Square is a diverse community with a mix of income levels. While there are affluent areas, there are also parts of the community with lower income levels. The community has a significant number of young professionals and families, which suggests a moderate level of disposable income overall.","Residents in Logan Square tend to spend on dining, entertainment, and cultural activities, reflecting a vibrant local culture. However, affordability is a concern for many, especially with rising living costs.","Logan Square has good access to public transit, including the Blue Line, which is a major asset for commuting to downtown Chicago. However, traffic congestion can be an issue, and parking is often limited. Many residents rely on a mix of public transit and driving.","Given the moderate disposable income and the importance of affordable transit options, policies with lower transit fares are preferred. A moderate sales tax is acceptable if it significantly improves transit services, as many residents rely on public transportation. Driver fees are less favorable due to the mixed reliance on cars, but a small fee could be acceptable if it leads to reduced congestion and better transit. Therefore, policies with a balance of lower fares, moderate taxes, and minimal driver fees are prioritized.","[1, 4, 10, 13, 19]"
Humboldt Park,"Humboldt Park has a moderate to low average disposable income, with many residents relying on affordable transportation options.","Residents prioritize essential spending, with limited discretionary income available for non-essential goods and services.","The community has moderate access to public transit, but improvements in transit times and affordability could significantly benefit residents who rely on public transportation.","Given the moderate to low disposable income, policies with lower transit fares and moderate sales tax rates are preferred to minimize the financial burden on residents. Additionally, policies that improve transit times without significantly increasing costs are prioritized. A balance between affordable transit fares and reasonable driver fees is essential to encourage public transit use while maintaining accessibility for those who drive. Policies with a 0.5% or 1.0% sales tax and a $0.75 or $1.25 transit fare, combined with a $0.5 driver fee, offer a good balance of affordability and improved transit service.","[1, 2, 4, 5, 10, 11, 13, 14]"
West Town,"West Town is a diverse community with a mix of income levels, but generally has a moderate to high disposable income due to its proximity to downtown Chicago and a growing number of young professionals and families.","Residents in West Town tend to have a higher level of discretionary consumption, with spending on dining, entertainment, and retail being common. The community values quality of life and convenience.","West Town has good accessibility to public transit, with several bus routes and train lines serving the area. However, traffic congestion can be an issue, making efficient transit options important for residents.","Given the moderate to high disposable income, West Town residents can afford a slight increase in transit fares and driver fees if it results in significantly improved transit services and reduced travel times. A lower sales tax is preferred to maintain discretionary spending. Policies that reduce car travel time and improve transit efficiency are prioritized, as they align with the community's preference for convenience and quality of life. Therefore, proposals with a balance of moderate fare and driver fees, along with a lower sales tax, are favored.","[1, 2, 4, 5, 10, 11, 13, 14, 19, 20, 22, 23]"
Austin,"Austin is a community with a relatively lower median household income compared to the city average. Many residents may have limited disposable income, making affordability a key concern.","Given the lower income levels, discretionary spending is likely constrained. Residents prioritize essential expenses, so any increase in transportation costs could significantly impact their budget.","Austin has moderate access to public transit, but improvements in transit service could enhance accessibility. Many residents rely on public transportation, so policies that improve transit times and affordability are crucial.","Considering Austin's lower disposable income and constrained discretionary spending, policies with lower transit fares and minimal tax increases are preferred. Improved transit times are also important to enhance accessibility. Therefore, policies with a $0.75 fare and a 0.5% or 1.0% tax rate are prioritized, as they balance affordability and service improvement. Driver fees are acceptable if they significantly reduce car travel times, encouraging a shift to public transit.","[1, 2, 10, 11, 19, 20]"
West Garfield Park,West Garfield Park is a lower-income community with limited disposable income. Many residents rely on public transportation due to the high cost of car ownership.,"Given the limited disposable income, discretionary consumption is low. Residents prioritize essential expenses such as housing, food, and utilities.","Public transportation is a critical mode of transport for residents, but current transit times are long. Improving transit efficiency is important, but affordability must be maintained.","The community needs affordable transit options with improved service times. Lower fares and moderate driver fees can encourage transit use without significantly impacting disposable income. A lower sales tax is preferred to minimize the impact on essential consumption. Therefore, policies with a $0.75 fare, moderate driver fees, and a 0.5% or 1% sales tax are prioritized to balance affordability and service improvement.","[1, 2, 10, 11, 19, 20]"
East Garfield Park,East Garfield Park is a community with relatively low disposable income. Many residents may rely on public transportation due to limited financial resources for car ownership and maintenance.,"Given the lower disposable income, discretionary consumption is limited. Residents prioritize essential expenses, and any increase in transportation costs could significantly impact their budget.","Public transportation is crucial for residents to access jobs, education, and services. Improving transit times and maintaining affordable fares are important for the community's accessibility.","Considering the low disposable income and limited discretionary consumption, policies with lower transit fares and minimal sales tax increases are preferred. A moderate driver fee could be acceptable if it significantly improves transit times, as many residents rely on public transportation. The goal is to enhance transit accessibility without imposing a heavy financial burden on residents.","[1, 2, 10, 11, 19]"
Near West Side,"The Near West Side has a diverse population with varying income levels, including students, professionals, and lower-income residents. The disposable income varies significantly, but there is a substantial portion of the population that may be sensitive to increases in transportation costs.","Given the mixed-income nature of the community, discretionary spending is varied. However, many residents prioritize essential goods and services, and any increase in transportation costs could impact their ability to spend on non-essential items.","The Near West Side is well-served by public transit, with access to multiple bus and train lines. However, travel times can be long, and improvements in transit efficiency would be beneficial. Car ownership is moderate, and reducing congestion and travel times for drivers is also important.","The community would benefit from policies that improve transit efficiency and reduce travel times without significantly increasing costs. A lower transit fare would be beneficial for residents who rely on public transportation. Moderate driver fees could help reduce congestion and improve transit times. A balanced approach with a moderate sales tax would ensure transit services are adequately funded without overly burdening residents. Therefore, policies with lower fares, moderate driver fees, and moderate sales taxes are prioritized.","[1, 4, 10, 13, 19]"
North Lawndale,"North Lawndale has a relatively low average disposable income compared to other areas in Chicago. Many residents may be sensitive to increases in costs related to transportation, such as higher fares or driver fees.","Given the lower disposable income, discretionary consumption is likely limited. Residents may prioritize essential goods and services over discretionary spending, making them sensitive to any policy that significantly increases their transportation costs.","North Lawndale has moderate access to public transit, but improvements in transit times could significantly benefit residents who rely on public transportation. However, any increase in costs must be carefully weighed against the benefits of reduced travel times.","The community would benefit from policies that improve transit times without significantly increasing costs. Lower fares and moderate driver fees could encourage more residents to use public transit, reducing congestion and emissions. A lower sales tax would also be preferable to minimize the impact on disposable income. Therefore, policies with a $0.75 fare and a $0.5 driver fee, combined with a 0.5% or 1.0% sales tax, are likely to be the most beneficial for North Lawndale.","[1, 10, 19]"
South Lawndale,"South Lawndale has a relatively low median household income compared to other areas in Chicago, which means residents have limited disposable income.","Given the lower income levels, discretionary spending is likely constrained, with a focus on essential goods and services.","South Lawndale has moderate access to public transit, but improvements in transit services could significantly benefit the community by providing better access to jobs and services.","Considering the limited disposable income, policies with lower transit fares and minimal increases in sales tax are preferred to minimize the financial burden on residents. Additionally, policies that improve transit times without significantly increasing costs are prioritized to enhance accessibility. Therefore, proposals with a $0.75 fare and a 0.5% or 1.0% sales tax, combined with a $0.5 or $1.0 driving fee, are favored as they balance cost and service improvements.","[1, 2, 10, 11, 19, 20]"
Lower West Side,"The Lower West Side community area has a moderate to low average disposable income, with many residents working in service and manufacturing sectors. This means that any increase in transportation costs could significantly impact their budget.","Residents in the Lower West Side have limited discretionary spending, focusing primarily on essential goods and services. Therefore, policies that increase costs for transportation could reduce their ability to spend on other necessities.","The Lower West Side has decent access to public transit, but travel times are relatively long compared to driving. Improving transit times without significantly increasing costs would be beneficial for the community.","Given the moderate to low disposable income and limited discretionary spending, policies with lower fares and taxes are preferred to minimize financial strain. However, improving transit times is also crucial. Therefore, policies that balance lower costs with improved transit times are prioritized. A moderate driver fee is acceptable if it significantly reduces congestion and improves transit times, as many residents rely on public transportation.","[1, 2, 10, 11, 19]"
Loop,"The Loop is a central business district with a mix of high-income professionals and lower-income service workers. Disposable income varies significantly, but there is a substantial portion of residents with higher disposable income.","Residents in the Loop have a high level of discretionary consumption due to the presence of numerous dining, entertainment, and shopping options. However, the cost of living is also high, which can impact discretionary spending.","The Loop has excellent accessibility to resources and services, with extensive public transit options including buses and trains. Car ownership is less common due to the availability of public transit and the high cost of parking.","Given the Loop's strong public transit infrastructure and the presence of high-income residents, policies that enhance transit services while maintaining reasonable costs are preferred. A lower transit fare and moderate driver fees can encourage transit use and reduce congestion. A moderate sales tax is acceptable if it significantly improves transit services, as many residents can absorb the cost. Therefore, policies with a $0.75 fare and a $0.5 driver fee, combined with a 1% or 1.5% sales tax, are prioritized to balance cost and service improvement.","[10, 11, 19, 20]"
Near South Side,"The Near South Side is a diverse area with a mix of income levels, but generally has a higher average income compared to other areas in Chicago. Residents may have more disposable income to allocate towards transportation costs.","Given the higher average income, residents may have more discretionary spending, allowing for flexibility in absorbing additional costs from transportation policies.","The Near South Side has good access to public transit options, including buses and trains, making it feasible for residents to switch from driving to transit if incentivized properly.","Considering the higher disposable income and discretionary consumption, the community can absorb moderate increases in transit fares and driver fees if it results in improved transit services and reduced travel times. A balance between tax rates and fare/fee structures is crucial to ensure that the community benefits from enhanced transit services without overly burdening residents. Policies that reduce travel time significantly while maintaining reasonable costs are prioritized. Therefore, policies with moderate to high driver fees and moderate transit fares, coupled with a balanced tax rate, are preferred to encourage a shift from driving to transit, reduce congestion, and improve overall transit service quality.","[1, 2, 4, 5, 10, 11, 13, 14, 19, 20, 22, 23]"
Armour Square,"Armour Square has a moderate level of disposable income, with a mix of middle-income and lower-income households. Residents are sensitive to changes in transportation costs, as these can impact their overall budget for essential and discretionary spending.","The community has a moderate level of discretionary consumption, with residents spending on a variety of goods and services. However, any increase in transportation costs could reduce their ability to spend on non-essential items.","Armour Square has decent access to public transit, with several bus and train lines serving the area. However, travel times by transit are relatively long compared to driving, which is a concern for residents who rely on public transportation for commuting and accessing services.","Given the moderate disposable income and sensitivity to cost increases, policies with lower fares and taxes are preferred to minimize the financial burden on residents. Additionally, reducing travel times by transit is important to improve accessibility. Therefore, policies that balance lower costs with improved transit times are prioritized. A moderate driver fee is acceptable if it significantly reduces congestion and transit times, benefiting those who rely on public transportation.","[1, 2, 10, 11, 19]"
Douglas,"Douglas is a diverse community with a mix of income levels, but generally has a moderate to low average disposable income. Many residents may be sensitive to increases in costs related to transportation, such as higher fares or fees.","Given the moderate to low disposable income, discretionary consumption is likely limited. Residents may prioritize essential goods and services, making them sensitive to changes in transportation costs that could impact their budget for other necessities.","Douglas has decent access to public transit, with several bus and train lines serving the area. However, travel times by transit are relatively long compared to driving, which may influence residents' preferences for policies that improve transit efficiency and affordability.","Considering the moderate to low disposable income and limited discretionary consumption, policies with lower transit fares and minimal increases in sales tax and driving fees are preferred. These policies would help maintain affordability while potentially improving transit services. Additionally, reducing travel times by transit is important to enhance accessibility. Therefore, policies with a $0.75 fare and moderate driving fees, which also reduce travel times, are prioritized. A balance between improving transit services and maintaining affordability is crucial for the Douglas community.","[1, 2, 10, 11, 19, 20]"
Oakland,"Oakland is a community with moderate to low disposable income levels. Many residents may be sensitive to increases in transportation costs, whether through fares, fees, or taxes.","Given the moderate to low disposable income, discretionary consumption is likely limited. Residents may prioritize essential goods and services over discretionary spending.","Oakland has moderate access to public transit, but improvements in transit service could significantly benefit the community. Reducing travel times and costs would be advantageous.","Considering the community's moderate to low disposable income, it is important to keep transit fares and driving fees low to avoid burdening residents financially. A lower sales tax is also preferable to maintain discretionary spending. However, improving transit accessibility and reducing travel times is crucial. Therefore, proposals with lower fares and fees, and moderate improvements in travel times, are prioritized. Proposals with a 0.5% sales tax and $0.75 fare are favored, as they offer a balance between cost and improved transit service. Proposals with a $0.5 driving fee are also considered to encourage transit use and reduce congestion.","[1, 2, 10, 11, 19, 20]"
Fuller Park,"Fuller Park is one of the lower-income areas in Chicago, with limited disposable income among residents. Many residents rely on affordable transportation options.","Given the lower income levels, discretionary consumption is limited. Residents prioritize essential expenses, making affordability a key concern in transportation policy.","Fuller Park has moderate access to public transit, but improvements in transit services could significantly benefit residents. Many residents rely on public transit due to lower car ownership rates.","Considering the limited disposable income and the need for affordable transportation, policies with lower transit fares and minimal sales tax increases are preferred. A modest driver fee could be acceptable if it significantly improves transit times and services, as many residents rely on public transit. The goal is to balance affordability with improved transit accessibility.","[1, 2, 10, 11, 19]"
Grand Boulevard,"Grand Boulevard has a relatively lower average disposable income compared to other areas in Chicago. This means that residents are more sensitive to increases in costs, whether through transit fares, sales taxes, or driving fees.","Given the lower disposable income, discretionary consumption is limited. Residents prioritize essential goods and services, so any increase in transportation costs could significantly impact their budget for other necessities.","Grand Boulevard has moderate access to public transit, but improvements in transit services could greatly benefit the community by reducing travel times and increasing reliability. However, the community also has a significant number of car users, so driving fees need to be carefully considered.","The community would benefit from lower transit fares to make public transportation more affordable. A moderate sales tax is acceptable if it significantly improves transit services, but it should not be too high to avoid burdening residents. Driving fees should be minimal to avoid disproportionately affecting car users. Therefore, proposals with lower fares, moderate sales taxes, and minimal driving fees are prioritized. Proposals that significantly reduce travel times for both transit and driving are also favored.","[1, 4, 10, 13, 19]"
Kenwood,"Kenwood is a diverse community with a mix of income levels, but generally has a moderate to high disposable income due to its proximity to the University of Chicago and other affluent neighborhoods.","Residents in Kenwood have a moderate level of discretionary consumption, with spending on education, dining, and cultural activities being significant.","Kenwood has good access to public transportation, including buses and nearby train stations, but also has a significant number of residents who drive. The community values efficient and reliable transit options.","Given Kenwood's moderate to high disposable income, the community can handle a slight increase in sales tax if it significantly improves transit services. Lower transit fares are preferred to encourage public transportation use, but a moderate fare is acceptable if it results in better service. A moderate driver fee is also acceptable to reduce congestion and emissions, as long as it leads to improved transit times. Therefore, policies with a balance of moderate tax, fare, and driver fee that improve transit times are prioritized.","[10, 13, 14, 19, 22]"
Washington Park,"Washington Park is a community with relatively low disposable income, meaning residents are sensitive to increases in costs related to transportation, taxes, and fees.","Given the lower disposable income, discretionary consumption is limited. Residents prioritize essential expenses, so any increase in transportation costs could significantly impact their budget.","Washington Park has moderate access to public transit, but improvements in transit times could enhance accessibility. Many residents rely on public transit, so lower fares and improved services are beneficial.","Considering the low disposable income and limited discretionary consumption, policies with lower transit fares and minimal increases in sales tax and driving fees are preferred. These policies should also aim to improve transit times to enhance accessibility. Therefore, proposals with a $0.75 fare and a 0.5% or 1.0% sales tax, combined with a $0.5 driving fee, are prioritized as they balance affordability and improved transit service.","[1, 2, 10, 11, 19, 20]"
Hyde Park,"Hyde Park is a diverse community with a mix of students, professionals, and long-term residents. The disposable income varies, but there is a significant portion of the population with moderate to high disposable income due to the presence of the University of Chicago and other institutions.","The community has a relatively high level of discretionary consumption, with residents spending on education, dining, cultural activities, and housing. The presence of students and professionals means that there is a focus on affordable living costs.","Hyde Park has good access to public transportation, including buses and Metra trains, which connect residents to downtown Chicago and other areas. Car ownership is moderate, and many residents rely on public transit for commuting.","Given the community's reliance on public transportation and the need to balance costs, proposals with lower transit fares and moderate driver fees are preferred. A lower sales tax is also favorable to maintain discretionary spending. Proposals that improve transit times without significantly increasing costs are prioritized. The community would benefit from reduced congestion and improved transit services, so a moderate driver fee is acceptable if it leads to better transit options.","[1, 2, 4, 5, 10]"
