community_area,disposable_income,discretionary_consumption,accessibility,decision_rationale,vote
Woodlawn,"Woodlawn has a relatively lower average disposable income compared to other areas in Chicago. This means that residents are more sensitive to increases in costs, whether through transit fares, sales taxes, or driving fees.","Given the lower disposable income, discretionary consumption is limited. Residents prioritize essential goods and services, so any increase in transportation costs could significantly impact their budget.","Woodlawn has moderate access to public transit, but improvements in transit services could greatly benefit the community by reducing travel times and increasing accessibility to jobs and services.","Considering the lower disposable income and limited discretionary consumption, policies with lower transit fares and minimal sales tax increases are preferred. However, improving transit times is also crucial for accessibility. Therefore, policies that balance lower costs with improved transit times are prioritized. A moderate driving fee is acceptable if it significantly reduces car travel time and improves transit services, as many residents rely on public transit.","[1, 2, 10, 11, 19]"
South Shore,"South Shore has a moderate to low average disposable income, with many residents relying on public transportation for commuting. The community is sensitive to increases in costs that could impact their overall budget for essential and discretionary spending.","The community's discretionary consumption is limited, with a significant portion of income allocated to essential expenses. Any increase in transportation costs could reduce the ability to spend on non-essential goods and services.","South Shore has decent access to public transportation, but improvements in transit times and reliability could significantly benefit the community. Many residents depend on public transit, so policies that enhance transit services without significantly increasing costs are preferred.","Given the community's reliance on public transit and sensitivity to cost increases, policies with lower fares and moderate taxes are preferred. A balance between improving transit services and maintaining affordability is crucial. Policies with higher driver fees are acceptable if they lead to reduced congestion and improved transit times, benefiting the majority of residents who use public transit.","[1, 2, 10, 11, 19, 20]"
Chatham,"Chatham is a middle-income community with a significant portion of residents relying on fixed incomes, such as pensions and social security. The community is sensitive to changes in disposable income due to limited financial flexibility.","Residents in Chatham prioritize essential spending on housing, food, and healthcare, with limited discretionary spending. Any increase in transportation costs could significantly impact their ability to afford other necessities.","Chatham has moderate access to public transit, with many residents relying on it for commuting. However, transit times are relatively long, and improvements in transit efficiency could benefit the community. Car ownership is moderate, and driving is a common mode of transportation for those who can afford it.","Given the community's sensitivity to income changes, policies with lower fares and taxes are preferred to minimize financial strain. However, improving transit efficiency is also important to reduce travel times. Therefore, policies with moderate driver fees that encourage a shift from driving to transit, reducing congestion and emissions, are favorable. Balancing these factors, policies with a 0.5% or 1.0% tax, lower fares, and moderate driver fees are prioritized to enhance transit services without significantly impacting disposable income.","[1, 2, 4, 5, 10, 11, 13, 14]"
Avalon Park,"Avalon Park is a middle-income community with a moderate level of disposable income. Residents are sensitive to changes in transportation costs, as these can impact their overall budget for essential and discretionary spending.","The community has a balanced level of discretionary consumption, with residents spending on a mix of necessities and leisure activities. Any increase in transportation costs could reduce their ability to spend on non-essential goods and services.","Avalon Park has moderate accessibility to resources and services. Public transit is a crucial mode of transportation for many residents, but driving is also common. Improvements in transit services could benefit the community, but not at the expense of significantly higher costs.","Given the community's moderate disposable income and balanced discretionary consumption, policies that maintain or slightly reduce transit fares while keeping taxes and driving fees reasonable are preferred. The community would benefit from improved transit services, but not at the cost of significantly higher taxes or driving fees. Therefore, proposals with lower fares and moderate taxes and fees are prioritized to ensure affordability and accessibility.","[1, 2, 4, 5, 10, 11, 13, 14, 19, 20, 22, 23]"
South Chicago,"South Chicago has a relatively lower median household income compared to the city average, which means residents have less disposable income to spend on transportation costs.","Given the lower income levels, discretionary spending is limited, and residents are likely to prioritize essential goods and services over higher transportation costs.","South Chicago has moderate access to public transit, but improvements in transit services could significantly benefit the community by reducing travel times and increasing accessibility to jobs and services.","Considering the lower disposable income and limited discretionary spending, policies with lower transit fares and moderate driver fees are preferred to minimize the financial burden on residents. A lower sales tax is also favored to avoid reducing disposable income further. However, improving transit times is crucial, so a balance between cost and service improvement is necessary. Policies that offer reduced travel times without significantly increasing costs are prioritized.","[1, 2, 10, 11, 19]"
Burnside,"Burnside is a lower-income community area, with many residents having limited disposable income. This means that any increase in costs, whether through transit fares, sales taxes, or driving fees, could significantly impact their financial situation.","Given the limited disposable income, discretionary consumption is likely to be low. Residents prioritize essential expenses, and any additional costs from transportation policies could reduce their ability to spend on non-essential goods and services.","Burnside has moderate access to public transit, but improvements in transit services could benefit the community by reducing travel times and increasing reliability. However, many residents may still rely on driving due to the current transit limitations.","Considering the financial constraints of Burnside residents, policies with lower transit fares and minimal sales tax increases are preferable. Additionally, moderate driving fees could be acceptable if they lead to significant improvements in transit services, as this could encourage a shift from driving to transit, reducing congestion and emissions. The goal is to balance affordability with improved accessibility and service quality.","[1, 2, 10, 11, 19]"
Calumet Heights,"Calumet Heights is a middle-income community with a moderate level of disposable income. Residents are sensitive to changes in transportation costs, as these can impact their overall budget for other essential and discretionary expenses.","The community has a balanced level of discretionary consumption, with residents spending on a mix of necessities and non-essential goods. Any increase in transportation costs could reduce their ability to spend on discretionary items.","Calumet Heights has moderate accessibility to resources and services. Public transit is a crucial mode of transportation for many residents, but driving is also common. Improvements in transit services could benefit the community, but not at the expense of significantly higher costs.","Given the community's moderate disposable income and balanced discretionary consumption, policies that maintain or slightly reduce transit fares while keeping taxes and driving fees low are preferred. This approach ensures that residents can continue to afford essential and discretionary goods while benefiting from improved transit services. Policies with a 0.5% sales tax and lower transit fares are prioritized, as they offer a balance between cost and service improvement. Driving fees are considered acceptable if they lead to significant reductions in travel time, benefiting both drivers and transit users.","[0, 1, 3, 4, 9, 10, 12, 13]"
Roseland,Roseland is a community with a relatively lower median household income compared to the city average. This means that residents have less disposable income to spend on transportation and other services.,"Given the lower income levels, discretionary spending is limited. Residents are likely to prioritize essential goods and services, making affordability a key consideration in transportation policy.","Roseland has moderate access to public transit, but improvements in transit service could significantly benefit the community by reducing travel times and increasing access to employment and services.","Given the lower disposable income and limited discretionary spending, policies with lower transit fares and minimal increases in sales tax are preferred to minimize financial burden. However, improving transit accessibility is also important, so some increase in driver fees is acceptable if it leads to better transit services and reduced travel times. Policies with a $0.75 fare and a 0.5% or 1.0% sales tax, combined with a $0.50 driver fee, strike a balance between affordability and improved transit service.","[1, 2, 10, 11, 19, 20]"
Pullman,"Pullman is a community with moderate to low disposable income levels. Many residents may be sensitive to increases in costs related to transportation, such as higher fares or driver fees.","Given the moderate to low disposable income, discretionary consumption is likely limited. Residents may prioritize essential goods and services over discretionary spending.","Pullman has moderate access to public transit, but improvements in transit times could significantly benefit residents who rely on public transportation for commuting and accessing services.","Considering Pullman's moderate to low disposable income, policies with lower transit fares and moderate driver fees are preferred to minimize financial burden. A moderate sales tax is acceptable if it significantly improves transit services, as many residents rely on public transportation. Policies that reduce transit times are prioritized to enhance accessibility and convenience for residents. Therefore, proposals with a balance of lower fares, moderate driver fees, and reasonable sales tax rates that improve transit times are favored.","[1, 2, 4, 5, 10, 11, 13, 14, 19, 20, 22, 23]"
South Deering,"South Deering is a lower-income community with limited disposable income. Residents are sensitive to increases in costs, whether through fares, fees, or taxes.","Given the limited disposable income, discretionary consumption is low. Residents prioritize essential goods and services, so any increase in transportation costs could significantly impact their budget.","South Deering has limited access to public transit options, making it crucial to improve transit services without significantly increasing costs. Many residents rely on driving due to the lack of efficient public transit.","The community needs to balance between improving transit services and keeping costs low. Lower fares and taxes are preferred to minimize the financial burden on residents. However, some increase in driver fees could be acceptable if it leads to significant improvements in transit times and services, encouraging a shift from driving to transit. Proposals with a 0.5% tax and $0.75 fare are favored, as they offer a balance between cost and service improvement. Driver fees are considered if they lead to reduced congestion and better transit times.","[0, 1, 9, 10, 18]"
East Side,"The East Side community area has a moderate to low disposable income, with many residents working in blue-collar jobs. This means that any increase in costs, whether through transit fares, sales taxes, or driving fees, could significantly impact their budget.","Given the moderate to low disposable income, discretionary consumption is limited. Residents prioritize essential goods and services, so any policy that increases their cost of living could reduce their ability to spend on non-essential items.","The East Side has moderate accessibility to resources and services. Public transit is a crucial mode of transportation for many residents, but driving is also common. Policies that improve transit times without significantly increasing costs would be beneficial.","Considering the community's moderate to low disposable income and limited discretionary consumption, policies with lower transit fares and minimal sales tax increases are preferred. Additionally, reducing travel times for both transit and driving is important. Therefore, policies that balance lower costs with improved transit times are prioritized. A moderate driving fee is acceptable if it significantly reduces travel times, as this could encourage a shift from driving to transit, reducing congestion and emissions.","[1, 2, 10, 11, 19]"
West Pullman,"West Pullman is a community with a relatively lower median household income compared to the city average. This means that residents have less disposable income, making them sensitive to increases in costs such as transit fares, sales taxes, and driving fees.","Given the lower disposable income, discretionary consumption is limited. Residents prioritize essential expenses, so any increase in transportation costs could significantly impact their ability to spend on other necessities.","West Pullman has moderate access to public transit, but travel times are relatively long. Improving transit times could benefit residents, but affordability remains a key concern. Many residents rely on driving, so driver fees could also impact them significantly.","The community would benefit from policies that lower transit fares and maintain or slightly increase driver fees to improve transit services without significantly impacting disposable income. A lower sales tax is preferred to minimize the impact on discretionary consumption. Therefore, policies with a $0.75 transit fare, a 0.5% sales tax, and a $0.50 or $1.00 driver fee are prioritized, as they offer improved transit times and services while keeping costs manageable for residents.","[1, 2, 10, 11, 19, 20]"
Riverdale,"Riverdale is one of the lower-income areas in Chicago, with a significant portion of the population living below the poverty line. Disposable income is limited, making affordability a key concern.","Given the limited disposable income, discretionary consumption is low. Residents prioritize essential goods and services, and any increase in transportation costs could significantly impact their budget.","Riverdale has limited access to resources and services, with public transit being a crucial mode of transportation for many residents. Improving transit accessibility and reducing travel times are important for the community.","Considering Riverdale's low disposable income and reliance on public transit, policies with lower transit fares and minimal sales tax increases are preferred. A modest driver fee could be acceptable if it significantly improves transit times, as many residents rely on public transit. The goal is to balance affordability with improved transit service, without imposing a heavy financial burden on residents.","[1, 2, 10, 11, 19, 20]"
Hegewisch,"Hegewisch is a working-class neighborhood with moderate disposable income levels. Residents are sensitive to increases in costs, whether through taxes, fares, or fees.","The community has limited discretionary consumption, with a focus on essential goods and services. Any increase in transportation costs could significantly impact their budget for other necessities.","Hegewisch has limited public transit options, making car travel a necessity for many residents. Improving transit times could benefit those who rely on public transportation, but not at the expense of significantly higher costs.","Given the moderate income levels and limited discretionary spending, policies with lower fares and taxes are preferred to minimize financial strain. However, improving transit times is also important. Therefore, policies that balance lower costs with improved transit times are prioritized. A moderate increase in driver fees is acceptable if it significantly reduces car travel time, as this could benefit those who drive. The focus is on maintaining affordability while enhancing transit efficiency.","[1, 2, 10, 11, 19]"
Garfield Ridge,"Garfield Ridge is a middle-income community with a moderate level of disposable income. Residents are sensitive to changes in transportation costs, as these can impact their overall budget for other essential and discretionary expenses.","The community has a balanced level of discretionary consumption, with residents spending on a mix of necessities and leisure activities. Any increase in transportation costs could reduce their ability to spend on non-essential goods and services.","Garfield Ridge has moderate accessibility to resources and services. Public transit options are available but not as extensive as in more central areas. Many residents rely on driving for daily commutes, so policies that significantly increase driving costs could be burdensome.","Given the community's moderate disposable income and reliance on both driving and transit, policies that maintain or slightly reduce transit fares while not excessively increasing driving fees are preferred. A lower sales tax is also favorable to avoid reducing disposable income significantly. Therefore, policies with a 0.5% sales tax, lower transit fares, and moderate driving fees are prioritized. These options balance the need for improved transit services with the community's financial constraints and transportation habits.","[1, 2, 4, 5, 10, 11, 13, 14, 19, 20, 22, 23]"
Archer Heights,"Archer Heights is a middle-income community with a moderate level of disposable income. Residents are sensitive to changes in transportation costs, as these can impact their overall budget for essential and discretionary spending.","The community has a balanced level of discretionary consumption, with residents spending on a mix of necessities and non-essential goods. Any increase in transportation costs could reduce their ability to spend on other goods and services.","Archer Heights has moderate accessibility to resources and services. Public transit is a viable option for many residents, but driving is also common. Reducing travel time and improving transit services would benefit the community.","Given the community's moderate disposable income and balanced discretionary consumption, policies that minimize additional financial burdens while improving transit services are preferred. Lower transit fares and moderate driver fees are favorable, as they encourage transit use without significantly impacting budgets. A moderate sales tax is acceptable if it leads to better transit services. Policies that reduce travel time for both transit and driving are prioritized to improve accessibility.","[1, 4, 10, 13, 19]"
Brighton Park,"Brighton Park is a working-class neighborhood with a moderate to low average disposable income. Many residents rely on public transportation for commuting, and any increase in costs could significantly impact their budget.","Residents in Brighton Park have limited discretionary income, meaning that increases in transportation costs could reduce their ability to spend on other essential goods and services.","Brighton Park has moderate access to public transportation, with many residents depending on it for daily commuting. Improving transit times and maintaining affordable fares are crucial for the community.","Given the moderate to low disposable income and limited discretionary consumption, policies with lower transit fares and minimal increases in sales tax and driving fees are preferred. The community would benefit from improved transit times, but not at the expense of significantly higher costs. Therefore, policies that balance improved transit times with affordable costs are prioritized.","[1, 2, 10, 11, 19, 20]"
McKinley Park,"McKinley Park is a middle-income community with a moderate level of disposable income. Residents are sensitive to changes in transportation costs, as these can impact their overall budget for other essential and discretionary expenses.","The community has a balanced level of discretionary consumption, with residents spending on a mix of necessities and leisure activities. Any increase in transportation costs could reduce their ability to spend on non-essential goods and services.","McKinley Park has decent access to public transit, but improvements in transit times and reliability could benefit the community. Many residents rely on both public transit and driving, so policies that improve transit without significantly increasing costs are preferred.","Given the community's moderate disposable income and balanced discretionary consumption, policies that maintain or reduce transit fares while slightly increasing driver fees could be beneficial. This would encourage a shift from driving to transit, reducing congestion and emissions, while keeping costs manageable for residents. A moderate sales tax is acceptable if it leads to better transit services. Therefore, policies with lower transit fares and moderate driver fees, combined with a reasonable sales tax, are prioritized.","[1, 2, 10, 11, 19, 20]"
Bridgeport,"Bridgeport is a diverse community with a mix of income levels, but generally has a moderate disposable income. Residents are sensitive to increases in costs, whether through taxes, fares, or fees.","The community has a moderate level of discretionary consumption. Residents prioritize essential goods and services, and any increase in transportation costs could impact their ability to spend on non-essential items.","Bridgeport has decent access to public transit, with several bus lines and proximity to the CTA Red Line. However, driving is also common, and many residents rely on both modes of transportation.","Given the moderate disposable income and discretionary consumption, policies with lower fares and taxes are preferred to minimize financial strain. However, improving transit times is also important to enhance accessibility. Therefore, policies that balance lower costs with improved transit times are prioritized. A moderate driver fee is acceptable if it significantly reduces car travel time and improves transit service, as this could encourage a shift to public transit, reducing congestion and emissions.","[1, 2, 10, 11, 19]"
New City,"New City is a working-class neighborhood with a moderate to low average disposable income. Residents are sensitive to increases in costs, whether through taxes, fares, or fees.","Given the moderate to low disposable income, discretionary consumption is limited. Residents prioritize essential goods and services, and any increase in transportation costs could significantly impact their budget.","New City has moderate access to public transit, but many residents rely on driving due to the need to reach jobs and services not easily accessible by transit. Reducing travel time and costs is crucial for improving accessibility.","The community's interest is best served by policies that minimize costs while improving transit service and reducing travel times. Lower fares and moderate driver fees can encourage transit use without overly burdening drivers. A lower sales tax is preferred to avoid reducing disposable income further. Therefore, policies with a 0.5% sales tax, lower fares, and moderate driver fees are prioritized. These options balance the need for improved transit services with the community's financial constraints.","[1, 2, 4, 5, 7, 8, 10, 11, 13, 14, 16, 17, 19, 20, 22, 23, 25, 26]"
West Elsdon,"West Elsdon is a middle-income community with a moderate level of disposable income. Residents are sensitive to changes in transportation costs, as these can impact their overall budget for essential and discretionary spending.","The community has a balanced level of discretionary consumption, with residents spending on a mix of necessities and non-essential goods. Any increase in transportation costs could reduce their ability to spend on other goods and services.","West Elsdon has moderate accessibility to resources and services. Public transit is a crucial mode of transportation for many residents, but driving is also common. Reducing travel times and improving transit services are important for the community.","Given the community's moderate disposable income and balanced discretionary consumption, policies that maintain or reduce transit fares and driving fees are preferred to minimize financial strain. A lower sales tax is also favored to preserve disposable income. Improving transit times is important, but not at the expense of significantly higher costs. Therefore, proposals with lower fares and fees, and moderate tax rates, that also offer improved transit times, are prioritized.","[1, 2, 10, 11, 19]"
