community_area,disposable_income,discretionary_consumption,accessibility,decision_rationale,vote,rank1,rank2,rank3,rank4,rank5
Sharpstown,"Sharpstown has a moderate to low disposable income level, with many residents working in service and retail sectors.","Residents in Sharpstown tend to have limited discretionary spending, focusing primarily on essential goods and services.","Sharpstown has moderate accessibility to public transit, but many residents rely on personal vehicles due to the spread-out nature of the area and the need to access jobs and services across the city.","Given Sharpstown's moderate to low disposable income, policies with lower transit fares and driving fees are preferred to minimize the financial burden on residents. A lower sales tax is also favored to preserve discretionary spending. However, improving transit times is crucial to enhance accessibility and reduce reliance on personal vehicles. Therefore, proposals that balance lower costs with improved transit times are prioritized. The top-ranked proposals offer reduced travel times for both transit and driving, with manageable costs, thus providing a balanced approach to improving transportation without significantly impacting residents' financial stability.","[1, 8, 3, 10, 19]",1,8,3,10,19
Gulfton,"Gulfton is a lower-income neighborhood with many residents working in low-wage jobs, meaning disposable income is limited.","Residents in Gulfton have limited discretionary spending, focusing primarily on essential goods and services.","Gulfton has moderate access to public transit, but many residents rely on it due to lower car ownership rates compared to other neighborhoods.","Given the limited disposable income and reliance on public transit, proposals with lower transit fares and moderate driver fees are prioritized to minimize financial burden while improving transit services. A lower sales tax is preferred to avoid further reducing disposable income. The top-ranked proposals balance these factors by offering reduced transit fares and moderate driver fees, which can improve transit times and accessibility without significantly increasing costs for residents.","[0, 7, 10, 2, 13]",0,7,10,2,13
West University Place,West University Place is a relatively affluent neighborhood with a high average disposable income.,"Residents in West University Place have a high level of discretionary consumption, often spending on luxury goods, services, and experiences.","The neighborhood has good accessibility to resources and services, with a high rate of car ownership and relatively less reliance on public transit.","Given the high disposable income and discretionary consumption, residents can afford higher transit fares and driver fees if it results in better services and reduced travel times. The focus is on reducing travel time and improving transit services, even if it means a higher sales tax, as the community can absorb these costs. The preference is for policies that significantly reduce travel times for both driving and transit, as this aligns with the community's preference for efficiency and convenience.","[23, 20, 17, 14, 11]",23,20,17,14,11
Westwood,"Westwood has a relatively low to moderate disposable income, with many residents working in service and blue-collar jobs.","Residents in Westwood have limited discretionary spending, prioritizing essential goods and services over luxury items.","Westwood has moderate access to public transit, but many residents rely on personal vehicles due to the spread-out nature of resources and services.","Given the moderate disposable income and limited discretionary spending, it is crucial to minimize additional financial burdens on residents. Therefore, lower transit fares and driving fees are preferred to keep transportation affordable. A moderate sales tax is acceptable if it significantly improves transit services, as this could reduce reliance on personal vehicles and lower overall transportation costs. The selected policies aim to balance affordability with improved transit efficiency, considering the community's reliance on both transit and personal vehicles.","[7, 10, 2, 19, 13]",7,10,2,19,13
Braeburn,"Braeburn has a moderate to low disposable income, with many residents working in service and blue-collar jobs.","Residents in Braeburn have limited discretionary spending, prioritizing essential goods and services.","Braeburn has moderate access to public transit, but many residents rely on personal vehicles due to the spread-out nature of the area and limited transit options.","Given the moderate to low disposable income, it is crucial to minimize additional financial burdens on residents. Lower transit fares and driving fees are preferred to keep transportation affordable. A moderate sales tax is acceptable if it significantly improves transit services, as this could reduce reliance on personal vehicles and lower overall transportation costs. The top-ranked proposals balance lower costs with improved transit times, considering the community's reliance on both driving and public transit.","[1, 7, 10, 16, 19]",1,7,10,16,19
Meyerland,Meyerland is a middle to upper-middle-class neighborhood with relatively high disposable income levels.,"Residents in Meyerland have a moderate to high level of discretionary consumption, often spending on dining, leisure, and education.","Meyerland has decent accessibility to resources and services, but public transit options are limited compared to driving, which is the preferred mode of transportation for many residents.","Given the higher disposable income and preference for driving, Meyerland residents would likely prefer policies that minimize additional costs while improving transit options to reduce congestion. A lower sales tax is preferred to maintain discretionary spending. A moderate driving fee is acceptable if it significantly reduces travel time and congestion. Therefore, policies with a 0.5% sales tax, moderate driving fees, and reduced transit times are prioritized. The top choice is option 1, which offers the lowest transit fare and driving fee combination with significant reductions in travel time. Option 3 is next, balancing a moderate fare with a higher driving fee for better transit times. Option 5 is chosen for its balance of costs and reduced travel times. Option 8 is selected for its low fare and moderate driving fee, offering good transit time reductions. Finally, option 11 is chosen for its balance of moderate fare and driving fee with significant transit time improvements.","[1, 3, 5, 8, 11]",1,3,5,8,11
Braeswood,Braeswood is a middle to upper-middle-income neighborhood with a relatively high disposable income compared to other areas in Houston.,"Residents in Braeswood have a moderate to high level of discretionary consumption, often spending on dining, entertainment, and leisure activities.","Braeswood has good accessibility to resources and services, with a mix of transit options and a high rate of car ownership, making driving a common mode of transportation.","Given the relatively high disposable income and discretionary consumption, Braeswood residents can afford moderate increases in transit fares and driving fees if it results in better transit services and reduced travel times. The neighborhood's good accessibility by car suggests that policies reducing car travel time and improving transit efficiency would be beneficial. Therefore, proposals with moderate sales tax, lower transit fares, and moderate driving fees are prioritized to balance cost and service improvements. The focus is on reducing travel times for both transit and driving while maintaining affordability.","[1, 8, 3, 11, 19]",1,8,3,11,19
Medical Center,The Medical Center neighborhood has a relatively high disposable income due to the presence of healthcare professionals and researchers.,"Residents in the Medical Center area have moderate to high discretionary consumption, with spending on dining, entertainment, and healthcare services.","The area has good accessibility to resources and services, with a strong reliance on both public transit and personal vehicles due to the presence of the Texas Medical Center.","Given the high disposable income, residents can afford a moderate increase in transit fares and driving fees if it results in better transit services and reduced travel times. The focus is on improving transit times to support the large number of healthcare workers who rely on public transportation. A moderate sales tax is acceptable if it significantly enhances transit services. The top-ranked proposals prioritize reducing transit travel time and maintaining a balance between fare, tax, and driving fee to ensure affordability and improved service.","[1, 3, 11, 17, 20]",1,3,11,17,20
Astrodome Area,"The Astrodome Area has a moderate level of disposable income, with a mix of middle-income households and some lower-income residents.","Residents in the Astrodome Area have moderate discretionary spending, with a focus on essential goods and services, and some spending on leisure and entertainment.","The Astrodome Area has decent accessibility to resources and services, with a reliance on both public transit and personal vehicles for commuting and daily activities.","Given the moderate disposable income, it is important to balance the cost of transit fares and driving fees with the benefits of reduced travel times and improved transit services. Lower fares and fees are preferred to minimize the financial burden on residents, while moderate sales tax rates are acceptable if they significantly improve transit services. The focus is on reducing travel times for both transit and driving, as well as maintaining affordability for residents. Proposals with lower fares and fees, and moderate improvements in travel times, are prioritized to ensure accessibility and affordability.","[1, 8, 3, 10, 19]",1,8,3,10,19
South Main,"South Main has a moderate level of disposable income, with a mix of middle-income households and some lower-income residents.","Residents in South Main have moderate discretionary spending, with a focus on essential goods and services, and some spending on leisure and non-essential items.","South Main has decent access to public transit, but many residents rely on driving due to the spread-out nature of resources and services.","Given the moderate disposable income, it's important to balance costs with benefits. Lower transit fares and moderate driver fees can encourage transit use without overly burdening drivers. A moderate sales tax is acceptable if it significantly improves transit times. The focus is on reducing travel times and costs for both transit users and drivers, while ensuring that the community can still afford other essential goods and services. Proposals with lower fares and moderate driver fees are prioritized to encourage a shift to transit, reduce congestion, and improve overall accessibility.","[1, 8, 3, 10, 19]",1,8,3,10,19
Brays Oaks,"Brays Oaks has a moderate to low disposable income, with many residents working in service and blue-collar jobs.","Residents in Brays Oaks have limited discretionary spending, prioritizing essential goods and services.","The area has moderate accessibility to public transit, but many residents rely on personal vehicles due to the spread-out nature of services and employment centers.","Given the moderate to low disposable income, it is crucial to minimize additional financial burdens on residents. Lower transit fares and driving fees are preferred to maintain affordability. A moderate sales tax is acceptable if it significantly improves transit services, as this could reduce reliance on personal vehicles and improve accessibility. The top-ranked proposals balance lower costs with improved transit times, considering the community's reliance on both driving and public transit.","[1, 8, 3, 10, 19]",1,8,3,10,19
Westbury,"Westbury has a moderate disposable income level, with a mix of middle-income families and some lower-income households.","Residents in Westbury have moderate discretionary spending, with a focus on essential goods and services, and some spending on leisure and non-essential items.","Westbury has moderate accessibility to resources and services, with some reliance on both public transit and personal vehicles for commuting and daily activities.","Given Westbury's moderate income levels, it is important to balance affordability with improved transit services. Lower fares and moderate driver fees can encourage transit use without overly burdening residents financially. A moderate sales tax is acceptable if it significantly improves transit times and accessibility. The focus is on reducing travel times and costs for both transit users and drivers, while ensuring that the financial impact on residents is manageable. Proposals with lower fares and moderate driver fees are prioritized to encourage a shift from driving to transit, reducing congestion and emissions.","[1, 8, 3, 10, 19]",1,8,3,10,19
Willow Meadows / Willowbend,Willow Meadows / Willowbend is a middle-income neighborhood with moderate disposable income levels.,"Residents have a balanced discretionary consumption pattern, spending on essentials and some luxury items.","The neighborhood has moderate accessibility to resources and services, with a reliance on both driving and public transit.","Given the moderate disposable income, it is important to keep costs low for both transit and driving. A lower transit fare and driving fee are preferred to maintain affordability. The neighborhood benefits from reduced travel times, so proposals that decrease travel time for both modes are prioritized. A moderate sales tax is acceptable if it significantly improves transit service, as it can encourage a shift from driving to transit, reducing congestion and emissions. Therefore, proposals with a balance of lower fares, moderate sales tax, and reduced travel times are ranked higher.","[1, 8, 3, 10, 19]",1,8,3,10,19
Fondren Gardens,"Fondren Gardens has a moderate disposable income level, with many residents working in middle-income jobs.","Residents in Fondren Gardens have limited discretionary spending, focusing primarily on essential goods and services.","Fondren Gardens has moderate accessibility to resources and services, with a reliance on both public transit and personal vehicles for commuting.","Given the moderate disposable income and limited discretionary spending, it is important to minimize additional financial burdens on residents. Therefore, lower transit fares and driving fees are preferred to keep transportation affordable. Additionally, reducing travel times is crucial to improve accessibility and quality of life. The selected policies balance these factors by offering reduced travel times and costs, while maintaining a reasonable sales tax to support transit improvements.","[1, 8, 3, 10, 19]",1,8,3,10,19
Central Southwest,"Central Southwest has a moderate disposable income level, with many residents working in blue-collar and service jobs.","Residents in Central Southwest tend to prioritize essential spending, with limited discretionary income for non-essential goods and services.","The area has moderate access to public transit, but many residents rely on personal vehicles due to the spread-out nature of resources and services.","Given the moderate disposable income, it is important to keep costs low for both transit users and drivers. A lower transit fare and driving fee would benefit residents who rely on both modes of transportation. A moderate sales tax is acceptable if it significantly improves transit services, as this could reduce travel times and improve accessibility. The top-ranked proposals balance lower costs with improved transit times, considering the community's reliance on both driving and public transit.","[1, 8, 3, 10, 19]",1,8,3,10,19
Fort Bend / Houston,"Fort Bend / Houston has a moderate to high disposable income level, with many residents having the financial flexibility to absorb slight increases in transportation costs.","The community has a diverse range of discretionary spending habits, with a significant portion of income allocated to housing, education, and leisure activities.","The area has decent accessibility to resources and services, but improvements in transit times could enhance connectivity and reduce reliance on personal vehicles.","Given the moderate to high disposable income, the community can handle a slight increase in sales tax if it results in significant improvements in transit times. Reducing transit times is crucial for enhancing accessibility and encouraging a shift from driving to public transit, which can alleviate congestion and reduce emissions. Therefore, proposals with lower transit fares and moderate driver fees are prioritized, as they offer a balance between cost and improved service. A moderate sales tax is acceptable if it leads to better transit services, as the community can absorb this cost without significantly impacting discretionary consumption.","[8, 11, 19, 17, 22]",8,11,19,17,22
IAH Airport,"The IAH Airport super neighborhood has a moderate disposable income, with many residents working in airport-related industries.","Residents have moderate discretionary consumption, with spending focused on essential goods and services due to the nature of employment in the area.","The area has good accessibility to resources and services by car, but transit options are less efficient, leading to longer travel times.","Given the moderate disposable income, it is important to keep costs low for both transit and driving. Reducing travel time is also crucial to improve accessibility. Therefore, proposals with lower fares and fees, and moderate tax rates are preferred. The focus is on balancing cost savings with improved transit times to encourage a shift from driving to transit, which can reduce congestion and emissions. Proposals with a 0.5% tax rate are favored to minimize the impact on discretionary consumption, while still improving transit services.","[1, 0, 3, 2, 5]",1,0,3,2,5
Kingwood,Kingwood is a relatively affluent area with higher than average disposable income compared to other Houston neighborhoods.,"Residents in Kingwood have a higher level of discretionary consumption, often spending on leisure, dining, and other non-essential goods and services.","Kingwood has limited public transit options, with most residents relying on personal vehicles for commuting and accessing services.","Given Kingwood's higher disposable income and reliance on personal vehicles, the community would benefit from policies that improve transit times without significantly increasing costs. A lower transit fare and moderate driver fee could encourage some residents to switch to transit, reducing congestion. However, a higher sales tax would be less favorable due to its impact on discretionary spending. Therefore, proposals with lower fares and moderate driver fees, combined with a moderate sales tax, are prioritized to balance improved transit service with minimal impact on disposable income.","[1, 3, 8, 10, 19]",1,3,8,10,19
Lake Houston,Lake Houston is a relatively affluent area with higher than average disposable income levels.,"Residents in Lake Houston have a moderate to high level of discretionary consumption, often spending on leisure, dining, and recreational activities.","The area has limited public transit options, with most residents relying on personal vehicles for commuting and accessing services.","Given the higher disposable income, residents can afford moderate increases in transit fares and driving fees if it results in significantly improved transit services and reduced travel times. However, a balance must be struck to ensure that the cost does not overly burden those who rely on driving. The focus is on reducing travel times and improving transit services to encourage a shift from driving to public transit, which can alleviate congestion and reduce emissions. Therefore, proposals with moderate sales tax and driving fees, coupled with reduced travel times, are prioritized.","[1, 3, 8, 11, 19]",1,3,8,11,19
Northside / Northline,The Northside / Northline neighborhood generally has a lower disposable income compared to other areas in Houston.,"Residents in this area tend to prioritize essential spending, with limited discretionary consumption due to lower income levels.","The neighborhood has moderate access to public transit, but improvements in transit times could significantly benefit residents who rely on public transportation.","Given the lower disposable income, it is crucial to minimize additional financial burdens on residents. Therefore, proposals with lower transit fares and driving fees are preferred. However, improving transit times is also important to enhance accessibility. Balancing these factors, proposals with a moderate sales tax and lower fares and fees are prioritized to ensure affordability while improving transit services. The selected proposals aim to reduce travel times and costs for both transit users and drivers, while not significantly increasing the financial burden through taxes.","[1, 7, 10, 16, 19]",1,7,10,16,19
Jensen,The Jensen super neighborhood has a relatively low disposable income compared to other areas in Houston.,"Residents in Jensen have limited discretionary consumption, focusing primarily on essential goods and services.","Jensen has moderate accessibility to resources and services, with a reliance on both public transit and personal vehicles for commuting.","Given the low disposable income, it is crucial to minimize additional financial burdens on residents. Therefore, lower transit fares and driving fees are prioritized to ensure affordability. A moderate sales tax is acceptable if it significantly improves transit services, as many residents rely on public transportation. Reducing travel times is also important to improve accessibility and quality of life. The selected policies balance these factors by offering lower fares and fees while maintaining or slightly increasing the sales tax to enhance transit services.","[0, 7, 10, 2, 6]",0,7,10,2,6
East Little York / Homestead,"East Little York / Homestead has a relatively low to moderate disposable income, with many residents relying on affordable transportation options.","The community has limited discretionary consumption, prioritizing essential goods and services over luxury items.","Public transit is a crucial mode of transportation for many residents, but current transit times are long, and accessibility to resources and services is limited.","Given the community's lower disposable income, affordability of transit fares and driver fees is crucial. Reducing transit times is also important to improve accessibility. A lower sales tax is preferred to minimize the impact on discretionary consumption. Therefore, proposals with lower fares and fees, and moderate improvements in transit times, are prioritized. Proposal 1 offers the lowest fare and fee with significant transit time reduction. Proposal 8 provides a balance of moderate fare and fee with good transit time improvement. Proposal 17 offers the lowest transit time with a reasonable fare and fee. Proposal 0 and 7 are chosen for their low fare and fee, with moderate transit time improvements.","[1, 8, 17, 0, 7]",1,8,17,0,7
Trinity / Houston Gardens,The Trinity / Houston Gardens neighborhood generally has a lower disposable income compared to other areas in Houston.,"Residents in this neighborhood have limited discretionary consumption due to lower income levels, prioritizing essential goods and services.","The neighborhood has moderate accessibility to resources and services, with a reliance on public transit due to lower car ownership rates.","Given the lower disposable income and limited discretionary spending, it is crucial to minimize additional financial burdens on residents. Therefore, proposals with lower transit fares and driving fees are preferred to ensure affordability. Additionally, improving transit times is important to enhance accessibility for residents who rely on public transportation. Balancing these factors, proposals with a moderate sales tax and lower fares and fees are prioritized to support better transit services without significantly impacting residents' financial stability.","[0, 7, 10, 2, 6]",0,7,10,2,6
East Houston,"East Houston has a moderate to low disposable income, with many residents working in blue-collar jobs.","Residents in East Houston have limited discretionary spending, prioritizing essential goods and services.","Public transit is crucial for East Houston, as many residents rely on it for commuting to work and accessing essential services.","Given the moderate to low disposable income, it is important to keep costs low for both transit and driving. However, improving transit times is also crucial as many residents rely on public transportation. A balance between lower fares and reasonable travel times is necessary. Proposals with lower fares and moderate driver fees are prioritized to encourage transit use while keeping costs manageable. A moderate sales tax is acceptable if it significantly improves transit services, as this can enhance accessibility and reduce travel times.","[7, 10, 2, 13, 19]",7,10,2,13,19
