community_area,disposable_income,discretionary_consumption,accessibility,decision_rationale,vote,rank1,rank2,rank3,rank4,rank5
Settegast,Settegast has a relatively low disposable income compared to other neighborhoods in Houston.,"Residents in Settegast have limited discretionary consumption due to lower income levels, prioritizing essential goods and services.","Settegast has limited access to public transportation, making car travel a necessity for many residents, though transit improvements could benefit those without cars.","Given the low disposable income in Settegast, policies with lower transit fares and driving fees are preferred to minimize financial burden. A moderate sales tax is acceptable if it significantly improves transit services, as better transit could provide more accessibility for residents without cars. The focus is on balancing cost savings with improved transit times to enhance accessibility without imposing high costs on residents.","[1, 7, 10, 2, 11]",1,7,10,2,11
Northside Village,"Northside Village has a relatively low to moderate disposable income, with many residents working in blue-collar jobs.","The community has limited discretionary consumption, with a significant portion of income spent on essentials like housing, food, and transportation.","Northside Village has moderate accessibility to resources and services, with a reliance on both public transit and personal vehicles for commuting and daily activities.","Given the lower disposable income, it is crucial to minimize additional financial burdens on residents. Therefore, proposals with lower transit fares and driving fees are prioritized. Additionally, reducing travel time is important to improve accessibility and quality of life. Balancing these factors, proposals with moderate sales tax rates are preferred to ensure adequate funding for transit improvements without overly burdening residents. The selected proposals aim to reduce travel time while keeping costs manageable for both transit users and drivers.","[1, 7, 10, 16, 19]",1,7,10,16,19
Kashmere Gardens,Kashmere Gardens has a relatively low average disposable income compared to other neighborhoods in Houston.,"Residents in Kashmere Gardens have limited discretionary spending, prioritizing essential goods and services.","The neighborhood has limited access to resources and services, with many residents relying on public transit due to lower car ownership rates.","Given the lower disposable income and reliance on public transit, it is crucial to prioritize policies that minimize costs for transit users while improving service efficiency. A lower transit fare and moderate driver fees can encourage more people to use public transit, reducing congestion and emissions. A moderate sales tax is acceptable if it significantly improves transit services, as long as it does not overly burden residents' limited discretionary spending. Therefore, the selected policies focus on balancing lower transit fares and reasonable driver fees with moderate sales taxes to enhance transit accessibility and affordability.","[1, 8, 17, 10, 19]",1,8,17,10,19
El Dorado / Oates Prairie,"El Dorado / Oates Prairie has a moderate disposable income, with many residents working in blue-collar jobs.","The community tends to prioritize essential spending, with limited discretionary consumption due to moderate income levels.","The area has limited public transit options, making car travel a necessity for many residents, though transit improvements could benefit those without cars.","Given the moderate disposable income, it's important to keep costs low for both transit users and drivers. A lower transit fare and driving fee are preferred to minimize the financial burden on residents. A moderate sales tax is acceptable if it significantly improves transit times, as this could benefit those who rely on public transportation. The top-ranked proposals balance these factors by offering reduced travel times and costs, while not overly increasing the sales tax burden.","[1, 8, 3, 10, 19]",1,8,3,10,19
Hunterwood,"Hunterwood has a moderate disposable income level, with many residents working in blue-collar and service jobs.","Residents in Hunterwood tend to prioritize essential spending, with limited discretionary consumption due to moderate income levels.","Hunterwood has limited public transit options, making car travel a necessity for many residents, though some rely on transit for cost savings.","Given the moderate disposable income and limited discretionary spending, policies with lower fares and fees are preferred to minimize financial strain. Accessibility improvements are crucial, so policies that reduce travel time and cost for both transit and driving are prioritized. A balance between tax rates and service improvements is necessary to ensure affordability while enhancing transit services. Therefore, options with lower fares and moderate driver fees, which also reduce travel times, are ranked higher.","[1, 8, 3, 10, 19]",1,8,3,10,19
Greater Fifth Ward,The Greater Fifth Ward has a relatively low average disposable income compared to other neighborhoods in Houston.,"Residents in the Greater Fifth Ward have limited discretionary consumption due to lower income levels, prioritizing essential goods and services.","The neighborhood has moderate accessibility to resources and services, with a significant portion of residents relying on public transit due to lower car ownership rates.","Given the lower disposable income and reliance on public transit, the Greater Fifth Ward would benefit from policies that reduce transit fares and improve transit service times. A lower sales tax is also preferable to minimize the impact on discretionary spending. Therefore, proposals with lower fares and moderate driver fees, which can improve transit times without significantly increasing costs, are prioritized. The top-ranked proposals balance these factors by offering reduced transit times and fares, while keeping the sales tax and driver fees at manageable levels.","[1, 8, 3, 10, 19]",1,8,3,10,19
Denver Harbor / Port Houston,Denver Harbor / Port Houston has a relatively low to moderate disposable income compared to other neighborhoods in Houston.,"Residents in this area have limited discretionary spending, focusing primarily on essential goods and services.","The neighborhood has moderate access to public transit, but many residents rely on driving due to the limited reach and frequency of transit services.","Given the lower disposable income, minimizing costs is crucial. A lower transit fare and driving fee are prioritized to reduce the financial burden on residents. A moderate sales tax is acceptable if it significantly improves transit services, as better transit can reduce reliance on cars, saving money in the long run. The selected policies aim to balance cost savings with improved transit efficiency, considering the community's reliance on both driving and public transit.","[7, 10, 2, 13, 19]",7,10,2,13,19
Pleasantville Area,Pleasantville Area has a relatively low disposable income compared to other neighborhoods in Houston.,"Residents in Pleasantville Area have limited discretionary consumption, focusing primarily on essential goods and services.","The neighborhood has moderate accessibility to resources and services, with a reliance on both public transit and personal vehicles.","Given the lower disposable income and limited discretionary spending, it is crucial to minimize additional financial burdens on residents. Therefore, proposals with lower transit fares and driving fees are preferred. Additionally, improving transit times is important to enhance accessibility. A balance between a reasonable sales tax and improved transit services is necessary to ensure affordability and accessibility. Proposals with a 0.5% sales tax and lower fares and fees are prioritized to minimize financial impact while slightly improving transit times.","[0, 2, 4, 6, 9]",0,2,4,6,9
Northshore,"Northshore has a moderate disposable income level, with many residents working in blue-collar and service jobs.","Residents in Northshore tend to have limited discretionary spending, focusing primarily on essential goods and services.","Northshore has moderate accessibility to resources and services, with a reliance on both public transit and personal vehicles for commuting and daily activities.","Given the moderate disposable income and limited discretionary spending, it is crucial to minimize additional financial burdens on residents. Therefore, lower transit fares and driving fees are prioritized to maintain affordability. Additionally, reducing travel times is important to improve accessibility and quality of life. The selected policies balance these factors by offering reduced travel times and costs, while also considering the impact of sales tax on overall consumption.","[1, 8, 3, 10, 19]",1,8,3,10,19
Clinton Park / Tri-Community,"Clinton Park / Tri-Community has a relatively low to moderate disposable income, with many residents working in blue-collar jobs.","The community has limited discretionary consumption, with a significant portion of income spent on essentials like housing, food, and transportation.","The neighborhood has moderate accessibility to resources and services, with a reliance on both public transit and personal vehicles for commuting and daily activities.","Given the community's limited disposable income, it is crucial to minimize additional financial burdens while improving transit services. Lower transit fares and moderate driver fees are preferred to encourage public transit use and reduce congestion. A lower sales tax is also favored to avoid significant impacts on discretionary spending. The selected policies aim to balance cost savings with improved transit efficiency, considering the community's reliance on both transit and driving.","[0, 7, 10, 2, 13]",0,7,10,2,13
Fourth Ward,The Fourth Ward has a mixed-income population with a significant portion of residents having moderate to low disposable income.,Residents in the Fourth Ward tend to have limited discretionary spending due to the cost of living and income levels.,"The Fourth Ward has moderate accessibility to resources and services, with a reliance on both public transit and personal vehicles for commuting.","Given the moderate to low disposable income, it is crucial to minimize additional financial burdens on residents. Therefore, lower transit fares and driving fees are prioritized to maintain affordability. A moderate sales tax is acceptable if it significantly improves transit services, as many residents rely on public transportation. Reducing travel times is also important to improve accessibility and quality of life. Balancing these factors, the selected policies aim to enhance transit efficiency while keeping costs manageable for residents.","[1, 8, 10, 19, 22]",1,8,10,19,22
Downtown,Downtown residents generally have a moderate to high disposable income due to a mix of professionals and business owners.,"The area has a high level of discretionary consumption with numerous dining, entertainment, and shopping options.","Downtown has excellent accessibility to resources and services, with robust public transit options and walkability, but also experiences significant traffic congestion.","Given the moderate to high disposable income, Downtown residents can afford slightly higher transit fares and driver fees if it results in better service and reduced congestion. The focus is on reducing travel time and improving transit service, as many residents rely on public transportation. A moderate sales tax is acceptable if it significantly enhances transit services. Therefore, proposals with a balance of moderate fares, driver fees, and sales tax, which also reduce travel times, are prioritized.","[11, 3, 19, 8, 17]",11,3,19,8,17
Midtown,"Midtown residents generally have a moderate to high disposable income, with a mix of young professionals and established residents.","The neighborhood has a vibrant lifestyle with a high level of discretionary consumption on dining, entertainment, and cultural activities.","Midtown has good accessibility to public transit options, with several bus and light rail lines, but also experiences significant traffic congestion for drivers.","Given the moderate to high disposable income, residents can afford a slight increase in transit fares and driver fees if it results in better transit services and reduced congestion. A lower sales tax is preferred to maintain discretionary spending. The focus is on reducing travel times and improving transit efficiency, which aligns with the neighborhood's reliance on both public transit and driving. Therefore, proposals with moderate fares and fees, and lower sales tax rates, that significantly reduce travel times are prioritized.","[1, 3, 8, 11, 17]",1,3,8,11,17
Second Ward,"The Second Ward has a relatively low to moderate disposable income, with many residents working in blue-collar jobs.","Discretionary consumption is limited, with residents prioritizing essential goods and services over luxury items.","The Second Ward has moderate accessibility to resources and services, with a reliance on both public transit and personal vehicles for commuting.","Given the lower disposable income, minimizing costs for both transit and driving is crucial. A lower transit fare and driving fee are preferred to reduce the financial burden on residents. Additionally, a moderate sales tax is acceptable if it significantly improves transit services, as many residents rely on public transportation. The goal is to balance affordability with improved transit efficiency, reducing travel times and enhancing accessibility.","[0, 7, 10, 1, 8]",0,7,10,1,8
Greater Eastwood,"Greater Eastwood has a moderate disposable income, with a mix of middle-income and lower-income households.","Residents in Greater Eastwood have limited discretionary spending, prioritizing essential goods and services.","The neighborhood has moderate access to public transit, with some reliance on personal vehicles for commuting and accessing services.","Given the moderate disposable income and limited discretionary spending, it is important to minimize additional financial burdens on residents. Lower transit fares and moderate driver fees are preferred to encourage public transit use while not overly penalizing drivers. A moderate sales tax is acceptable if it significantly improves transit services, as this can enhance accessibility and reduce travel times. The selected policies aim to balance cost savings for residents with improved transit efficiency and accessibility.","[7, 10, 13, 19, 22]",7,10,13,19,22
Harrisburg / Manchester,"Harrisburg / Manchester has a relatively low to moderate disposable income, with many residents working in industrial and service sectors.","The community has limited discretionary consumption, with a significant portion of income spent on essentials like housing, food, and transportation.","The area has moderate accessibility to resources and services, with public transit being a crucial mode of transportation for many residents due to lower car ownership rates.","Given the lower disposable income and reliance on public transit, policies with lower transit fares and moderate sales taxes are preferred to minimize financial burden. Reducing travel time is also important to improve accessibility and quality of life. Therefore, proposals with lower fares and moderate driver fees are prioritized to balance cost and service improvements. A moderate sales tax is acceptable if it significantly enhances transit services, as this can benefit the community by reducing travel times and improving accessibility.","[7, 10, 2, 13, 19]",7,10,2,13,19
Museum Park,Museum Park is a relatively affluent area with higher than average disposable income levels.,"Residents in Museum Park have a high level of discretionary consumption, often spending on cultural, dining, and recreational activities.","Museum Park has good accessibility to resources and services, with multiple transit options and proximity to major city attractions.","Given the higher disposable income and discretionary spending, residents can afford slightly higher transit fares and driver fees if it results in significantly improved transit services and reduced travel times. The focus is on reducing travel time and improving transit efficiency, as many residents rely on public transportation for commuting to cultural and recreational activities. A moderate sales tax is acceptable if it leads to better transit services, but the priority is on reducing travel times and improving service quality. Therefore, proposals with lower transit times and reasonable costs are prioritized.","[23, 20, 14, 11, 5]",23,20,14,11,5
Greater Third Ward,The Greater Third Ward has a relatively lower disposable income compared to other neighborhoods in Houston.,"Residents in the Greater Third Ward have limited discretionary consumption due to lower income levels, making cost-sensitive policies more favorable.","The neighborhood has moderate accessibility to resources and services, with a significant portion of residents relying on public transit.","Given the lower disposable income and reliance on public transit, policies with lower transit fares and moderate driver fees are prioritized to ensure affordability and improved transit services. A lower sales tax is preferred to minimize the impact on discretionary spending. The top-ranked policies balance reduced travel times and costs for both transit users and drivers, while also considering the potential for reduced congestion and emissions.","[1, 0, 7, 10, 3]",1,0,7,10,3
Greater OST / South Union,"The Greater OST / South Union neighborhood has a moderate to low disposable income, with many residents relying on affordable transportation options.","Discretionary consumption is limited, with residents prioritizing essential goods and services over luxury items.","The neighborhood has moderate accessibility to resources and services, with a significant portion of the population relying on public transit due to limited car ownership.","Given the moderate to low disposable income, it is crucial to prioritize policies that minimize costs for residents while improving transit efficiency. Lower transit fares and moderate driver fees are preferred to encourage public transit use and reduce congestion. A moderate sales tax is acceptable if it significantly enhances transit services. The selected policies balance affordability, improved transit times, and reasonable tax rates to support the community's needs.","[1, 8, 3, 10, 19]",1,8,3,10,19
Gulfgate Riverview / Pine Valley,"The disposable income in Gulfgate Riverview / Pine Valley is relatively moderate, with many residents working in blue-collar and service jobs.","Discretionary consumption is limited, with residents prioritizing essential expenses such as housing, food, and transportation.","The neighborhood has moderate accessibility to resources and services, with a reliance on both public transit and personal vehicles for commuting and daily activities.","Given the moderate disposable income and limited discretionary consumption, it is crucial to minimize additional financial burdens on residents. Therefore, lower transit fares and driving fees are preferred to keep transportation affordable. Additionally, improving transit times is important to enhance accessibility and reduce reliance on personal vehicles. Balancing these factors, proposals with lower fares and fees, and moderate sales tax rates that improve transit times without significantly increasing costs, are prioritized.","[1, 8, 3, 10, 19]",1,8,3,10,19
Pecan Park,"Pecan Park has a moderate to low disposable income, with many residents working in blue-collar jobs and relying on affordable transportation options.","Residents in Pecan Park prioritize essential spending, with limited discretionary income available for non-essential goods and services.","Pecan Park has moderate accessibility to resources and services, with many residents relying on public transit due to limited car ownership.","Given the moderate to low disposable income, it is crucial to keep transit fares and driving fees affordable to ensure accessibility. A lower sales tax is preferred to minimize the impact on discretionary spending. The focus is on improving transit times to make public transportation a more viable option, while also considering the potential benefits of reduced congestion and emissions. Therefore, proposals with lower fares and moderate driver fees, which also offer significant reductions in travel time, are prioritized.","[1, 8, 3, 10, 19]",1,8,3,10,19
Sunnyside,Sunnyside has a relatively low average disposable income compared to other Houston neighborhoods.,"Residents in Sunnyside have limited discretionary spending, focusing primarily on essential goods and services.","Sunnyside has moderate access to public transit, but many residents rely on personal vehicles due to limited transit options and longer travel times.","Given the lower disposable income in Sunnyside, minimizing costs for both transit and driving is crucial. A lower transit fare and driving fee are prioritized to ensure affordability. Additionally, reducing travel time is important to improve accessibility and convenience for residents. Therefore, proposals with lower fares and fees, along with reduced travel times, are ranked higher. The sales tax impact is also considered, but the immediate cost savings on fares and fees take precedence due to the community's financial constraints.","[0, 7, 2, 10, 1]",0,7,2,10,1
South Park,South Park has a relatively low average disposable income compared to other neighborhoods in Houston.,"Residents in South Park have limited discretionary spending, focusing primarily on essential goods and services.","South Park has moderate access to public transit, but many residents rely on personal vehicles due to limited transit options and longer travel times.","Given the lower disposable income in South Park, minimizing costs for both transit and driving is crucial. A lower transit fare and driving fee would benefit residents who rely on both modes of transportation. Additionally, a lower sales tax would help preserve residents' limited discretionary income. Therefore, proposals with lower fares, fees, and taxes are prioritized. However, improving transit times is also important to enhance accessibility, so proposals that offer better transit times without significantly increasing costs are favored.","[0, 7, 2, 10, 1]",0,7,2,10,1
Golfcrest / Bellfort / Reveille,"The Golfcrest / Bellfort / Reveille neighborhood has a moderate to low disposable income, with many residents working in blue-collar jobs.","Residents in this area have limited discretionary spending, focusing primarily on essential goods and services.","The neighborhood has moderate accessibility to public transit, but many residents rely on personal vehicles due to the spread-out nature of resources and services.","Given the moderate to low disposable income, it is crucial to minimize additional financial burdens on residents. Therefore, lower transit fares and driving fees are preferred to maintain affordability. A moderate sales tax is acceptable if it significantly improves transit services, as this could reduce reliance on personal vehicles and lower overall transportation costs. The top-ranked proposals balance these considerations by offering reduced travel times and costs, while not overly increasing the sales tax burden.","[1, 7, 10, 2, 19]",1,7,10,2,19
Park Place,"Park Place has a moderate disposable income level, with many residents working in blue-collar and service jobs.","Residents in Park Place tend to have limited discretionary spending, focusing on essential goods and services.","Park Place has moderate accessibility to public transit, but many residents rely on personal vehicles for commuting due to limited transit options.","Given the moderate disposable income and limited discretionary spending, it is important to minimize additional financial burdens on residents. Lower transit fares and driving fees are preferred to keep transportation affordable. A moderate sales tax is acceptable if it significantly improves transit services, as this could reduce reliance on personal vehicles and improve accessibility. The selected policies balance affordability with improved transit times, aiming to enhance overall accessibility without imposing excessive costs on residents.","[7, 10, 2, 19, 13]",7,10,2,19,13
Meadowbrook / Allendale,"The Meadowbrook / Allendale neighborhood has a moderate disposable income, with many residents working in blue-collar and service jobs.","Residents in this area tend to have limited discretionary spending, focusing primarily on essential goods and services.","The neighborhood has moderate access to public transit, but many residents rely on personal vehicles due to the spread-out nature of resources and services.","Given the moderate disposable income and limited discretionary spending, it is crucial to minimize additional financial burdens on residents. Lower transit fares and driving fees are preferred to keep transportation affordable. A moderate sales tax is acceptable if it significantly improves transit services, as this could reduce reliance on personal vehicles and improve accessibility. The top-ranked proposals balance lower costs with improved transit times, considering the neighborhood's reliance on both transit and driving.","[1, 7, 10, 3, 19]",1,7,10,3,19
