community_area,disposable_income,discretionary_consumption,accessibility,decision_rationale,vote,rank1,rank2,rank3,rank4,rank5
Willowbrook,"Willowbrook has a moderate disposable income level, with residents having some flexibility in their spending but still being sensitive to significant increases in costs.","Residents in Willowbrook tend to have moderate discretionary consumption, with a focus on essential goods and services, and some spending on leisure and non-essential items.","Willowbrook has decent accessibility to resources and services, with a reliance on both driving and public transit, though transit times are currently longer than driving times.","Given the moderate disposable income and discretionary consumption, the community would benefit from policies that balance cost savings with improved transit services. Lower fares and moderate driver fees can encourage transit use without significantly impacting disposable income. A moderate sales tax is acceptable if it leads to better transit services, as long as it doesn't overly burden residents. The focus is on reducing travel times and costs for both transit and driving, while ensuring that the community's financial burden remains manageable.","[1, 8, 3, 10, 19]",1,8,3,10,19
Greater Greenspoint,"Greater Greenspoint has a relatively lower disposable income compared to other Houston neighborhoods, with many residents working in service and retail sectors.","Residents in Greater Greenspoint have limited discretionary consumption, focusing primarily on essential goods and services.","The neighborhood has moderate accessibility to resources and services, with a significant portion of the population relying on public transit due to lower car ownership rates.","Given the lower disposable income and reliance on public transit, the community would benefit from lower transit fares and minimal increases in sales tax. Reducing travel time is also important to improve access to employment opportunities. Therefore, proposals with lower fares and moderate driver fees, which can improve transit services and reduce congestion, are prioritized. A balance between tax rates and fare/fee structures is crucial to ensure affordability while enhancing transit efficiency.","[1, 7, 10, 2, 8]",1,7,10,2,8
Carverdale,"Carverdale has a moderate disposable income level, with many residents working in blue-collar and service jobs.","Residents in Carverdale have limited discretionary spending, focusing primarily on essential goods and services.","Carverdale has moderate accessibility to resources and services, with a reliance on both public transit and personal vehicles for commuting.","Given Carverdale's moderate disposable income and limited discretionary spending, it is crucial to minimize additional financial burdens while improving transit efficiency. Lower transit fares and moderate driver fees are preferred to encourage public transit use without significantly impacting residents' budgets. A moderate sales tax is acceptable if it results in noticeable improvements in transit service. The selected policies aim to balance cost savings with improved transit times, benefiting both transit users and drivers by reducing congestion and emissions.","[1, 8, 10, 19, 22]",1,8,10,19,22
Fairbanks / Northwest Crossing,"The Fairbanks / Northwest Crossing neighborhood has a moderate level of disposable income, with many residents working in middle-income jobs.","Residents in this area have a balanced discretionary consumption pattern, spending on essentials and some non-essential goods and services.","The neighborhood has moderate accessibility to resources and services, with a reliance on both personal vehicles and public transit for commuting and daily activities.","Given the moderate disposable income, it is important to keep costs low for both transit and driving to avoid burdening residents financially. A lower transit fare and moderate driver fee can encourage transit use, reducing congestion and emissions. A moderate sales tax is acceptable if it significantly improves transit services. The selected policies aim to balance cost, travel time, and service improvement, prioritizing affordability and accessibility.","[1, 8, 10, 19, 22]",1,8,10,19,22
Greater Inwood,"Greater Inwood has a moderate level of disposable income, with a mix of middle-income households and some lower-income residents.","Residents in Greater Inwood have moderate discretionary spending, with a focus on essential goods and services, and some capacity for leisure and non-essential spending.","The neighborhood has moderate accessibility to resources and services, with a reliance on both personal vehicles and public transit, though transit times are currently longer than driving times.","Given the moderate disposable income, it is important to balance the cost of transit fares and driving fees with the benefits of reduced travel times and improved transit services. Lower fares and fees are preferred to minimize the financial burden on residents, while moderate sales tax rates are acceptable if they significantly improve transit efficiency. The goal is to enhance transit accessibility and reduce travel times without imposing excessive costs on residents.","[1, 8, 3, 10, 19]",1,8,3,10,19
Acres Home,"Acres Home has a relatively low median household income compared to other Houston neighborhoods, indicating limited disposable income.","Residents in Acres Home have limited discretionary spending, prioritizing essential goods and services.","Acres Home has moderate access to public transit, but many residents rely on personal vehicles due to limited transit options and longer travel times.","Given the limited disposable income and reliance on personal vehicles, the community would benefit from policies that reduce transit fares and driving fees while maintaining or slightly increasing the sales tax to improve transit services. Lower fares and fees would make transit more affordable and encourage a shift from driving, reducing congestion and emissions. The selected policies balance affordability with improved transit times, considering the community's financial constraints and need for better transit access.","[0, 7, 10, 16, 19]",0,7,10,16,19
Hidden Valley,"Hidden Valley has a moderate to low disposable income, with many residents working in blue-collar jobs.","Residents in Hidden Valley have limited discretionary spending, focusing primarily on essential goods and services.","The neighborhood has moderate access to public transit, but many residents rely on personal vehicles due to the spread-out nature of resources and services.","Given the moderate to low disposable income, it is crucial to minimize additional financial burdens on residents. Therefore, lower transit fares and driving fees are preferred to maintain affordability. A moderate sales tax is acceptable if it significantly improves transit services, as better transit can reduce reliance on personal vehicles and lower overall transportation costs. The selected policies aim to balance affordability with improved transit efficiency, considering the community's reliance on both transit and personal vehicles.","[7, 10, 2, 13, 19]",7,10,2,13,19
Westbranch,"Westbranch has a moderate level of disposable income, with residents generally able to afford basic necessities but being cautious about additional expenses.","Residents in Westbranch tend to prioritize essential spending, with limited discretionary consumption due to budget constraints.","Westbranch has moderate accessibility to resources and services, with a reliance on both driving and public transit, though transit times are currently longer.","Given the moderate disposable income, it is important to balance costs with improved transit services. Lower fares and moderate driver fees are preferred to encourage transit use without overly burdening drivers. A moderate sales tax is acceptable if it significantly improves transit times. The top choices prioritize reducing transit times and maintaining affordability for both transit users and drivers, while also considering the potential for reduced congestion and emissions.","[1, 8, 3, 10, 19]",1,8,3,10,19
Addicks / Park Ten,"The Addicks / Park Ten neighborhood has a moderate to high disposable income, with many residents employed in the energy sector and related industries.","Residents in this area have a relatively high level of discretionary consumption, often spending on housing, dining, and leisure activities.","The neighborhood has moderate accessibility to resources and services, with a reliance on both personal vehicles and transit options for commuting and daily activities.","Given the moderate to high disposable income, the community can handle a slight increase in sales tax or transit fare if it results in significantly improved transit services. The neighborhood's reliance on both driving and transit means that reducing travel times for both modes is important. Proposals that balance lower transit fares with moderate driver fees and sales taxes are preferred, as they encourage transit use while not overly burdening drivers. The top-ranked proposals prioritize reducing travel times and costs for transit users, as this can lead to a shift from driving to transit, reducing congestion and emissions.","[1, 8, 3, 11, 19]",1,8,3,11,19
Spring Branch West,"Spring Branch West has a moderate level of disposable income, with a mix of middle-income and working-class families.","Residents in Spring Branch West have moderate discretionary spending, balancing essential expenses with some leisure and non-essential purchases.","The area has decent access to public transit, but many residents rely on driving due to the spread-out nature of services and employment centers.","Given the moderate disposable income, it's important to keep costs low for both transit users and drivers. A lower fare and moderate driver fee can encourage transit use without overly burdening drivers. A moderate sales tax is acceptable if it significantly improves transit times, as this can benefit both transit users and drivers by reducing congestion. The top-ranked proposals balance these factors by offering reduced travel times and costs, while maintaining a reasonable tax rate to support transit improvements.","[1, 8, 3, 10, 19]",1,8,3,10,19
Langwood,Langwood is a working-class neighborhood with relatively low to moderate disposable income levels.,"Residents in Langwood have limited discretionary spending, focusing primarily on essential goods and services.","Langwood has moderate access to public transit, but many residents rely on driving due to the limited reach and frequency of transit services.","Given the limited disposable income, it is crucial to minimize additional financial burdens on residents. Therefore, lower transit fares and driving fees are preferred to maintain affordability. A moderate sales tax is acceptable if it significantly improves transit services, as better transit can reduce reliance on driving, lower congestion, and improve accessibility. The top-ranked proposals balance these factors by offering reduced travel times and costs, while not imposing high taxes or fees that would strain residents' budgets.","[1, 7, 10, 2, 11]",1,7,10,2,11
Central Northwest,"The Central Northwest neighborhood has a moderate disposable income, with a mix of middle-income and lower-income households.","Residents in Central Northwest have moderate discretionary spending, with a focus on essential goods and services, and limited luxury spending.","The neighborhood has moderate accessibility to resources and services, with some reliance on public transit and personal vehicles for commuting and daily activities.","Given the moderate disposable income and discretionary consumption, it is important to balance affordability with improved transit services. Lower fares and moderate driver fees are preferred to encourage transit use without significantly impacting disposable income. A moderate sales tax is acceptable if it results in better transit services, as this can improve accessibility and reduce travel times. The selected policies prioritize reduced travel times and costs for both transit and driving, while considering the financial impact on residents.","[8, 11, 10, 19, 22]",8,11,10,19,22
Independence Heights,"Independence Heights has a relatively low to moderate disposable income, with many residents working in service and blue-collar jobs.","The community prioritizes essential spending, with limited discretionary income for non-essential goods and services.","Public transit is a crucial mode of transportation for many residents, but current transit times are long, and car ownership is lower than in other neighborhoods.","Given the lower disposable income, minimizing costs for both transit and driving is important. A lower transit fare and driving fee are prioritized to ensure affordability. The community would benefit from improved transit times, so proposals that reduce travel time are favored. A moderate sales tax is acceptable if it significantly improves transit services, as many residents rely on public transportation. The selected proposals balance affordability with improved transit efficiency, considering the community's reliance on public transit and limited discretionary income.","[1, 8, 3, 10, 19]",1,8,3,10,19
Lazybrook / Timbergrove,Lazybrook / Timbergrove is a middle to upper-middle-income neighborhood with relatively high disposable income levels.,"Residents in Lazybrook / Timbergrove have moderate to high discretionary consumption, often spending on dining, leisure, and home improvements.","The neighborhood has good accessibility to resources and services, with a mix of transit options and a high rate of car ownership.","Given the higher disposable income, residents can afford moderate increases in transit fares and driving fees if it results in better services and reduced travel times. A lower sales tax is preferred to maintain discretionary spending. The focus is on reducing travel times for both transit and driving, while keeping costs reasonable. Proposals with a balance of lower fares and fees, and moderate sales tax, which improve transit times significantly, are prioritized.","[1, 3, 8, 11, 19]",1,3,8,11,19
Greater Heights,Greater Heights is a relatively affluent area with a higher than average disposable income compared to other Houston neighborhoods.,"Residents in Greater Heights tend to have higher discretionary spending on dining, entertainment, and retail, reflecting their higher disposable income.","The neighborhood has good accessibility to resources and services, with a mix of transit options and a high rate of car ownership, but transit times are longer compared to driving.","Given the higher disposable income, residents can afford a moderate increase in sales tax and transit fares if it results in significantly improved transit services. The focus is on reducing transit times to make it a more viable option compared to driving, which is currently faster. A moderate driver fee is acceptable if it leads to reduced congestion and emissions. Therefore, proposals with a balance of moderate sales tax, reasonable transit fare, and a driver fee that significantly reduces transit time are prioritized.","[11, 3, 19, 13, 5]",11,3,19,13,5
Memorial,Memorial is a relatively affluent area with higher than average disposable income levels.,"Residents in Memorial have significant discretionary spending, often on luxury goods and services.","The area has good accessibility by car, but public transit options are less developed, leading to longer transit times.","Given the higher disposable income, residents can afford slightly higher fares and fees if it results in better services. However, the community values time efficiency, so reducing travel time is a priority. A moderate sales tax is acceptable if it significantly improves transit services. The focus is on reducing transit times and improving service quality, while balancing costs to avoid excessive burden on residents.","[1, 3, 11, 17, 20]",1,3,11,17,20
Eldridge / West Oaks,Eldridge / West Oaks is a relatively affluent area with a higher than average disposable income.,"Residents in Eldridge / West Oaks have a high level of discretionary consumption, often spending on luxury goods, dining, and entertainment.","The area has moderate accessibility to resources and services, with a reliance on personal vehicles due to limited public transit options.","Given the higher disposable income, residents can afford moderate increases in transit fares and driving fees if it results in significantly improved transit services and reduced travel times. A lower sales tax is preferred to maintain discretionary spending. The focus is on reducing travel times for both driving and transit, as well as improving transit service quality to encourage a shift from driving to transit, which could alleviate congestion and reduce emissions. Therefore, proposals with moderate fares and fees, and lower sales tax rates, that offer significant reductions in travel times are prioritized.","[1, 3, 5, 8, 11]",1,3,5,8,11
Briar Forest,"Briar Forest is a middle to upper-middle-income neighborhood, with residents having a moderate to high level of disposable income.","Residents in Briar Forest have a relatively high level of discretionary consumption, often spending on leisure, dining, and other non-essential goods and services.","Briar Forest has moderate accessibility to resources and services, with a reliance on both personal vehicles and public transit, though transit options are less frequent and slower compared to driving.","Given the moderate to high disposable income, residents can afford a slight increase in transit fares and driver fees if it results in significantly improved transit services and reduced travel times. The community values efficient transportation, so proposals that reduce travel time for both driving and transit are prioritized. A moderate sales tax is acceptable if it leads to better transit services, but a high sales tax would be less favorable due to its impact on discretionary spending. Therefore, proposals with a balance of moderate costs and significant improvements in travel times are ranked higher.","[1, 3, 8, 11, 19]",1,3,8,11,19
Westchase,"Westchase is a mixed-income area with a significant portion of middle-income residents, providing moderate disposable income levels.","Residents in Westchase have a balanced discretionary consumption pattern, with spending on housing, dining, and entertainment being significant.","Westchase has good accessibility to resources and services, with a well-connected road network and moderate public transit options.","Given the moderate disposable income, it is important to balance costs with benefits. Lower transit fares and moderate driver fees are preferred to encourage public transit use without overly burdening drivers. A moderate sales tax is acceptable if it significantly improves transit services. Reducing travel times is also a priority to enhance accessibility. Therefore, proposals with lower fares, moderate driver fees, and reasonable travel times are prioritized.","[1, 8, 3, 10, 19]",1,8,3,10,19
Mid-West (formerly Woodlake/Briarmeadow),"The Mid-West neighborhood has a moderate to high disposable income, with many residents employed in professional sectors.","Residents in this area have a relatively high level of discretionary consumption, often spending on dining, entertainment, and retail.","The neighborhood has good accessibility to resources and services, with a mix of transit options and a high rate of car ownership.","Given the moderate to high disposable income, residents can afford a slight increase in transit fares and driver fees if it results in better services and reduced travel times. A lower sales tax is preferred to maintain discretionary spending. The focus is on reducing travel times for both transit and driving, as well as improving transit services to encourage a shift from driving to transit, which can reduce congestion and emissions. Therefore, proposals with moderate fares and fees, and lower sales tax rates, that offer significant reductions in travel times are prioritized.","[1, 3, 8, 11, 19]",1,3,8,11,19
Greater Uptown,Greater Uptown is a relatively affluent area with higher than average disposable income levels.,"Residents in Greater Uptown have a high level of discretionary consumption, often spending on luxury goods, dining, and entertainment.","The area has good accessibility with a mix of transit options and a high rate of car ownership, but traffic congestion can be an issue.","Given the higher disposable income, residents can afford slightly higher transit fares and driver fees if it results in significantly improved transit services and reduced congestion. A moderate sales tax is acceptable if it enhances transit infrastructure. The focus is on reducing travel time and improving service quality, as residents value time efficiency. Therefore, proposals with a balance of moderate taxes, reasonable fares, and driver fees that lead to reduced travel times are prioritized.","[17, 20, 23, 8, 11]",17,20,23,8,11
Washington Avenue Coalition / Memorial Park,The Washington Avenue Coalition / Memorial Park area generally has a higher disposable income compared to other neighborhoods in Houston.,"Residents in this area tend to have higher discretionary spending, often on dining, entertainment, and leisure activities.","The neighborhood has good accessibility to resources and services, with a mix of transit options and a high rate of car ownership.","Given the higher disposable income and discretionary spending, residents can afford slightly higher transit fares and driver fees if it results in significantly improved transit services and reduced travel times. The focus is on balancing the cost of transit and driving with the benefits of reduced travel times and improved service. Proposals with moderate sales tax rates are preferred to avoid excessive impact on discretionary spending. The top-ranked proposals offer a good balance of reduced travel times for both transit and driving, with reasonable costs.","[1, 3, 8, 11, 19]",1,3,8,11,19
Afton Oaks / River Oaks,Afton Oaks / River Oaks is a relatively affluent neighborhood with a high average disposable income.,"Residents in this area have a high level of discretionary consumption, often spending on luxury goods and services.","The neighborhood has good accessibility to resources and services, with a high rate of car ownership and less reliance on public transit.","Given the high disposable income and discretionary spending, the community can absorb higher costs if it results in significant benefits. The focus is on reducing travel time and improving transit services, even if it means higher fares and fees. A lower sales tax is preferred to maintain discretionary spending. Therefore, proposals with moderate to high driver fees and fares, but lower sales tax, are prioritized to enhance transit services and reduce congestion, aligning with the community's ability to pay for improved services.","[1, 3, 5, 8, 11]",1,3,5,8,11
Neartown / Montrose,Neartown / Montrose is a relatively affluent area with a higher-than-average disposable income compared to other Houston neighborhoods.,"Residents in Neartown / Montrose tend to have higher discretionary spending on dining, entertainment, and cultural activities.","The neighborhood has good accessibility to resources and services, with a mix of transit options and walkable areas, but still relies significantly on car travel.","Given the higher disposable income, residents can afford a moderate increase in transit fares and driver fees if it results in better services and reduced travel times. A lower sales tax is preferred to maintain discretionary spending. The focus is on reducing travel times for both transit and driving, as well as improving transit services to encourage a shift from driving to transit, which aligns with the neighborhood's environmental consciousness and desire for efficient transportation.","[1, 3, 8, 11, 17]",1,3,8,11,17
Alief,"Alief is a diverse community with a moderate to low average disposable income, where many residents are budget-conscious.","Residents in Alief prioritize essential spending, with limited discretionary consumption due to budget constraints.","Alief has moderate access to public transit, but many residents rely on personal vehicles due to the spread-out nature of the area and limited transit options.","Given the moderate to low disposable income in Alief, policies with lower transit fares and driving fees are preferred to minimize the financial burden on residents. A lower sales tax is also favored to preserve disposable income for essential goods. Improved transit times are beneficial, but not at the expense of significantly higher costs. Therefore, proposals that balance reduced travel times with minimal cost increases are prioritized. The top choices reflect a preference for lower fares and fees, with moderate improvements in transit times, while maintaining a reasonable sales tax rate.","[0, 7, 2, 10, 1]",0,7,2,10,1
