community_area,disposable_income,discretionary_consumption,accessibility,decision_rationale,vote,rank1,rank2,rank3,rank4,rank5
South Acres / Crestmont Park,"The South Acres / Crestmont Park neighborhood has a moderate to low disposable income, with many residents relying on affordable transportation options.","Residents in this area have limited discretionary spending, prioritizing essential goods and services over luxury items.","The neighborhood has moderate accessibility to resources and services, with a reliance on both public transit and personal vehicles for commuting and daily activities.","Given the moderate to low disposable income, it is crucial to keep transportation costs affordable while improving transit efficiency. Lower fares and moderate driver fees are preferred to encourage transit use and reduce congestion. A balanced sales tax is necessary to support transit improvements without overly burdening residents' consumption. The selected policies aim to reduce travel time and costs for both transit users and drivers, enhancing overall accessibility and quality of life.","[1, 8, 3, 10, 19]",1,8,3,10,19
Minnetex,"Minnetex is a lower-income neighborhood, with many residents having limited disposable income.","Residents in Minnetex prioritize essential spending, with limited room for discretionary consumption.","Public transit options are limited, and many residents rely on personal vehicles for commuting, though transit improvements could benefit those without cars.","Given the limited disposable income, policies with lower fares and fees are preferred to minimize financial burden. However, improving transit accessibility is crucial for those without cars. Balancing these needs, proposals with moderate taxes and fees that significantly reduce travel times are prioritized. The top choices aim to enhance transit services while keeping costs manageable for residents.","[1, 8, 3, 11, 19]",1,8,3,11,19
Greater Hobby Area,"The Greater Hobby Area has a moderate level of disposable income, with many residents working in blue-collar and service jobs.","Residents in the Greater Hobby Area tend to have limited discretionary spending, focusing primarily on essential goods and services.","The area has moderate accessibility to resources and services, with a reliance on both public transit and personal vehicles for commuting and daily activities.","Given the moderate disposable income and limited discretionary spending, it is important to minimize additional financial burdens on residents. Therefore, lower transit fares and driving fees are preferred to keep transportation affordable. Additionally, reducing travel times is crucial to improve accessibility and quality of life. Balancing these factors, proposals with lower fares and fees, and moderate sales tax rates that still improve transit times, are prioritized. The selected proposals aim to enhance transit services while keeping costs manageable for residents.","[1, 7, 10, 16, 19]",1,7,10,16,19
Edgebrook,"Edgebrook has a moderate disposable income level, with many residents working in blue-collar and service jobs.","Residents in Edgebrook tend to have limited discretionary spending, focusing on essential goods and services.","Edgebrook has moderate accessibility to resources and services, with a reliance on both public transit and personal vehicles for commuting.","Given the moderate disposable income and limited discretionary spending, it is important to minimize additional financial burdens on residents. Therefore, lower transit fares and driving fees are preferred to keep transportation affordable. Additionally, reducing travel times is crucial to improve accessibility and quality of life. Balancing these factors, proposals with lower fares and fees, and moderate sales tax rates that still improve transit times, are prioritized. The selected proposals aim to enhance transit service without significantly increasing costs for residents.","[1, 7, 10, 16, 19]",1,7,10,16,19
South Belt / Ellington,"The South Belt / Ellington neighborhood has a moderate level of disposable income, with many residents working in middle-income jobs.","Residents in this area have a balanced discretionary consumption pattern, spending on essentials and some non-essential goods and services.","The neighborhood has moderate accessibility to resources and services, with a reliance on both personal vehicles and public transit for commuting and daily activities.","Given the moderate disposable income, it is important to keep costs low for both transit and driving to avoid burdening residents financially. A lower transit fare and driving fee are preferred to maintain affordability. The sales tax should be moderate to ensure sufficient funding for transit improvements without significantly impacting discretionary spending. Reducing travel times for both transit and driving is also a priority to improve accessibility and convenience. Therefore, proposals with lower fares and fees, moderate sales tax, and reduced travel times are prioritized.","[1, 8, 3, 10, 19]",1,8,3,10,19
Clear Lake,Clear Lake is a relatively affluent area with a higher than average disposable income compared to other Houston neighborhoods.,"Residents in Clear Lake have a higher level of discretionary consumption, often spending on leisure, dining, and recreational activities.","Clear Lake has moderate accessibility to resources and services, with a reliance on both personal vehicles and transit options, though transit times are currently longer.","Given the higher disposable income, residents can absorb moderate increases in transit fares and driving fees if it results in significantly improved transit times. A lower sales tax is preferred to maintain discretionary spending. The focus is on reducing transit times to make public transportation a more viable option, thus reducing congestion and emissions. Proposals with a balance of moderate fare and fee increases, coupled with reduced travel times, are prioritized.","[1, 3, 8, 11, 17]",1,3,8,11,17
Magnolia Park,"Magnolia Park has a relatively low disposable income compared to other neighborhoods in Houston, with many residents working in blue-collar jobs.","Residents in Magnolia Park have limited discretionary spending, prioritizing essential goods and services over luxury items.","The neighborhood has moderate access to public transit, but many residents rely on personal vehicles due to the limited reach and frequency of transit services.","Given the low disposable income, it is crucial to minimize additional financial burdens on residents. Therefore, lower transit fares and driving fees are preferred to keep transportation affordable. A moderate sales tax is acceptable if it significantly improves transit services, as better transit can reduce reliance on personal vehicles and lower overall transportation costs. The selected policies aim to balance affordability with improved transit efficiency, considering the neighborhood's reliance on both transit and personal vehicles.","[7, 10, 2, 13, 19]",7,10,2,13,19
MacGregor,"MacGregor has a moderate level of disposable income, with a mix of middle-income and some lower-income households.","Residents in MacGregor have moderate discretionary spending, with a focus on essential goods and services, and some spending on leisure and non-essential items.","MacGregor has decent access to public transit, but improvements in transit times and reliability could significantly benefit the community, especially for those without personal vehicles.","Given the moderate disposable income, it is important to balance costs with benefits. Lower transit fares and moderate driver fees are preferred to encourage transit use and reduce congestion. A moderate sales tax is acceptable if it significantly improves transit services. The focus is on reducing travel times and costs for both transit users and drivers, while ensuring that the financial burden is not too high for residents. Proposals with lower fares and moderate driver fees are prioritized to enhance accessibility and affordability.","[1, 8, 3, 10, 19]",1,8,3,10,19
Spring Branch North,"Spring Branch North has a moderate disposable income level, with a mix of middle-income and lower-income households.","The community has a moderate level of discretionary consumption, with residents spending on essentials and some non-essential goods and services.","Spring Branch North has moderate accessibility to resources and services, with a reliance on both personal vehicles and public transit for commuting and daily activities.","Given the moderate disposable income, it is important to balance the cost of transit fares and driving fees with the benefits of reduced travel times and improved transit services. Lower fares and fees are preferred to minimize the financial burden on residents. A moderate sales tax is acceptable if it significantly improves transit services, as many residents rely on public transportation. The top-ranked proposals prioritize lower fares and fees while considering the impact of sales tax on overall consumption. Proposals that offer significant reductions in travel time are also prioritized to enhance accessibility and convenience for residents.","[7, 10, 2, 19, 13]",7,10,2,19,13
Spring Branch Central,"Spring Branch Central has a moderate level of disposable income, with a mix of middle-income and lower-income households.","The community has a balanced discretionary consumption pattern, with residents spending on essentials and some non-essential goods and services.","Spring Branch Central has moderate accessibility to resources and services, with a reliance on both public transit and personal vehicles for commuting and daily activities.","Given the moderate disposable income, it is important to keep costs low for both transit users and drivers. A lower transit fare and moderate driver fee can encourage public transit use, reducing congestion and emissions. A moderate sales tax is acceptable if it significantly improves transit services. The top-ranked proposals balance these factors by offering reduced travel times and costs, while ensuring the community can still afford other essential goods and services.","[1, 8, 3, 10, 19]",1,8,3,10,19
Spring Branch East,"Spring Branch East has a moderate level of disposable income, with a mix of middle-income families and some lower-income households.","The neighborhood has a diverse range of discretionary consumption patterns, with residents spending on essentials and some luxury goods, but generally being price-sensitive.","Spring Branch East has moderate accessibility to resources and services, with some reliance on both public transit and personal vehicles for commuting and daily activities.","Given the moderate disposable income, it is important to balance the cost of transit fares and driving fees with the benefits of reduced travel times and improved transit services. Lower fares and fees are preferred to minimize the financial burden on residents, while moderate sales tax rates are acceptable if they significantly improve transit efficiency. The top-ranked proposals prioritize lower fares and fees with reasonable travel time reductions, ensuring affordability and accessibility for the community.","[1, 7, 10, 16, 19]",1,7,10,16,19
Greenway / Upper Kirby,Greenway / Upper Kirby is a relatively affluent area with higher than average disposable income.,"Residents in this neighborhood have a high level of discretionary consumption, often spending on dining, entertainment, and luxury goods.","The area has good accessibility to resources and services, with a mix of transit options and a high rate of car ownership.","Given the higher disposable income, residents can afford a moderate increase in sales tax and transit fares if it results in significantly improved transit services. The neighborhood's high car ownership means that driver fees should be considered carefully to avoid excessive burden. The focus is on reducing travel times and improving transit efficiency, while maintaining a balance between cost and service improvement. Proposals with moderate sales tax and driver fees, combined with reduced travel times, are prioritized to enhance overall accessibility and convenience.","[17, 20, 8, 11, 19]",17,20,8,11,19
Lawndale / Wayside,"The Lawndale / Wayside neighborhood has a moderate to low disposable income, with many residents working in blue-collar jobs.","Residents in this area have limited discretionary spending, prioritizing essential goods and services over luxury items.","The neighborhood has moderate access to public transit, but many residents rely on personal vehicles due to the spread-out nature of resources and services.","Given the moderate to low disposable income, it is crucial to minimize additional financial burdens on residents. Therefore, lower transit fares and driving fees are preferred to maintain affordability. A moderate sales tax is acceptable if it significantly improves transit services, as this could reduce reliance on personal vehicles and lower overall transportation costs. The top-ranked proposals balance these factors by offering reduced travel times and costs, while not imposing high taxes or fees that would strain residents' budgets.","[1, 8, 3, 10, 19]",1,8,3,10,19
